number,contents
191186,[ 1 ] 도시 계획 시설물 ㄴ 건축 허가 건폐율 산정 기준 되 대지 범위 < br / > [ 2 ] 도시 계획 사업 시행자 건축 허가 되 ㄴ 대상 토지 중 일부 ㄴ 소유권 내지 사용권 취득 하 지 못하 ㄴ 건축 허가 취소 하 ㄹ 있 는지 ( ) < br / > [ 3 ] 법규 해석 그르치 어 위법 하 ㄴ 행정 처분 하 ㄴ 행정청 귀책 사유 유무 < br / > 
212287,"[ 1 ] 신고 납세 방식 조세 ㄴ 취득세 등록 세 있 어서 납세 무 자의 신고 행위 하자 중대 하 고 명백 하 여 당연 무효 하 는지 기준 신고 납부 하 ㄴ 세금 부당 이득 되 기 위하 ㄴ < br / > [ 2 ] 토지 취득 하 여 등기 하 면서 착오 등록 세 취득세 정당 하 게 납부 하 였 세금 보다 4 배 내지 55 배 달하 세액 신고 납부 하 여 토지 취득 가액 보다 더 많 게 되 ㄴ , ㄴ 이의 신청 이나 심사 행정 통하 ㄴ 구제 수단 전혀 없 점 등 비추 어 신고 납부 행위 하자 중대 하 고 명백 하 여 무효 라고 보 것 정의 · 공평 이념 국민 재산권 보호 측면 타당 하 다고 하 ㄴ < br / > "
101920,아 . 자백 배치 되 사실 하 였 다는 것 권리 상고 이유 되 는지 < br / > 나 아 . 공동 참가 < br / > 
136483,"취득 시효 원용 하 지 않 것 같 태도 보이 어 등기 명의자 같 신뢰 하 게 하 ㄴ 자가 점유 취득 시효 완성 원인 소유권 이전 등기 하 것 , 신의칙 반하 여 허용 되 지 않 는다고 보 ㄹ 여지 있 다고 하 ㄴ < br / > "
116950,체납 처분 의하 ㄴ 재산 압류 이전 납세 의무 자로 부터 저 3 자로 이전 되 ㄴ 재산 ㄴ 국세 채권 추급권 유무 ( ) < br / > 
199716,부동산 취득 시효 하 기 위하 ㄴ 으로서 자주 점유 < br / > 
221715,"[ 1 ] 종교 단체 비 법인 사단 으로서 실체 갖추 었 는지 ㄴ 기준 < br / > [ 2 ] ○○ 교 △△ 제단 교 주인 대표자 허황 되 ㄴ 교리 기망 되 어 금원 편취 당하 ㄴ 신도 여 부담 하 손해 배상 청구권 소멸 시효 기산점 관련 하 여 , 교주 다르 ㄴ 신도 ㄴ 동일 하 ㄴ 사기 행위 인하 여 구속 되 ㄴ 사실 알았 거나 피해자 수사 기관 진정 하 ㄴ 사정 만 피하 어 자가 교 주의 편취 행위 위법성 있음 인식 하 였 다고 보 기 어렵 다고 하 ㄴ < br / > [ 3 ] 비 법인 사단 여 대표자 행위 인하 ㄴ 손해 배상 하 , 766 저 1 항 소정 ' 아 해자 알 ㄴ다는 것 ' < br / > [ 4 ] ○○ 교 △△ 제단 대표자인 교주 허황 되 ㄴ 교리 기망 되 어 금원 편취 당하 ㄴ 신도 여 손해 배상 책임 질 , 신도 부 주의 이유 손해 배상 책임 감경 주장 하 것 허용 되 ㄹ 없다 고 하 ㄴ < br / > [ 5 ] ○○ 교 △△ 제단 대표자인 교주 허황 되 ㄴ 교리 기망 되 어 금원 편취 당하 등 사유 정상적 ㄴ 가정 생활 사회생활 파탄 지경 이르 ㄴ 신 도들이 ○○ 교 △△ 제단 상대 정신적 고통 따르 ㄴ 위자료 하 ㄹ 있 다고 하 ㄴ < br / > "
157358,비 자경 농지 라 하여 국가 매상 되 ㄴ 농지 도시 계획법 49 의하 여 분배 하 ㄹ 없 게 되 ㄴ 동 농지 소 유권자 < br / > 
226137,"[ 1 ] 1 동 건물 중 구조상 구분 되 어 구분 소유권 목적 되 ㄴ 수개 구분 건물 사이 격벽 제거 되 등 건물 로서 독립성 상실 하 여 일체화되 고 일체화 되 ㄴ 구획 전유 부분 하 1 개 건물 되 ㄴ , 기존 구분 건물 ㄴ 등기 < br / > [ 2 ] 인접 하 ㄴ 구분 건물 사이 설치 되 ㄴ 경계 벽 제거 되 어 각 구분 건물 구조상 이용 상의 독립성 상실 하 였 으나 각 구분 건물 위치 면적 등 특정 하 ㄹ 있 고 사회 통념 복원 전제 일시적 ㄴ 것 으로서 복원 용이 하 ㄴ 각 구분 건물 관하 ㄴ 등기 ( 유 효 ) / 이때 구조상 구분 의하 여 구분 소유권 객체 범위 확정 하 ㄹ 없 , 건축물 관리 대장 독립 하 ㄴ 별개 구분 건물 등재 되 고 등기부 구분 소유권 목적 등기 되 어 있 더라도 등기 자체 무효 ㄴ지 ( ) < br / > [ 3 ] 1 동 상가 건물 리모델링 공사 구조 층수 , 면적 등 변경 되 었 음에도 리모델링 공사 허가 받 지 못하 여 준공 이후 상가 건물 내 구분 건물 관하 ㄴ 사용 승인 나 지 않 음 따르 아 리모델링 따르 ㄴ 공부 표시 변경 등록 표시 변경 등기 이루어지 지 않 았 고 , 결과 상가 건물 구분 소유 부분 각 등기 되 ㄴ 건물 부분 관하 ㄴ 건축물 대장 등기부 현재 건물 현황 제대로 반영 하 지 못하 고 있 , 제반 사정 비추 어 상가 건물 내 구분 건물 관하 ㄴ 구분 등기 자체 무효 고 , 리모델링 생겨나 ㄴ 새 롭 ㄴ 건물 중 구분 건물 차지 하 비율 상응 하 공유지 분 등기 로서 만 되 는데 , 달리 보 ㄴ 법리 오해 등 잘못 있 다고 하 ㄴ < br / > "
81706,[ 1 ] 국 · 공유 재산 매각 하 ㄹ 매매 계약 체결 당시 시가 참작 하 여 당해 재산 예정 가격 결정 하 도록 규정 하 ㄴ 국유 재산법 34 같 시행령 37 저 1 항 규정 ㄴ지 ( ) < br / > [ 2 ] 매매 계약 성립 으로서 목적물 대금 특정 정도 < br / > 
210003,[ 1 ] 주택 46 등 의하 여 사업 주체 하자 보수 의무 질 내력 구조 부 하자 범위 ( = 내력 구조 부 발생 하 ㄴ 모든 하자 ) < br / > [ 2 ] 주택 같 시행령 의하 여 사업 주체 하자 보수 의무 부담 하 하자 하자 담보 책임 기간 내 발생 하 였 는지 관하 ㄴ 입증 책임 부담자 ( = 사업 주체 ) < br / > [ 3 ] 주택 시행령 59 하자 담보 책임 기간 하자 보수 청구권 행사 제척 기간 ㄴ지 ( ) 하자 담보 책임 기간 내 발생 하 ㄴ 하자 ㄴ 보수 청구권 소멸 시효 기산일 ( = 각 하자 담보 책임 기간 경과 하 ㄴ 날 ) < br / > [ 4 ] 아파트 자연 발생적 ㄴ 노화 현상 있 있 점 등 참작 하 여 주택 46 등 의하 ㄴ 사업 주체 하자 보수 갈음 하 ㄴ 손해 배상액 하 보수 비용 70 % 하 ㄴ < br / > 
145804,"과적 적발 되 ㄴ 화물 차량 운전자 재 측정 위하 여 폐쇄 도로 후진 하 더 ㄴ 중 후방 주시 안전 운전 의무 위반 하 여 피해자 역과 하 여 상해 입히 ㄴ , 고속도로 관리 하 도로 공사 손해 배상 책임 있 다고 하 ㄴ < br / > "
92757,불하 받 창고 위하 여 부지 ㄴ 관습 정지 상권 취득 하 ㄴ 자가 부지 ㄴ 사용 허가 얻 어 사용료 납부 하 ㄴ 것 위의 관습 정지 상권 포기 하 ㄴ 것 보 ㄹ 있 지의 < br / > 
118791,공공 용지 취득 손실 보상 관하 ㄴ 특례법 6 저 1 항 같 시행령 4 저 1 항 공시 송달 절차 민사 소송법 정하 공시 송달 등 관하 ㄴ 규정 준용 되 는지 < br / > 
154830,"아 . 국가 농지 분배 사무 집행 국가 배상법 말하 공무원 직무 집행 하 ㄴ 늘 ㄴ 하 다 . < br / > 나 아 . 농지 분배 사무 집행 담당 하 공무원 농지 개혁법 시행령 10 저 1 항 오해 하 여 무효 하 ㄴ 국유 농지 분배 절차 취하 고 이에 관 하 ㄴ 소유권 전등 기르 ㄹ 수배자 앞 넘겨주 ㄴ 이상 , 등기 믿 고 부동산 매수 하 ㄴ 원고 소유권 취득 하 지 못하 ㅁ 인하 여 입 손해 배상 직접 피 고 나라 하 ㄹ 있 다 . < br / > "
118876,양도 담보 계약 체결 당시 피 담보 채무액 확정 되 어 있 지 아니하 고 장래 양도 담보권 지출 따르 아 채무액 확정 되 이른바 포괄 근 양도 담보 로서 담보 목적 물의 명도 구하 기 위하 여 아 등기 담보 등 관하 ㄴ 법률 소 정의 청산 절차 거치 어야 하 ㄴ다고 보 ㄴ < br / > 
209967,"[ 1 ] 사법 보좌관 사법 적 잘못 여 따로 불복 절차 마련 되 어 있 , 직무 행위 여 국가 배상 책임 되 는지 ( 원칙적 ) < br / > [ 2 ] 부동산 임의 경매 절차 집행 매각 대상 부동산 지상 건립 되 ㄴ 미 등기 상태 소유자 미상 건물 ㄴ 감정 평가액 포함 하 여 최저 매각 가격 결정 하 였 으나 집행 사법 보좌관 건물 제외 하 ㄴ 부동산 여만 매각 허가 결정 하 ㄴ , 국가 배상 책임 하 ㄹ 없다 고 하 ㄴ < br / > "
94397,일반 농지 소유권 이전 등기 관하 ㄴ 특별 조치법 의하 ㄴ 소유권 전등 기의 추정 력 < br / > 
114053,"[ 1 ] 법무 사의 등기 신청 사무 수임 따르 ㄴ 업무상 주의 의무 내용 < br / > [ 2 ] 법무사 사무원 전세권 설정 등기 신청 사무 위임 받 음 있 어 전세권 설정자 측 서류 구비 관하 여 전세권 허위 확인 하 여 주 ㄴ , 법무사 사무원 업무상 주의 의무 위반 이유 법무사 사무원 책임 하 ㄴ < br / > "
151520,기초 변경 없 것 보 ㄹ 있 < br / > 
139221,"아 . 토지 대장 가옥 대장 소관청 < br / > 나 아 . 766 저 1 항 "" 손해 알 ㄴ 날 "" 입증 책임 < br / > "
123096,아 . 부군 수가 처 명의 군 유 재산 매수 하 면서 사실 진술 하 지 아니하 ㄴ 것 군 유 재산 매매 계약 해제권 류 보사 유 정하 ㄴ 부정 하 ㄴ 하 ㄴ다고 보 ㄹ 없 다 하 ㄴ < br / > 나 아 . “ 아 ” 항 매매 대상 토지 중 일부 수의 계약 대상 되 ㄹ 없 음에도 전체 수의 계약 대상 되 것 알 고 매각 하 ㄴ 잘못 있 을지라도 매도인 측 귀책 사유 발생 하 ㄴ 것 므로 매도 인은 매매 계약 해제 하 ㄹ 없다 고 하 ㄴ < br / > 다 . “ 아 ” 항 매매 계약 연고권 명의 빌 어 계약 맺 실질적 당사자 “ 부정 하 ㄴ 내지 위법 사유 사실 ” 있 다면 매도 인은 계약 해제 하 ㄹ 있 다고 하 ㄴ < br / > 
194897,"물상 보증인 담보권 실행 타인 채무 담보 하 기 위하 여 제공 하 ㄴ 부동산 소유권 잃 , 물상 보증인 채무자 구상 하 ㄹ 있 범위 담보권 실행 부동산 소유권 잃 게 되 ㄴ 부동산 시가 기준 하 여야 하 는지 ( 원칙적 ) < br / > "
198923,"아 . 부부 일방 혼인 중 자기 명의 취득 하 ㄴ 재산 관하 ㄴ 특유 재산 추정 번복 되 소유 관계 < br / > 나 아 . 처 명의 부동산 주되 ㄴ 매입 자금 부의 수입 지만 처 적극적 ㄴ 재산 증식 노력 있 었 더 ㄴ , 이르 ㄹ 부부 공유 재산 보 ㄹ 여지 있 다고 보 ㄴ < br / > "
232507,명도 단행 가처분 있 어서 보전 필요성 < br / > 
194655,남편 처 점포 운영 필요 하 ㄴ 자금 자신 명의 차용 하 ㄹ 권한 포괄적 위임 하 였 다고 보 ㄹ 여지 있 다고 하 ㄴ < br / > 
93207,보조금 관리법 2 의하 여 지방 자치 단체 교부 되 ㄴ 국고 보조금 취득 하 ㄴ 재산 소유권 귀속 < br / > 
107577,채무 대위 변제 하 ㄴ 물상 보증인 다른 물상 보증인 소유 부동산 설정 되 ㄴ 근저당 권 설정 등기 관하 여 대위 부기 등기 하 지 아니하 고 있 동안 저 3 취득자 부동산 취득 하 ㄴ 대위 변제 하 ㄴ 물상 보증인 저 3 취득자 여 채권자 대위 하 ㄹ 있 는지 ( ) < br / > 
192167,"[ 1 ] 개인 사찰 관리 · 운영 되 어 오 더 ㄴ 사찰 종단 소속 사찰 등록 되 어 종단 부터 주지 임명 받 관할 관청 종단 소속 사찰 등록 주지 등록 하 고 사찰 부지 관하 여 사찰 명의 소유권 이전 등기 경 료 하 ㄴ , 종단 소속 불교 단체 내지 법인 아니 ㄴ 사단 재단 으로서 실체 갖추 ㄴ 독립 되 ㄴ 사찰 보 아야 하 는지 ( 한정 ) < br / > [ 2 ] 종단 소속 불교 단체 내지 법인 아니 ㄴ 사단 재단 으로서 실체 갖추 ㄴ 독립 되 ㄴ 사찰 전통 사찰 보존법 의하 ㄴ 전통 사찰 부동산 등기법 41 2 저 1 항 3 호 규정 의하 ㄴ 종교 단체 등록 되 지 않 , 독립 되 ㄴ 불교 단체 ㄴ 사찰 로서 지위 소멸 되 는지 ( ) < br / > "
230017,"기존 채무 지급 위하 여 지급 확보 위하 여 어음 교부 되 ㄴ 어음 채권 변제 · 상계 등 의하 여 소멸 되 ㄴ , 기존 채권 소멸 ( ) < br / > "
81426,"[ 1 ] 구 택지 소유 상한 관하 ㄴ 법률 전부 ㄴ 위헌 결정 이전 택지 초과 소유 부담금 부과 처분 압류 처분 이에 기한 압류 등기 이루어지 고 각 처분 확정 되 ㄴ , 위헌 결정 이후 후속 체납 처분 절차 진행 하 ㄹ 있 는지 ( ) 다른 사람 의하 여 개시 되 ㄴ 임의 경매 절차 배당 받 있 는지 ( ) < br / > [ 2 ] 구 택지 소유 상한 관하 ㄴ 법률 전부 ㄴ 위헌 결정 이후 택지 소유 상한 관하 ㄴ 법률 폐지 법률 부칙 3 항 < br / > "
151069,스 어 증과 인증 증거력 우열 < br / > 
100700,관련 형사 사건 이나 신청 사건 되 ㄴ 사실 민사 재판 있 어서 증명력 < br / > 
81411,[ 1 ] 매매 목적물 하자 있 다고 하 기 위하 ㄴ < br / > [ 2 ] 매매 계약 합의 해제 청약 여 상대방 조건 붙이 거나 변경 가하 여 승낙 하 ㄴ 효과 < br / > 
156689,담보 목적 명의 신탁 하 ㄴ 부동산 매수 하 ㄴ 저 3 지위 < br / > 
138125,"[ 1 ] 구 체육 시설 설치 · 이용 관하 ㄴ 법률 30 저 3 항 정하 ㄴ 영업 양도 하 는지 기준 < br / > [ 2 ] 담보 조로 회원권 발급 받 등 유효 하 게 회원 자격 취득 하 였 다고 보 ㄹ 없 자가 구 체육 시설 설치 · 이용 관하 ㄴ 법률 30 저 3 항 , 저 1 항 의하 여 기존 회원 모집 계약 권리 보호 받 게 되 회원 포함 되 는지 ( ) < br / > [ 3 ] 대물 변제 관하 ㄴ 합의 따르 아 공사 대금 채권 액 입회금 갈음 하 입회 금 납입 하 고 골프장 회원권 관하 ㄴ 회원증 교부 받 , 회원권 관하 ㄴ 골프 회원 가입 계약 유효 하 게 체결 되 었 다고 보 ㄴ < br / > "
207262,채무 담보 목적 아 등기 하 ㄴ 당사자 간 대물 변제 약정 없 더라도 담보 내용 아 등기 하 었 다가 피고 채무 불이 행시 보 ㄴ 등기 까지 이전 하 기로 하 내용 약정 었 다는 원고 주장 여 심리 하 여 하 여야 하 는지 < br / > 
157496,"가압류 하 ㄴ 물건 매수 하 였 , 소유권 취득 가부 < br / > "
99802,지방 자치 단체 ㄴ 군 도지사 승인 없이 중요 재산 처분 행위 나 예산 외의 채무 부담 행위 < br / > 
96688,서면 의하 지 아니하 ㄴ 취지 변경 책 문권 상실 < br / > 
199483,아 . 타 아 주점 유가 자주 점유 전환 되 ㄴ 사실 ㄴ 주장 있 다 하여 바로 자주 점유 추정 되 는지 < br / > 나 아 . 타 아 주점 유자 자기 명의 소유권 전등 기르 ㄹ 하 었 다 하여 소유 의사 표시 하 ㄴ 것 라고 보 ㄹ 것 ㄴ지 < br / > 
172534,"[ 1 ] 소멸 시효 중단 사유 로서 채무 승인 성립 하 기 위하 ㄴ 시효 완성 이익 포기 의사 표시 하 ㄹ 있 < br / > [ 2 ] 동일 당사자 간 같 종류 목적 하 수개 채권 관계 성립 되 어 있 는데 채무자 근저당 권 설정 등기 말소 하 기 위하 여 피 담보 채무 변제 하 , 피 담보 채무 아니 ㄴ 별개 채무 ㄴ 승인 소멸 시효 이익 포기 보 ㄹ 있 는지 ( 원칙적 ) < br / > [ 3 ] 전소 피 담보 채무 변제 양도 담보권 소멸 하 였 음 원인 소유권 전등 기의 회복 기각 되 ㄴ , 장래 잔존 피 담보 채무 변제 조건 소유권 전등 기의 회복 하 것 전소 확정 기판력 저촉 되 는지 ( ) < br / > "
191103,상대방 법정 대리권 등 흠결 재심 사유 삼 기 위하 ㄴ < br / > 
191215,"동일 부동산 관하 여 등기 명의 달리하 여 멸실 회복 의하 ㄴ 각 소유권 이전 등기 중복 등재 되 ㄴ , 각 회복 등기 간 우열 가리 기준 < br / > "
139619,공사 대금 채권 기하 여 유치권 행사 하 자가 스스로 유치 물 ㄴ 주택 거주 하 며 사용 하 것 유치 물의 보존 필요 하 ㄴ 사용 하 는지 ( ) 차임 상당 이득 소유자 반환 하 ㄹ 의무 있 는지 ( ) < br / > 
76749,출발 하 열차 승차 중 낙하 사고 일으키 어서 손해 배상 되 ㄴ < br / > 
216273,"[ 1 ] 소유권 이전 등기 청구권 압류 하 ㄴ 채권자 저 3 채무자 나 채무 자로 부터 이전 등기 경 료 하 ㄴ 저 3 여 이전 등기 말소 하 ㄹ 있 는지 ( ) 저 3 채무 자가 압류 결정 무시 하 고 채무자 이전 등기 이행 하 고 채무자 다시 저 3 이전 등기 경 료 하 어 주 어 채권자 손해 입히 ㄴ 불법 행위 성립 ( ) < br / > [ 2 ] 토지 구획 정리 사업 시행자 환지 처분 체비지 지정 하 여 저 3 처분 하 , 양수인 사용 수익권 소유권 취득 하 시기 < br / > [ 3 ] 체비지 양수인 토지 구획 정리 사업 시행자 여 가지 소유권 이전 등기 청구권 압류 되 ㄴ , 사업 시행자 체비지 대장 상의 소유자 명의 양수인 앞 변경 하 ㄹ 있 는지 ( ) 압류 결정 무시 하 고 대장 상의 소유자 명의 양수인 앞 변경 하 여 주 어 양수인 다시 저 3 처분 하 ㄴ 결과 당하 어 채권자 손해 입히 ㄴ 불법 행위 성립 ( ) < br / > [ 4 ] 체비지 양수인 토지 구획 정리 사업 시행자 여 가지 소유권 이전 등기 청구권 압류 되 ㄴ , 사업 시행자 체비지 처분 행위 압류 채권자 ㄴ 불법 행위 되 기 위하 ㄴ < br / > "
92261,매매 계약 있 등기부 목적 물이 매도인 소유자 아니 ㄴ 것 발견 되 ㄴ 매수인 선행 무인 중도금 지급 거절 하 ㄹ 있 는가 여 부 < br / > 
73532,실기 하 ㄴ 방어 하 지 않 는다고 보 ㄴ < br / > 
116782,"[ 1 ] 채무자 이외 자의 소유 속하 동산 경매 하 ㄴ , 동산 매득금 배당 받 채권자 동산 소유자 여 부당 이득 반환 의무 부담 하 는지 ( ) < br / > [ 2 ] 동산 선의 취득 제도 취지 효과 < br / > [ 3 ] 채무자 이외 자의 소유 속하 동산 경매 하 여 매득금 배당 받 채권자 동산 경락 받 아 선의 취득자 지위 겸하 고 있 , 동산 소유자 여 배당금 대신 동산 자체 반환 받 것 요구 하 ㄹ 있 는지 ( ) < br / > "
118621,월북 작가 북한 거주 하 면서 저작 하 ㄴ 저작물 여 우리 저작권법 의하 ㄴ 저작권 취득 하 ㄹ 있 는지 < br / > 
83545,[ 1 ] 일반 거래 약관 구속력 근거 < br / > [ 2 ] 선박 양도 선박 보험 계약 종료 사유 상법 703 2 저 1 호 규정 취지 조업 허가 목적 허위 선박 매매 계약서 작성 하 였 다는 사정 이에 하 는지 ( ) < br / > 
93865,사해 행위 취소 항변 주장 하 ㄹ 있 는지 < br / > 
74618,공동 불법 행위자 상호 간의 구상 금 청구권 발생 < br / > 
230739,"甲 하남시 장 가설 건축물 축조 신고 하여 자신 소유 하 ㄴ 하남시 소재 토지 가설 건축물 축조 하 ㄴ 다음 乙 주식회사 등에 임대 하 다가 , 丙 주식회사 ‘ 토지 가설 건축물 丙 회사 매도 하 되 가설 건축물 신고 명의자 변경 곤란 하 ㄴ 사정 감안 하 여 토지 등 포괄 양수 하 고 기존 임대차 계약 승계 하 ㄴ다 . ’ 늘 ㄴ 내용 매매 계약 사업 ( 부동산 ) 포괄 양수 계약 체결 하 였 고 , 이에 따르 아 丙 회사 앞 토지 관하 ㄴ 소유권 전등 기가 마치 어 지 고 기존 임대차 계약상 임대인 지위 승계 되 었 으나 가설 건축물 신고 명의자 甲 상태 그대로 었 는데 , 하남시 장이 신고 명의 자인 甲 ‘ 가설 건축물 신고 다른 용도 사용 되 고 있 어 시정 명령 하 였 는데 원상 복구 이행 되 지 않 다 . ’ 늘 ㄴ 이유 2 차례 걸치 어 이행 강제금 부과 하 , 甲 이르 ㄹ 모두 납부 하 ㄴ 다음 丙 회사 상대 688 저 1 항 따르 아 가설 건축물 매도 위반 행위 대상 2 차 이행 강제금 납부 액 하 돈 이에 대한 지연 손해금 지급 구하 ㄴ , 가설 건축물 동산 불과 하 므로 소유권 매매 계약 따르 아 가설 건축물 인도 하 ㄴ 丙 회사 이전 되 었 다고 보 ㄴ 다음 , 제반 사정 비추 어 보 면 丙 회사 가설 건축물 적법 하 게 계속 사용 하 기 위하 ㄴ 업무 묵시 적 甲 위임 하 였 고 , 甲 위임 받 사무 수행 하 과정 2 차 이행 강제금 부과 처분 받 고 丙 회사 대신 하 여 이르 ㄹ 납부 하 였 으므로 , 丙 회사 甲 688 저 1 항 따르 ㄴ 위임 사무 처리 비용 2 차 이행 강제금 납부 액 하 돈 이에 대한 지연 손해금 지급 하 ㄹ 의무 있 다고 하 ㄴ < br / > "
198742,"아 . 가처분 본안 각하 받 , 가처분 취소 사유 ㄴ 사정 변경 되 는지 < br / > 나 아 . 가처분 피 보전 채권 저 3 의하 여 압류 되 고 추심 확정 되 ㄴ 사정 만 그것 ㄴ 압류 해제 불가능 하 여 이행 불능 되 었 다고 하 ㄹ 없 다는 이유 , 사정 변경 인하 ㄴ 가처분 취소 배척 하 ㄴ < br / > "
75723,준용 하천 구역 내의 포락 되 ㄴ 토지 ㄴ 사권 소멸 < br / > 
156705,영업 양수 관하 여 심리 미진 내지 증거 의하 지 아니하 고 사실 하 ㄴ 위법 있 실례 < br / > 
117657,소유자 지방 자치 단체 도로 부지 매도 하여 사용 수익 권이 없 다는 사실 알 면서 토지 이중 매수 하 ㄴ 자가 토지 도로 부지 사용 하 지방 자치 단체 여 부당 이득 반환 하 ㄹ 있 는지 ( ) < br / > 
121069,아 . 미비 공시 송달 의하 여 판 결정 본 송달 되 어 항소 기간 지나 ㄴ 형식적 확정 ( ) < br / > 나 아 . 가집행 선고 붙 지 않 저 1 심 여 피고 만이 항소 하 ㄴ 항소심 항소 기각 하 면서 가집행 선고 붙이 ㄴ 것 불이익 변경 금지 원칙 위배 되 는지 ( ) < br / > 
76495,폐쇄 등기부 등재 되 ㄴ 등기 ㄴ 말소 있 어서 소 이익 < br / > 
69895,"[ 1 ] 피 보전 채권 변 아직 도래 하 지 않 았 거나 변 연장 되 었 다고 하 더라도 채권자 채권 보전 위하 여 채무자 등 변 도래 변 연장 사해 행위 취소 구하 ㄹ 있 는지 ( ) 같 사해 행위 취소 구함 있 어서 채무자 채무 불이행 상태 있음 요하 는지 ( ) < br / > [ 2 ] 채무 자가 연대 보증인 사해 행위 채권자 사이 변 연장 합의 하 등 채무 불이행 상태 벗어나 ㄴ , 채권자 여전히 연대 보증인 사해 행위 취소 구하 ㄹ 이익 있 다고 하 ㄴ < br / > "
197344,[ 1 ] 건물 건축 도급 계약 의하 여 신축 되 ㄴ 건물 소유권 귀속 관계 < br / > [ 2 ] 건물 건축 도급 계약 당시 부터 건축 허가 명의 도급인 하 등 완성 되 ㄴ 건축물 소유권 원시적 도급인 귀속 시키 기로 하 묵시 적 합의 있 었 다고 보 ㄴ < br / > 
218451,"[ 1 ] 718 저 1 항 조합원 제명 정하 ㄴ ‘ 정 당하 ㄴ 사유 있 ’ 신뢰 관계 파탄 이유 조합원 제명 하 ㄴ 것 정 당하 ㄴ 사유 있 는지 하 ㄹ 고려 하 여야 하 ㄹ 사항 < br / > [ 2 ] 甲 , 乙 , 丙 기간 정하 여 병원 공동 운영 하 기 위하 ㄴ 동업 계약 하면서 출자 지분 甲 1 / 7 , 乙 5 / 7 , 丙 1 / 7 하 며 , 乙 병원장 경영권 가지 기로 하 였 고 , 약정 기간 지나 ㄴ 다음 계속 병원 운영 하 다가 乙 동업 계약 변경 안 제시 하 였 으나 甲 이르 ㄹ 반대 하 여 재 계약 하 지 못하 였 고 과정 심각 하 ㄴ 불화 발생 하 였 는데 , 乙 丙 甲 ㄴ 제명 결의 하 ㄴ , 甲 귀책 사유 재 계약 체결 되 지 못하 었 다고 보 ㄹ 없 다는 이유 제명 결의 정 당하 ㄴ 사유 되 지 않 는다고 보 ㄴ 법리 오해 등 잘못 있 다고 하 ㄴ < br / > "
183952,"주택 재 건축 사업 조합원 도시 주거 환경 정 비법 정하 ㄴ 충족 하 여 현금 청산 대상자 되 ㄴ , 조합 현금 청산 대상자 같 61 저 1 항 따르 ㄴ 부과금 부과 · 징수 하 ㄹ 있 는지 ( 원칙적 ) / 조합 정관 등 현금 청산 대상자 조합원 지위 상실 하 기 까지 발생 하 ㄴ 정비 사업비 중 일정 부분 분담 하 기로 미리 정하 지 않 , 같 47 따르 ㄴ 청산 절차 등 이르 ㄹ 청산 하 거나 별도 현금 청산 대상자 반환 하 ㄹ 있 는지 ( ) 일 조합원 조합 정관 정하 ㄴ 충족 하 여 현금 청산 대상자 되 마찬가지 ㄴ지 ( ) < br / > "
200121,주택 건설 촉진법 주택 조합 법적 성질 < br / > 
194758,"토지 소유자 도로 개설 있 어 소유 토지 도로 부지 무상 기부 하 였 거나 , 최소한 도로 점유 · 사용 하 것 허용 하 고 배타적 사용 · 수익권 포기 하 ㄴ 것 보 ㄴ < br / > "
228137,"[ 1 ] 매수인 귀책 사유 의하 여 매도 인의 매매 목적물 관하 ㄴ 소유권 이전 무가 이행 불능 되 ㄴ , 매수인 이행 불능 이유 계약 해제 하 ㄹ 있 는지 ( ) < br / > [ 2 ] 매도인 매매 목적물 관하 ㄴ 소유권 이전 무가 이행 불능 되 ㄴ 책임 오로지 매수인 있 다고 하 ㄴ < br / > [ 3 ] 계약 해제 위하 ㄴ 이행 최고 하 ㅁ 있 어 최고 되 채무 성질 채권자 단순 하 ㄴ 수령 이상 행위 하 여야 이행 완료 되 것 ㅁ에도 채권자 이행 완료 위하 여 필요 하 ㄴ 행위 하 ㄹ 있 일시 · 장소 등 채무자 알리 최고 하 지 아니하 고 단지 언제 까지 이행 하 여야 하 ㄴ다는 최고 만 하 ㄴ , 이행 최고 < br / > [ 4 ] 계약 해제 전제 로서 이행 최고 적법 관하 여 석명 의무 다하 지 아니하 여 심리 미진 위법 있 다는 이유 파기 하 ㄴ < br / > "
204704,국세 징수법 의하 ㄴ 압류 범위 < br / > 
125011,사해 행위 취소 인하 ㄴ 원상 회복 부동산 반환 하 사용 이익 이나 임 료 상당 액도 반환 하 어야 하 는지 ( ) < br / > 
96569,지적 공부 등록 되 ㄴ 토지 특정 < br / > 
