number,contents
229587,부동산 을 매수 하 려는 사람 매매 계약 을 체결 하 기 등기부 등본 이나 지적 공부 등 의하 어 소유 관계 면적 등 을 확인 하   다음 매매 계약 을 체결 하 므로 매매 대상 토지 면적 공부 면적 을 상당히 초과 하 계약 당사자 사실 을 알 고 있 었 보 것 상당 하 다   
229699,지적 원도 소유자 기재 사정 직접적   근거 자료 되 것 아니 라 사정 을 위하   공부   토지 조사부 실지 조사부 조제 위하   내부 자료 불과   
71217,공동 불법 행위자 중 사람 자기 부담 부분 못 미치 금액 을 변제 하   구상권 을 행사 하   없 다   
229767,점유자 점유 소유 의사 없 타 주점 유인 지의 점유자 내심 의사 의하 어 결정 되 것 아니 라 모든 사정 의하 여 외형 적   객관적 결정 되 어야 하  다   
229797,토지 매수인 목적 토지 점유 취득 하   계약 타인 토지 매매 하 여 곧바로 소유권 을 취득 하   없 다는 사실 만 자주 점유 추정 번복 되 다   
229833,분할 토지   등기부 지적 분할 동일 지 번 을 가지 일부 토지 지적 경정 등기 되   경정 등기 동일성 없 종전 토지   등기 로서 효력 을 갖 지 않 다   
190378,구 농촌 근대화 촉진법 의하   농지 개량 사업 일환 이루어지 환지 처분 시행 구역 내의 종전 토지 대신 하 여 다른 토지 지정 하 여 종전 토지 보 대물 적 행정 행위 다   
120972,생전 증여 상속인 특별 수익 되 기 위하 어서 상속인 돌아가   상속 재산 중 몫 일부 미리 주 것 라고 보   있 사정 있 어야 하  다   
120984,일반 민사 사건   유류분 반환 사건 추가적 병합 되   기여 분 반환 부분   소 부적 법하 다   
120988,수용 인원 을 초과 하 여 죄질 구분 없이 혼거 수용 하   경찰서 유치장 내 발생 하   수감자 사이 폭력 행위 어 소속 경찰관 제지 의무 게을리 하   과실 을 하   다   
79053,유언 집행자 유언 집행 방해 되 유증 목적물 경 료 되   상속 등기 등 말소 유증 목적물   소유권 이전 등기 있 어서 원고 적격 을 가지  다고 봄 상당 하 다   
79063,동일 하   채권 어 복수 압류 명령 있   채무자 채무액 을 공탁 하   있 권리 하 것 상당 하 다   
224083,자기 신체 사고 보험 약관 중 타 차량 사고 보상 받 을 있 금액 을 사망 보험금 공제 하 도록 하   약관 약관 규제   법률   의하 어 무효 다   
192748,명의 신탁 신탁 명의 수탁자 부담 하   있 채무 유무 따르 아 명의 수탁자 부담 하   있 다   
192750,갑  을 상대 소유권 이전 등기 을 하 여 승소 확정 을 선고 받 아 소유권 이전 등기 마치 었 지만 을 소 여 전소 확정 기판력 미치 지 않 다   
120971,구 산림법     저   항 같 시행령   의하 어 조직 되   기능인 작업 단 소속 작업자 간벌 작업 중 사고 당하   소속 공무원 지도   감독 소홀   국가 사용자 책임 을 하   다   
120974,구 관습법 의하 면 호주 사망 하   제사상 속인 일가 호주 로서 지위 승계 하 호주 상속인 되  다   
192174,등기 명의 부동산 을 저   매도 하 거나 근저당 권 을 설정 하 등 처분 하 여 취득 시효 완성 을 원인 소유권 이전 등기 무가 이행 불능 빠지 었 다면 등기 명의 인의 처분 행위 위법 하 다   
118022,구 관습   년 이전 양친 파 아 양의 의사 표시 만 파양하 것 되 었 으나   년 이후 양친 일방적 재판 외 의사 표시 파양하   있 하 구 관습 폐멸되 었 다   
192166,부동산 취득 당해 부동산 소유권 취득 실질적 을 갖추   으로써 사실상 취득 하 일체 말하 며 소유권 을 취득 하   있 어 반드시 소유권 이전 등기 형식 을 거치 것 아니 다   
192124,부동산 공유자 중 사람 공유물 일부 지분 여서 말   재 판상 하 었 으면 시효 중단 효력 하   소송물 한하 여 발생 하  다   
120958,공해 가해 기업 측 무해 것 을 입증 하 어야 하 고 하 지 못하 면 책임 을 면하   없다 고 보 것 적합 하 다   
117918,종중 유사 단체 문장 이나 연고 항 존 자만 종중 재산   대표권 을 갖 것 아니 며 부동산 등기법       법인 아니   사단   재단 외국인 부동산 등기 용 등록 번호 부여 절차   규정 의하   등록 을 하   있 어서 대표자 표시 되   자가 적법 하   대표자 라고 보   없 다   
117905,보험 계약 체결 시 보험 약관 계약 내용 포함 시키 기로 합의 되   것 으로서 계약 당사자 여 구속력 을 갖 다   
120973,피 상속인 상속인 을 수익자 하여 체결 하   보험 계약 따르 아 취득 하   보험금 청구권 수익자 고유 재산 속하 게 되 고 상속 재산 되 지 않 다   
120956,공동 상속인 실제 상속 재산 을 계산 하   생전 증여 따르   초과 수익자 상속인 아니   것 보 아 상속분 고려 하 지 않 고 공동 상속인 법정 상속 분만 구체적 상속분 을 계산 하 것 타당 하 다   
120969,선상 생활 영역 편입 되   선원 책임자 형성   유지 하 고 있 장의 상황 직   간접적 영향 을 받 만큼 책임자 장의 상황 을 선원 적응 하   있 도록 적절 하 게 형성   유지 하 여야 하   의무 있 다   
117853,  저   항   저     저   각 규정 의하 면 대 습 상속 상속인 되   피 상속인 직계 비속 형제자매 상속 개시 사망 하 거나 결 격자 되   상속인 되 것 을 말하  다   
117808,부동산 소유권 명의 신탁 결과 토지 대장 이나 건축물 관리 대장 기재 소유권 변동 을 공시 하 것 아니 기 때문 명의 신탁 해지 되 면 외부 관계 있 어서 소유권 상실 되  다   
195063,명의 신탁 탁자 공유물 분할 협의 따르 아 특정 토지 단독 소유 하 고 나머지 토지   지분 을 다른 공유자 이전 하   명의 수탁자 명의 수탁자 사이 명의 신탁 관계 존속 하  다고 보 아야 하  다   
194931,원인 채권 지급 을 확보 하 기 위하   어음 수수 되   어음 채권 소멸 시효 채권자 어음 채권 소멸 시효 중단 하 여 두 어도 권리 실현 하   없 게 되 불합리 하   결과 발생 하  다   
195088,종 원   세보 발간 되 었 다면 특별 하   사정 없 세보 의하 여 종중 회의 소집 통지 대상 되 종 원의 범위 확정 하   상당 하 다   
195093,농지 개량 사업 의하   환지 계획 의하 어 교부 되   환지 농림수산부 장관 환지 계획 을 고시 하   날 다음날 부터 종전 토지 보 도록 규정 하 고 있 다   
221495,부당 하   강제 집행 을 방지 하 기 위하   집행법 적   구제 방안 확정 기한 집행력 을 배제 하 것 지 확정 기하 여 발생 하   기판력 자체 배제 하 것 아니 다   
117657,지방 자치 단체 소유 자로 부터 토지 매수 하 고 대금 을 지급 하   지목 도로 변경 하 여   년 이상 간선 도로 사용 하 고 있 다   
120848,사적 자치 원칙상 매수인 자유 속하 고 특정 매수 부분 전체 어 명의 신탁 해지권 을 행사 하   의무 부담 하 것 아니 다   
120823,교통 법규 위반 차량 정지 지시 무시 하 고 도주 하 다가 교통 사고 일으키   것 거동 수상자 로서 다르   범죄 관계 있 것 라고 하   있 상황 으로서 추적 필요성 상당 성 되  다   
120838,공동 상속인 중 상속분 을 초과 하 여 재산 을 취득 하   초과 특별 수익자 상속 재산 실제 취득 하   액수 없 고 나머지 공동 상속인 상속 재산 취득 하   액수 비율 상속 재산 을 현실 취득 하  다   
120827,여관 숙박 계약 대가 받 고 여관 객실 을 상대방 일시적 사용 하 게 하 일종 임대차 계약 다   
120839,  유언 본법 정하   방식 의하 지 아니하 면 효력 생기 지 않 는다고 규정 하 고 있 다   
120822,원고 불법 행위 인하   피해자 임 동시 공동 불법 행위자 로서 저   피고 손해 배상 책임 을 부담 하 피고 원고 가지 구상권 손해 배상 채권 상계 하  다   
120834,의사 피해자 중증 폐결핵 급성 폐렴 환자 로서 전신 허약 하   상태 입원 치료 받 고 있 었 는데 합병증 사망 하   있 다는 점 을 예상 하   있 었 음에도 소 외인 을   실 입원 조치 하 었 다   
222209,공동 상속인 중   받으   특별 수익 상속 개시 당시 시가 상당액 평가 하여 유류분 산정 기초 되 재산 산입 하 여야 하  다   
120830,아파트 주민 자치회 간부 건축주 불법 행위 인하 어 건축주 입 손해 배상 하   의무 있 보  다   
211185,예탁금 입금 되   양 신용 협동조합 업무 전산화 하   이후 사용 하 지 않 정기 예탁금 증서 작성 하 여 교부 하   예금자 통상 주의 기울이 었 다면 예금 계약 체결 의사 표시 진의 아니 라는 것 을 알   있 었 다   
120829,  차 진료 하   의사 부모 아기 병세 악화 되 었 다는 사정 을 알 게 되 었 고 아기 연령 비추 어 단기간 지속 되   심 하   설사 구토 증세 인하 어 발생 하   있 위험 을 방지 하 여야 하   의무 있 다   
120726,부동산 물 권리자 명의 등기   쟁송 명의 신탁자 당 자자 로서 부동산 여 실 권리자 임 을 주장 하 여 이르   공적 확인 받 기 위하   쟁송 다   
195248,부동산 실 권리자 명의 등기   법률     저     저   등 의하 면 시행 일로 부터   년 기간 이내 실명 등기 하 여야 하  다   
117206,시효 취득 있 어서 부동산 소유권 이전 등기 청구권 구민법 저   대항 하   없 소유권 기해 점유 하 자도 포함 되  다   
195287,부동산 물 권리자 명의 등기   쟁송 명의 신탁자 당사자 로서 부동산 여 실 권리자 임 을 주장 하 여 이르   공적 확인 받 기 위하   쟁송 다   
120862,부동산 실 권리자 명의 등기   법률 위임   위탁 매매 형식 의하   명의 신탁 약정 을 무효 규정 하   것 위임   위탁 매매 가장 하 여 명의 신탁 목적 을 달성 하 려는 것 을 본질적 내용 하 것 다   
117134,피고 상대 진정 명의 회복 을 원인 소유권 이전 등기 절차 이행 을 구하 것 상속 회복 소 하 지 않 다   
117059,서면 의하   증여 란 증 여자 자기 재산 을 상대방 주  다는 증여 사가 문서 통하 어 확실히 알   있 정도 서면 나타나   증여 말하  다   
117047,감정 평가 업자 부실 감정 손해 입 게 되   감정 평가 의뢰인 이나 저   지가 공시 토지 등 평가   법률 손해 배상 책임 불법 행위 인하   손해 배상 책임 을 묻 을 있 다   
195356,사정 을 이유 소유권 을 취득 하 였 음 을 주장 하 사정 사실 외 사정 이전 토지 취득 경위 까지 입증 하   필요 없 다   
120736,구 소련 령 사할린 앞바다 격추 되   대 하   항공   기 승객 승무원 유족 대한 항공 을 상대 하   손해 배상 불제 소 합의 반하 여 되 었 다   
196138,자주 점유 추정 깨어지 무단 점유 타인 소유 부동산 을 점유 하 것 을 뜻하  다   
195366,서울 지방 되   약정금 사건 재 항고인 대여금 등 사건 을 서울 지방 하 여 상당 하   심리 진행 되 어 있 다   
196159,호주 장남 처 신 시행 사망 하   그녀 재산   상속 순위 결정 하   있 어 신 적용 되 어야 하  다   
116902,선택적 중 하나 만 을 기각 하 일부 선택적 병합 성질 반하 것 으로서 법률 허용 되 지 않 다   
116910,상속 개시 자신 상속권 을 주장 하 것 권리 남용 하 거나 신의칙 반하 권리 행사 라고 하   없 다   
116873,표현 자유 헌법상 권리 로서 최대한 보장 을 받 아야 하지만 못 지 않 게 사적 법익 보호 되 어야 하  다   
116818,지방 자치 단체 조례 무허가 건물 대장 등재 되   건물 어 철거 보상금 을 지급 하 도록 규정 하 고 있 고 관할 동사무소 무허가 건물 여 확정 따르 아 업무 처리 하   무허가 건물 대장 건물주 명의 말소 구하 소 이익 있 다   
196222,점유자 점유 소유 의사 없 타 주점 유인 지의 점유자 내심 의사 의하 어 결정 되 것 아니 라 모든 사정 의하 여 외형 적   객관적 결정 되 어야 하  다   
120619,피 상속인 등기 능력 없 자의 명의 신탁 하 여 경 료 소유권 전등 기가 무효   상속인 국가 상대 부동산 여 소유권 확인 을 구하   이익 없 다   
116777,유언 존재 내용 입증 사항   이상 유서   필적 무인 감정 유일 하   증거 하 지 않 다   
196257,타인 부동산 을 무단 점유 하   것   입증 되   점유자 타인 소유권 을 배척 하 고 점유 하   의사 갖 고 있 지 않 보 아야 하  다   
116730,  저   항 규정 되   유언 증서   검인 위조   변조 방지 하 고 보존 을 확실히 하 기 위하   절차 불과   
120583,무자 력 상태 있 채무자 정상 속 지분 을 협의 분할 방식 포기 하   으로써 다른 상속인 상속 재산 을 취득 하 게 하 더라도 협의 분할 행위 사해 행위 대상 되   없 다   
196294,취득 시효 기산점 법률 효과 여 직접 필요 하   주요 사실 아니 고 간접 사실 불과 하 므로 으로서 이에 관 하   당사자 주장 구속 되 지 않 고 자료 의하 여 점유 시기 하   있 다   
196307,타인 소유 토지 권한 없이 건물 을 소유 하 고 있 법률 원인 없이 타인 재산 인하 어 토지 차임 상당 하 이익 을 얻 고 인하 어 타인 동액 상당 손해 주 고 있 보 아야 하  다   
196305,토지 원 소유자 토지 일부 도로 부지 무상 제공 하   으로써 독점적 고 배타적   사용 수익권 을 포기 하 고 토지 소유권 을 특정 승계 하   사용   수익 제한 라는 부담 있 다   
116664,국가 배상법   국가 지방 자치 단체 손해 배상 책임 여 이외 법률 다른 규정 있 을 규정 의하  다고 규정 하 고 있 다   
116622,위임 위임 인과 수임인 사이 지휘   감독 관계 있 고 수임인 불법 행위 어 위임 인은 수임인 불법 행위 어 사용자 책임 을 질  다   
120601,상속인 채권 양수인 상속 채권 을 양도 하 고 확정 일자 있 내용 증명 우편 양도 사실 을 통지 하 기 이전 채권 가압류 결정 정본 저   채무자 송달 되 어 채권 양수인 가압류 채권자 대항 하   없 다   
196354,미 등기 토지 여 소유자 상속인 명의 구 소유권 이전 등기 등   특별 조치법 따르   소유권 보존 등기 마 쳐지 었 어도 시효 취득 영향 을 미치 소유자 변경 하 지 않 다   
196374,등기 명의 인은 종전 소유자 같 지위 있 자로 보   없 고 취득 시효 완성 새 롭   이해 관계인 보 아야 하  다   
196377,국방부 장관 징발 매수 결정 있 으면 징발 보상 증권 교부   현금 지급 공탁 없 것 을 해제 조건 하여 등기 없이 징발 재산   소유권 을 취득 하  다   
196365,구 농지 개혁법 의하 어 분배 되 었 다가 정부 반환 되   재분배 구 농지 개혁법 의하   분배 므로 재분배 하   다시 구 농지 개혁법 시행령 부칙   재분배 하 어야 하  다   
196371,진정 속인 주장 하 피 상속인 참칭 상속인 주장 하 피 상속인 다른 사람   이르   상속 회복 소라 고 하   없 다   
196387,경정 등기 신청 있 어서 등기 이해관계 있 저   있 을 신청서 승낙서 대항 하   있 재판 등본 을 반드시 첨부 하 어야 하  다   
120600,배우자 대 습 상속권 을 하     상속인 되   직계 비속 사망 하   대 습 상속 가능 고 규정 하 고 있 다   
116493,상속 회복 청구권 제척 기간 경과 소멸 하 게 되 면 상속인 상속인 으로서 지위 확정 되 어 상속인 으로서 지위 취득 하   것 봄 상당 하 므로 상속 재산 상속 개시일 소급 하 여 참칭 상속인 소유 되  다   
120611,원고 피고 주소 거소 알 고 있 었 음에도 소재 불명 을 이유 공시 송달 을 신청 하   것 신의 좇 아 성실 하 게 협력 하 어야 하   의무 저버리   처사 다   
120620,부동산 실 권리자 명의 등기   법률     저   저   항 본문   저     부칙   의하 면 부동산   물권 을 명의 수탁자 명의 등기 하   시행 일로 부터   년 이내 실명 등기 하 여야 하  다   
196483,임야 일부 선조 분묘 설치 되 어 있 다는 사정 만 임야 전체 배타적 점유   관리 하 어 오 았 보   없 다   
196028,채권 집행 있 어서 압류 전부 명령 경정 결정 일체 되 어 경정 되   내용 압류 전부 명령 효력 발생 하  다   
196059,점유자 타인 선대 위하 어 선산 분묘 등 을 돌보 면서 관리 하 어 오   토지   점유 권원 성질 처음 부터 타 주점 유 다   
196032,매수인 중도금 지급 의무 이행 하 지 않 상태 입주 예정일 도래 하 였 다면 매수인 중도금 지급 의무 매도 인의 입주 가능 하 게 하   의무 동시 이행 관계 있 게 되  다   
196092,지방 자치 단체 가옥 을 상실 하   주민 국유 토지 가옥 을 건축 하 도록 하   것 무상 사용 하 도록 하   것 지나 지 않 는다고 보 아야 하  다   
196037,등기부 취득 시효 으로서 소유자 등기 하   자라 함 적법   유효 하   등기 마치   자일 필요 없 고 등기 마치   자라도 상관없 다   
196076,농지 분배 처분 행정 처분 으로서 효력 적법 하   절차 의하 어 부인 되 지 않 처분 별도 수분 배자 권리 소멸 되  다고 하   없 다   
129741,공유 근저당 권 준 공유자 피 담보 채권 을 모두 합치 어서 채권 최고액 까지 담보 하 것 피 담보 채권 확정 되 기 준공유 비율 을 정하   없 다   
120488,전환 사채 발행 무효 사유 있 상법   이하 규정 을 유추 적용 하 여 회사 상대 전환 사채 발행 무효 소 하   있 다   
196629,민사 소송법   규정 소송법 대리권 을 정형 적   포괄적 법정 하   것 불과 하 고 변호사 의뢰인 사이 사법 위임 계약 내용 까지 법정 하   것 아니 다   
196506,소유권 전등 기가 경 료 되 어 있 등기 명의자 적법 하   등기 원인 의하 여 소유권 을 취득 하   것 추정 되  다   
196636,토지 소유자 토지 분할 하 여 매도 하   남기 어 지   토지 어 독점적 고 배타적   사용 수익권 을 포기 하   것 의사 해석 을 하   있 어서 토지 위치 나 성상   주변 환경 등 을 종합적 고찰 하 어야 하  다   
196505,조선총독부 실시 하   저   차 긴급 증 미용 수원 확충 사업 소류지 설치 사업 일환 총독부 보조금 의하 어 시행 되 었 다   
196631,문서 진정 성립 필적 인영   무인 대조 의하 여 증명 하   있 고 문서 진정 성립 사실 심의 자유 심증 속하 사항 다   
129743,  의하 어 채권자 채무자 법률 행위 취소 하 것 채무자 사적 자치   중대 하   간섭 기 때문 책임 재산 모자라 게 되 만 허용 되  다   
129784,차량 소유자 아파트 단지 내의 경 사진 비탈길 사이드 브레이크 채우 지 않 고 돌멩이 만 받치 어 주차 하 어 두   차량 을 다르   주민 함께 비탈길 구르 어 사망 하   차량 소유자 자동차 손해 배상 보장 법상 운 행자 로서 책임 을 하  다   
120471,중국 교포   피해 자가 체류 기간 연장 허가 없이 불법 체류 하 여 적발 되 면 출입국 관리 법령 따르 아 강제 퇴거 조치 받 을 지위 있었 고 일정 하   기간 지나 면 피해자 스스로 중국 돌아가   가능성 배제 하   없 다   
196641,임야   소유권 보존 등 기가 경 료 되   당시 종 중원 손 중 각   을 선정 하 여 명의 소유권 보존 등기 경 료 하   것 객관적 종중 대표자 명의 신탁 관계 변경 하   것 보이  다   
196664,  저   항   호 소정 피 상속인 형제자매 부계 모계 형제자매 모두 포함 하 것 해석 하 것 상당 하 다   
196679,상속인 을 제외 하   다른 누 구도 토지   소유권 을 주장 하 거나 이르   점유   사용 하   바 없 었 더   상속인 계속 하 어서 토지 소유 의사 점유 하   것 추정 되  다   
196663,사망자 명의 등기 신청 의하 어 경 료 되   등기 원인 무효 등기 로서 등기 추정 력 을 하   여지 없 다   
196713,임야 선조   기의 분묘 설치 되 어 있 고 임야 인접 토지 경계 울타리 세우 어 지 어 있 점유자 임야 평온   공연 하 게 점유 하 어 오 았 보   여지 충분히 있 다   
196727,  저   항 의하 여 취득 시효 준용 되 재판 상의 시효 중단 사유 하나 규정 하 고 있 다   
129694,환자 최초 문 진시 의사 복부 통증 원인 일지 모르 구타 사실 을 고지 하 지 않 고 의사 하여금 환자 병명 을 췌장염 오진 하 게 하 였 하 더라도 엑스선 촬영 결과 의하 어 장 파열 을 의심 하   있 다   
196759,구 관습 따르 아 피 상속인 유산 사후 양자 상속 하 기 까지 피 상속인 조모 상속 되 었 는데 상속 부동산 을 현실적 점유 하 어 오   피 상속인 처 소유 의사 점유 시작 하   것 추정 되  다   
196781,기업자 수용 보상금 을 절대적 불 확지 공탁 하   수용 토지 소유자 공탁금 출급 을 위하 어 기업자 상대 공탁금 출급 청구권 자신 있 다는 확인 을 구하 확인 이익 있 있 다   
196780,구 부동산 소유권 이전 등기 등   특별 조치법 의하   등기 실체 관계 부합 하 등기 추정 되 므로 등기 말소 소구 하 추정 을 번복 시키   주장   입증 책임 있 다   
196811,부동산 소유권 이전 등기 등   특별 조치법 의하 어 경 료 되   등기 규정 되   절차 따르 아 적법 하 게 마 쳐지   등기 추정 되  다   
196801,구 조선 임야 조사령 의하 어 작성 되   임야 조사서 소유자 국   연고자 특정 개인 기재 되 어 있 지 않 연고자 기재 되   자가 구체적 어떠하   연고 가지 가가 밝혀지 지 않 임야 국유 귀속 되  다   
196834,외국인 토지 취득 관리   법률   저   항 정하 토지 취득 허가 받 아야 하 고 명의 신탁 을 해지 하 여 소유권 이전 등기 하 마찬가지 토지 취득 허가 받 아야 하  다   
196849,구 임야 소유권 이전 등기 등   특별 조치법 의하 어 경 료 되   소유권 보존 등기 같 소정 적법 하   절차 따르 아 마 쳐지   등기 추정 되  다   
196844,저당권 법률 특별 하   규정 있 거나 설정 행위 다른 약정 있 제외 하 고 저당 부동산 부합 되   물건 종 물 이외 까지 효력 미치 것 아니 므로 경매 절차 지상 건물 을 토지 부합물 내지 종 물 보 아 경락 허가 하 였 하여 건물 소유권 변동 초래 되   없 다   
196839,구 삼림 령 저   의하 어 조선 총독 국유 산림 대부 받 산림 을 양여 하 행위 사법 법률 행위 하  다   
196906,전소 확정 참가 적 효력 보조 참가인 피 참가인 공동 이익 주장 하 거나 다투   있 었 더   사항 미치 는데 전소 확정 필수적   요소 아니 어서 결론 영향 을 미치   없 다   
196911,구 부동산 소유권 이전 등기 등   특별 조치법 의하   등기 공부 소유 명의 부터 직접 양수 하   뿐 만 아니 라 상속인 이나 저   거치 어 양수 하   허용 되  다   
120476,부부간 재산 관계 규율 하   있 어 부부 일방 자기 명의 취득 하   재산 특유 재산 하 고 있 다   
196927,집합 건물 소유 관리   법률   저   항 의하   집합 건물 관리 단 구분 소유자 전원 을 구성원 하여 대지 부대 시설 관리   사업 시행 을 목적 성립 되 것 다   
120504,경인 국도 상의 소명 지하 차도 도로 교통법 통행 맞 지 않 이례적   구조 다   
196962,구 복지 역내 소유자 미 복구 토지 복구 등록 보존 등기 등   특별 조치법 의하   소유권 보존 등기 같 소정 적법 하   절차 따르 아 마 쳐지   등기 추정 되  다   
196528,점유자 점유 개시 당시 소유권 취득 원인 되   있 법률 행위 기타 법률 없이 같 법률 없 다는 사실 을 알 면서 타인 소유 부동산 을 무단 점유 하   자주 점유 추정 깨어지 묻 다   
196977,공동 선조 후손 중 성년 이상 남자 종 원 하여 구성 되 종족 자연 발생적 집단 므로 성립 을 위하 어 특별 하   조직 행위 필요 하 지 않 다   
196999,채권자 대위   채무 자가 이르   행사 하   없 으며 채권자 대위   채무 자가 이르   행사 하   없 다   
222091,망부 사망 지급 되   보험금 중 자의 몫 반환 을 구하 을 하 것 친권 남용 하 므로 행위 효과 본인 미치 지 않 다   
196554,조합 지분 상속 가능 하   지 만 하   것 이유 불비 위법 있 다는 이유 파기 하   다   
196548,공동 상속 인의   상속 재산   부동산 을 전부 점유 하  다고 하 더라도 다른 공유자 지분 비율 범위 타 주점 유 보 아야 하  다   
