number,contents
191154,자동차운전학원에서 연습 중인 피교습자에게 학원 소유의 교습용 자동차를 이용하여 운전연습을 하게 하는 경우 임대차 또는 사용대차의 관계가 성립된다고 할 것이다.
200598,의료법인 이사회의 결의가 정당한 소집권자 아닌 자에 의하여 소집되고 적법한 소집절차 없이 개최되었다.
208795,가해행위와 현실적인 손해의 발생 사이에 시간적 간격이 있는 불법행위의 경우 소멸시효의 기산점이 되는 불법행위를 안 날은 잠재하고 있던 손해에 대한 인식이 있었다는 정도만으로는 부족하다.
197234,유니언 숍 협정이 있는 사업장의 일부 조합원이 노동조합에 불만을 품고 탈퇴하였다가 재가입 신청을 하였으나 일부만의 가입을 승인하고 나머지에 대한 승인을 거부한 것은 권리남용 내지 신의칙 위반이다.
230977,타인의 불법행위가 계속되는 중 공동불법행위자의 과실에 의한 행위가 이루어졌다면 그 과실에 의한 행위와 타인의 불법행위로 발생한 손해 사이에 상당인과관계가 있다고 보기는 어렵다.
146020,도급인의 위약으로 인한 수급인의 구제는 손해배상의 문제로 귀착될 것이기 때문에 특정 행위의 금지를 구할 만한 보전의 필요성이 없다고 보기도 어렵다.
208106,차주들이 자동차를 현물출자하여 주식회사를 설립했다 하더라도 출자현물인 자동차를 지입차주들이 각자 관리 운영하고 있는 경우 동 자동차는 차주의 점유하에 있다.
76581,전차인은 직접 임대인에게 임대보증금이나 필요비·유익비의 반환을 청구할 수 없고 필요비·유익비의 반환을 청구할 수 없다.
217409,공무원의 순전한 직무상의 행위로 국가 또는 공공단체가 재산상의 손해를 입은 경우 그 공무원은 민법상의 불법행위에 기한 손해배상 책임을 지지 않는다.
175440,자동차종합보험의 가족운전자 한정운전 특별약관은 보험자의 구체적이고 상세한 명시·설명의무의 대상이 된다.
139109,은행원이 고위험·고수익의 장외파생상품을 주된 투자대상으로 하는 펀드의 위험성을 제대로 알리지 않은 사안에서 투자설명서의 제시·교부도 하지 않은 채 문외한인 고객들을 상대로 펀드 가입을 권유했다.
105473,사단법인의 구성원들이 그 법인을 해산하고 신법인을 결성한 경우 구법인과 신법인의 구성원이 동일하고 두 법인의 임원과 대표자가 중복된 때가 있었다.
193748,공사도급계약의 수급인을 선정하기 위해 입찰을 실시한 자와 낙찰자 사이에는 예약의 계약관계가 성립하고 일방이 정당한 이유 없이 본계약의 체결을 거절하는 경우 상대방은 예약채무불이행을 이유로 손해배상을 청구할 수 있다.
93276,혼인해 소방식에 구애되어 혼인취소 또는 이혼판결이 있어야 할 이유는 없다.
211731,구 외부감사법 제5조 제2항에 의하면 회계감사기준은 한국공인회계사회가 정하고 그에 따라 마련된 회계감사기준은 감사인의 주의의무 위반 여부에 대한 판단의 기준이 된다.
226009,근로기준법이 정한 기준근로시간을 초과하는 약정 근로시간에 대한 임금으로서 고정수당을 시간급 통상임금으로 환산하는 경우 가산수당 산정을 위한 가산율을 고려해야 하는지 여부가 원칙적 소극이다.
199596,자동차 보유자의 운행지배는 간접적이거나 제3자의 권리를 통한 관념상의 지배관계를 포함하는 것이므로 자동차를 매도하고도 등록명의를 남겨둔 경우 매도인의 운행지배 유무는 매도인의 차량운행에 간섭을 하거나 지배관리할 책무가 있는지의 여부를 가려 결정해야 한다.
155616,감사원의 변상판정이 확정되면 동일한 금액의 배상을 구하는 민사청구는 특별한 사정이 없는 한 권리보호의 필요가 없다.
235129,제조업체가 위법한 쟁의행위로 입은 고정비용 상당 손해의 배상을 구하기 위해 증명해야 할 사항 및 간접반증이 없는 한 생산된 제품이 판매되어 제조업체가 고정비용을 회수할 수 있다고 추정되는지 여부 등이 있다.
95668,전기사업법이나 전기설비기술기준령은 전기공작물의 설치 보존상의 하자유무를 판단하는 참작기준이 될 수 있을 뿐 절대적인 기준은 아니다.
70348,운전자의 성폭행을 피하기 위해 주행 중인 차에서 뛰어 내려 두개골골절상 등의 상해를 입은 사안에서 피해자가 다른 방어수단을 취할 것을 기대하기 어렵다고 판단해 가해자의 과실상계 주장을 배척했다.
215083,학교법인이 금전을 차입하려면 이사회의 결의와 문교부장관의 허가가 있어야 하는데 절차 없이 돈을 대여함으로써 손해를 입었다면 과실상계의 항변을 판단하지 않은 것은 잘못이다.
75121,건축사인 피고가 건물의 설계를 함에 있어서 고압전선에 대한 위험방지조치를 취할 의무가 없고 건축공사를 도급준 피고는 고압전선에 관한 별도의 위험방지조치를 취할 의무가 없다.
110845,피해자가 휠체어를 사용하여 움직일 수밖에 없기 때문에 개호인의 도움을 받아야만 휠체어를 탈 수 있을 뿐 아니라 성인 여자 1인으로부터 1일 4시간 정도 부분적인 개호를 받을 수 있다.
109633,제3자의 무면허운전이 피보험자의 지배 또는 관리가능한 상황하에서 이루어진 것이라 무면허면책조항에 따라 보험자의 책임이 없다고 본 사례다.
105513,본사례 본사례에는 심리미진으로 인한 이유불비의 위법이 있다고 본사례 본사례가 있다.
76878,렌트카회사로부터 차를 임차하여 4일간 장거리여행을 함에 있어 임대차 계약서상 임차인이 아닌 제3자 운전을 금지하는 조항이 있다 하더라도 일행 중 한 사람이 교통사고를 일으킨 경우 그 차량은 임차인을 위하여 한 것이라고 봄이 타당하다.
155458,피신원보증인이 장기간에 걸쳐 국고손실을 끼친 경우 감사책임자들이 부하직원의 감독을 철저히 하지 못해 피해의 발생 및 그 금액을 증가케 한 점 등 일절의 사정을 참작하여 신원보증인에게 손해배상책임을 지운 것은 정당하다.
120284,컴퓨터프로그램보호법의 각 규정에 의하면 원프로그램의 저작권자에게 원프로그램을 개작할 수 있는 권리가 있지만 타인이 개작한 프로그램에 창작성이 인정되는 경우 개작된 프로그램은 2차적 저작권의 대상이 된다.
228583,근로자의법 제23조 소정의 근로조건은 사용자가 근로자를 채용하면서 유리한 근로조건을 제시하고도 불리한 조건으로 근로시키는 폐단을 방지하고 근로자의 해지권과 손해배상청구권을 보장하려는 것이다.
156173,가압류의 본안사건이 계속중이라면 가압류사건이 완결되었다 하여도 담보권리자에게 그 권리행사를 최고할 수 있는 소송완결이 있다고 할 수 없다.
195065,증권회사의 임직원이 강행규정에 위반한 투자수익보장으로 투자를 권유하였으나 손실을 본 경우 불법행위책임이 성립하기 위해서는 거래 경위와 거래 방법 등을 종합적으로 고려해야 한다.
107191,월차휴가 수당을 일실수입 산정의 기초로 인정한 것은 심리미진의 위법을 저지른 것이다.
82208,자동차손해배상보장법 제3조 소정의 타인임을 주장할 수 없는 것이 원칙이지만 상대방이 용이하게 사고의 발생을 방지할 수 있었다고 보여지는 경우에 한하여 자신이 타인임을 주장할 수 있을 것이다.
200137,편도 3차선 도로의 2차선상을 운행하는 자동차의 운전자는 뒤따라 진행하는 차량도 정상적으로 그 차선을 유지하면서 진행하리라고 신뢰하는 것이 보통이다.
161838,국방과학연구소가 사격장 인근 해역의 출입을 통제하여 어민들의 어업을 제한하는 불법행위를 했다는 이유로 손해배상을 구한 사안에서 시험사격은 구 수산업법 제34조 제1항 제5호에 해당하는 것으로서 국방·군사에 관한 사업상 필요한 경우이다.
81266,분할채권자는 제3자에 대한 대항요건을 갖춘 양수인이라 하더라도 각 분할채권액의 채권 총액에 대한 비율에 따라 상계되어야 한다는 이의를 할 수 없다.
75353,민법 제643조에서 규정하는 임차인의 건물매수청구권은 토지의 임대차가 건물의 소유를 목적으로 하고 계약당사자간에 그 임차지상의 건물을 철거하기로 하는 약정이 없었어야 한다.
117096,표현지배인이 성립하려면 본·지점의 지휘·감독 아래 보조적 사무만을 처리하는 영업소는 상법상의 영업소인 본·지점에 준하는 영업 장소라고 볼 수 없다.
80352,민법 제756조에 규정된 사무집행에 관하여는 객관적으로 사용자의 사업활동 내지 사무집행 행위와 관련된 것이라고 보여질 때 주관적 사정을 고려하지 않고 사무집행에 관하여 한 행위로 본다.
81611,선박소유 안전한 항해를 할 수 있는 능력을 구비하지 못했다는 불감항성을 이유로 한 손해배상 청구소송도 불법행위로 인한 손해배상 청구소송과 동일한 성격을 가진다.
115407,교장이나 교사는 학생을 보호·감독할 의무를 지는 것이나 학생에 대한 보호·감독의무는 학교에서의 교육활동 및 밀접불가분의 관계에 있는 생활관계에 한한다.
193073,甲 주식회사가 골프장 회원들에게 골프장 운영을 대중제로 전환함에 따라 회원권 계약을 해지하니 입회금 반환신청을 할 것과 공탁절차가 완료되는 날 이후에는 회원 지위가 보장되지 않는다는 취지의 통고서를 보냈다.
207404,매매 당사자가 모두 타인의 소유인 사실을 모르고 계약을 체결한 경우 위약금의 약정은 담보책임까지 예상하여 배상액을 예정한 것이라고 볼 수 없다.
164076,인터넷 포털사이트의 경제 토론방 게시판에 미네르바라는 필명으로 국내외 경제동향 분석 및 예측에 관한 글을 게시한 甲은 고기능 자폐증의 일종인 아스퍼거 증후군 환자이다.
113713,민사소송법 제422조 제1항 제8호는 판결의 기초가 된 민사나 형사의 판결 기타의 재판 또는 행정처분이 다른 재판이나 행정처분에 의하여 변경된 경우를 재심사유로 규정하고 있다.
74976,사용자가 영업의 전부를 타인에게 양도한 경우 양수인과 피용자간에 존속되는 것이고 특별한 사정이 없는 한 신원보증계약도 존속되는 것이라고 해석할 것이다.
197013,회사가 다이아몬드공구의 제조공정에 있어서 일반적 지식 또는 기능이라고 할 수 없는 특수한 기술상의 비밀정보를 가지고 있는 것은 직업선택의 자유에 관한 헌법규정에 반하지 않는다.
208332,사용자와 간에 체결된 단체협약에 정하여진 정년 53세를 넘은 경우에는 특별한 기술이 있다는 특별한 사유가 없는 한 종전과 같은 임금을 받을 수 없다.
192165,구 수산업법 제40조 소정의 관행어업권은 타인의 방해를 받지 않고 일정한 공유수면에 출입하면서 수산동식물을 채포할 수 있는 권리에 지나지 않는다.
179086,甲이 丙 주식회사와 신혼여행 계약을 체결하고 대금을 모두 지급하였다가 5주간의 치료를 필요로 하는 상해를 입게 되자 계약 해제의 의사표시를 했다.
119135,1심 변론종결시까지만 허용되는 항소심에 이르러 피고를 삼척시로 변경하는 것은 허용되지 않는다.
121162,전국버스운송사업조합연합회공제조합은 연합회 산하의 부속기관에 불과하고 독립된 단체라고 볼 수 없어 민사소송법상 당사자능력이 없다.
112434,"보세화물관리세칙 제4조, 제5조는 운송인으로 하여금 자가보세장치장을 가지고 있는 수입자의 보세운송에 동의하도록 강제하는 근거가 될 수 없다."
142050,홈쇼핑회사로 하여금 예정된 홈쇼핑 방송을 취소하도록 한 행위는 고의 또는 과실에 의해 상대방의 영업활동을 방해한 것으로 위법성이 인정되기 때문에 손해를 배상할 의무가 있다.
71975,대물변제예약의 효력이 발생하여 피고 소유 부동산에 관한 소유권을 취득한 원고의 이전등기 청구권은 이행불능으로 돌아가고 이로 인해 피고는 불법행위로 인한 손해배상책임을 진다.
146005,공동어업권자는 일정한 법률상의 부담을 감수하게 되는 등록의무자로 등록절차상의 등록의무자는 등록이 행하여짐으로써 실체적 권리관계에 있어 불이익을 받는 자를 말한다.
192309,2인 이상의 불가분채무자 또는 연대채무자가 있는 금전채권의 경우 채권압류 및 추심명령이 이루어지면 피압류채권에 관한 이행의 소는 추심채권자만이 제기할 수 있다.
150519,신원보증계약이 성립된 후 피용자의 행위로 인한 손해가 신원보증계약성립전의 사용자가 받은 손해를 보충하기 위해 발생한 것이라고 하더라도 손해는 신원보증계약 후 발생한 것이다.
210055,학교용지확보 등에 관한 특례법은 학교용지의 확보가 불가능한 경우 인근의 학교 증축을 용이하게 함을 목적으로 한다.
131269,집합건물의 소유 및 관리에 관한 법률 제9조는 건축업자 내지 분양자로 하여금 견고한 건물을 짓도록 유도하고 부실하게 건축된 집합건물의 소유자를 두텁게 보호하기 위한 것이다.
229697,"예산회계법 제96조 제2항, 제1항은 국가에 대한 금전채권의 소멸시효를 규정한 것으로 헌법상의 평등 원칙에 반하여 무효인 규정이라고 할 수 없다."
158429,민법 제535조 제1항에 따라 사업시행자가 실시협약이 유효한 것으로 믿고 실시계획에 필요한 준비절차를 진행하며 지출한 비용 상당 손해를 배상할 책임이 있다.
198972,보험자는 제3자가 피보험자로부터 배상을 받기 전에는 피보험자에 대한 보험금 지급으로 직접청구권을 갖는 피해자에게 대항할 수 없기 때문에 보험금지급 청구를 거절할 권리를 갖게 된다.
118418,"교통사고의 후유증으로 인한 구음장애, 기억 및 계산능력장애 등의 정신질환을 얻은 피해자는 증상이 호전되지 않고 있던 중 농약을 먹고 자살했다."
74503,기결수의 귀밥에 생긴 종기를 절개수술한 후 사망하였다고 하여 그 수술과 사망과 사이의 인과관계를 입증하지 못한 이상 손해배상책임이 없다.
118417,조합의 피용자는 홍수를 조절하기 위해 하류지역에 거주하는 주민들에게 사전에 통보하고 어린이가 저수지에서 방류된 물살에 휩쓸려 익사하는 등의 사고가 발생하지 않도록 미리 충분한 시간적 여유를 둬야 할 주의의무가 있다.
104314,사고 당시 을이 경영하는 판매업체에 출근하여 을이 제공하는 물건을 을경영 사업체 명의로 판매해 왔고 월말에 입금한 대금 중 일정비율의 금원을 지급받아 왔다.
122819,보험계약을 체결함에 있어 중요한 사항의 고지의무를 위반한 경우 고지의무 위반사실이 보험사고의 발생에 영향을 미치지 않았으며 보험사고의 발생이 불실고지한 사실에 의한 것이 아니라는 점이 증명되었다.
148922,택시회사인 甲 합자회사가 콜센터를 운영하는 乙과 콜서비스위탁계약을 체결하고 할부로 구입한 단말기를 이용해 콜서비스를 제공받고 있었다.
115134,지연손해금은 채무의 이행지체에 대한 손해배상으로서 본래의 채권채무관계를 규율하는 준거법에 의해 결정되어야 하며 소송촉진등에관한특례법 제3조 제1항 소정의 법정이율에 관한 규정은 법정이율에 관한 규정이다.
146178,교원소청심사위원회는 교원소청심사위원회의 소청을 심사하고 그 소청심사결정은 처분권자를 기속한다.
69625,甲이 타인에게 서비스표를 양도하기로 하는 내용의 계약을 체결하여 그 등록명의를 이전할 의무를 부담하고 있다고 하나 상표법상 서비스표에 대한 등록명의자로서 여전히 대외적으로 위 서비스표를 독점 사용할 권리를 가지고 있었다.
120813,문화센터 스포츠클럽의 영구회원으로 회원가입계약을 체결한 자가 구 문화센터 건물을 철거한 후 새로 개관한 신 건물 스포츠클럽의 시설에 대한 이용권을 주장할 수 없다.
74338,피고는 원고 명의로 소유권이전등기를 마친 부동산에 관하여 각 소유권이전등기말소 청구소송을 제기하여 승소확정됐다.
119873,건강진단검사의 일환으로 자궁암 검사를 담당한 의사 또는 간호사는 처녀막의 손상 가능성 등을 설명해야 할 주의의무가 있음에도 설명의무 위반으로 승낙권을 침해한 것이라고 위자료를 청구했다.
73920,민사소송법 32조 소정의 경우이외에는 당사자에게 이송신청권이 있고 민사소송법 32조 소정의 경우이외에는 당사자에게 이송신청권이 있다.
98975,도로운송차량 보안규칙이 좌석에 좌석안전벨트의 설치를 의무화한 이유는 불의의 사고가 발생한 경우 승객의 피해를 최소한도에 그치도록 하기 위한 것이다.
145939,농지매매증명은 농지의 소유권을 취득하기 위한 효력발생요건으로 당사자간 매매계약의 채권적 효력은 계속 존속하므로 자경 또는 자영의 의사는 농지에 대한 소유권을 취득하는 시점에서 더욱 필요한 것이다.
193862,소유권이전등기 말소등기의무의 이행불능으로 인한 전보배상청구권의 소멸시효는 말소등기의무가 이행불능 상태에 돌아간 때로부터 진행된다.
94265,교통사고로 입원치료 중인 환자에 대한 식사대도 광의의 입원비용에 포함될 수 있으며 이는 간호상 부득이 부수되는 비용으로서 가해행위와 인과관계가 있다.
199010,의무 없이 타인을 위하여 그의 사무를 처리하는 행위를 말하는 사무관리라 함은 의무 없이 타인을 위하여 처리한다는 관리의사가 없는 경우 사무관리가 성립될 수 없다.
215715,재판상의 자백은 상대방 당사자의 주장과 일치하는 자기에게 불리한 사실의 진술로서 적법하게 취소되지 않는 한 법원도 이에 기속되는 것이다.
74981,피해자가 사고를 당하여 상처를 입고 병원에 입원하여 계속 입원 치료를 받았고 그로 인해 사망하였다면 입원치료가 끝났거나 그가 사망한 때에야 그의 손해 사실을 알았다고 보아야 한다.
160234,토양환경보전법 제10조의3 제3항 제1호에서 토양오염을 유발시킨 자는 토양오염관리대상시설로 규정하고 있으며 토양오염관리대상시설이 토양오염의 원인이 될 것을 요건으로 한다.
120736,구 소련령 사할린 앞바다에서 격추된 대한항공 007기 승객 및 승무원의 유족이 대한항공을 상대로 제기한 손해배상소송이 불제소합의에 반하여 제기되었다.
102636,의료사고에 있어서 의료종사원의 과실은 일반적 보통인을 표준으로 하여 요구되는 주의의무를 결한 것이다.
115777,자동차손해배상보장법 제3조에서 자기를 위하여 자동차를 운행하는 자는 그 운행으로 말미암아 다른 사람을 사망하게 하거나 부상하게 한 때에는 손해를 배상할 책임을 진다고 규정하고 있다.
207431,국가배상법 제9조의 규정에 의해 배상결정신청을 한 때부터 3월이 경과한 때라야 제소할 수 있다는 전치주의에 관한 제소요건을 갖추지 못한 원판결은 위법하여 파기되어야 한다.
183634,증권관련 집단소송의 소송허가절차에서 대표당사자가 소명할 대상 및 손해배상책임의 성립 여부 등이 소송허가절차에서 심리할 대상인지 여부와 손해배상청구의 원인이 되는 행위 등에 대해 심리할 수 있는지 여부 등이 있다.
168274,구치소 공무원들이 시국 사건으로 수감되었던 사람의 전향수기를 甲 등의 항의를 받고 회수한 사안에서 구치소 공무원들이 甲 등에 대하여 사상·양심의 자유를 침해했다고 보기 어렵다.
200839,임차인이 임대차계약의 목적에 따라 사용·수익하지 아니하여 실질적인 이득을 얻은 바 없는 경우에는 임대인에게 손해가 발생해도 임차인의 부당이득반환의무는 성립되지 않는다.
81302,일반 공물에 대하여 특허 또는 허가를 받지 않고 하는 일반사용은 공공목적을 위한 개발 또는 관리·보존행위를 방해하지 않는 범위 내에서만 허용된다.
74710,시효중단사유로서의 채무의 승인은 채무자가 채권자에 대하여 하여야 하는 것이므로 대한보증보험주식회사가 원고에게 보증보험금을 지급한 사실만 가지고는 피고회사가 위 채무를 승인한 것이라고 볼 수 없다.
109831,형사사건의 위증자에게 형사사건의 위증자가 유죄판결을 받지 않았더라도 불법행위로 인한 위자료지급책임을 인정한 사례는 불법행위로 인한 위자료지급책임을 인정한 사례이다.
154792,피해에 대한 손해 배상을 받고자 제소할 때 피고들이 부당한 응소 와 부당한 상소를 통해 항쟁하였기 때문에 변호사에게 소송수행을 위임하게 되었다.
120576,무면허운전 중에 발생한 사고는 보상하지 않기로 하는 약관에 따라 보험금지급대상에서 제외되었다면 실질적으로 무보험차량과 다름이 없다.
155312,갑이 을을 대위하여 병에게 병의 부동산에 대한 소유권이전등기 절차를 직접 이행하라는 청구의 승소판결이 확정되었더라도 제 3자에게 소유권을 넘겨버려 이행불능이 된 경우 갑은 손해배상을 청구할 권리는 없다.
70768,상표의 등록이 타인의 상품과 혼동을 일으키게 하거나 영업상의 시설이나 활동과 혼동을 일으키게 하여 상표권을 취득하는 경우에는 상표법에 의한 적법한 권리의 행사라고 인정할 수 없다.
201059,"위탁직 징수원도 한국방송공사에 대해 실질적인 사용종속관계에 있는 근로자에 해당되며 근로기준법 제28조 제2항은 하나의 사업 내에서 직종, 직위, 업종별로 다른 퇴직금제도를 두어 차별하는 것을 금지하고 있다."
199083,주식회사를 설립하고 그 상호를 계속 사용하는 경우에는 출자의 목적이 된 영업의 개념이 동일하고 법률행위에 의한 영업의 이전이란 점에서 영업의 양도와 유사하다.
114575,제1심이에서의 당사자 표시 변경이 당사자 표시정정에 해당하는 것으로 항소심이 임의적 당사자 변경에 해당하여 허용될 수 없는 것이라고 잘못 판단하여 소송당사자 아닌 자를 소송당사자로 취급하여 변론을 진행시키고 판결을 선고한 경우 진정한 소송당사자는 상고를 제기할 것이다.
105900,소송에 유리한 자료로 제출하기 위해 소송중에 작성된 증거라 하여 배척한 조치가 채증법칙에 위반된다고 본 사례다.
85609,민법 제630조 제1항은 임차인이 임대인의 동의를 얻어 임차물을 전대한 경우 전차인은 임대인에 대한 차임의 지급으로 임대인에게 대항할 수 없다고 규정하고 있다.
194577,병원은 휴대품 등의 도난을 방지하기 위한 적절한 조치를 강구해 줄 신의칙상의 보호의무가 있다.
118939,대한적십자사가 장차 수혈에 사용될 혈액에 대해 세균감염을 피하기 위해 밀봉하여 각 병원에 공급하고 혈액을 공급받은 병원 역시 2차적인 세균감염의 위험 때문에 곧바로 환자에게 수혈할 수밖에 없다.
193200,자본시장법 제176조 제3항을 위반하여 타인에게 손해를 입힌 경우 상당인과관계가 있는 범위 내에서는 민법 제750조의 불법행위책임을 지게 된다.
199591,상호신용금고법 제12조의 규정 취지는 특정인에 대한 과대한 편중여신을 규제함으로써 여신의 기회를 주고자 하는 것이다.
103168,"처분문서의 진정성립이 인정되는 이상 법원은 특별한 명시적, 묵시적 약정이 있는 사실이 인정될 경우 기재내용과 다른 사실을 인정할 수 있다."
76602,행정관청이 버스운송사업면허양도 인가시 채무일절을 양수인이 승계할 것을 조건으로 하였다 하더라도 양수인이 양도인의 채무를 승계하는 사법적 효과가 발생하는 것은 아니다.
