number,contents
95942,갑 학교 법인 이사 이사장 자격 법인 이사회 결의 무효 확인 을 하 여 수행 중 사망 하   동 이사 이사장 지위 일신 전속권 으로서 상속 대상 되   없 다   
75190,재단사 양복점 경영   세 끝나   까지 가동 하   있 으며 기업 경영자 사망 인하   일실 이익 을 먼저 공 제한 잔액 다시 기업 자본 적 수익 을 공제 하   액 다   
95903,입증 책임 있 당사자 입증 을 촉구 하 기 위하 어 행사 하 것 지 독립 하   항변 사유 시사 하 여 제출 을 권유 하 행위 변론 주의 원칙 위배 되 것 다   
95856,동일 부동산 어 동 일인 명의 소유권 보존 등기 중복 되 어 있 뒤 경 료 되   보존 등기 실체 관계 부합 하 가리   것 없이 무효 므로 각하 하   등기 공무원 처분 위법 하 다   
95824,호주 후손 없이 사망 하 여 무후 가가 되 고 상속인 없 어 상속 재산 근친자 또 리   동 소유 귀속 되   무후 부흥 을 위하   사후 양자 선정 되 었 하 더라도 호주 유산 을 소급 하 여 상속 하   권리 없 다   
212051,호주 아니   남자 처 딸 만 을 남기 어 두고 사망 하 었 을 처 만이 재산 상속 을 하  다는 것 우리나라 관습 다   
95825,명의 수탁자 사망 하 면 명의 신탁 관계 재산 상속인 과의 사이 존속 하  다   
144647,토지 매매 하 면서 공장 부지 진입 도로 부지 편입 되 지 아니하   부분 토지 매도인 원가 반환 하  다는 약정 일종 해제 조건부 매매 라고 보   없 다   
95760,  저   항 단서   호주 상속인 상속분 가산 규정 의거 하 여 고유 상속분   할 을 가산 하   것 위법 하 다   
75176,진정 속인 잠 칭상 속인 을 상대 하   뿐 만 아니 라 상속 재산 을 양수 하   저   상대 말소 등기 절차 이행 을 구하   상속 회복 청구권 단기 제척 기간 적용 되  다   
75169,연대 보증인 중   채권자 어 채무 일부 변제 하 였 다 하 여도 주 채무자 어 별도 진행 되 시효 중단 사유 되  다고 보   없 다   
95691,공유물 분할 승소 확정 확정 원본 멸실 되 어 강제 집행 필요 하   집행문 을 받 을 없 등 특별 하   사정 없 동일 하   소 하   소 이익 없 다   
95700,구 민 법하 친족회 후견인 을 선임 하   후견 감독인 을 선임 하 어야 하 고 후견인 피 후견인 이익 상반 되 행위 여 후견인 을 대리 하 어야 하  다   
75160,안내양 운전 보조자 아니 므로 자동차 보유자 자동차 보유자 손해 배상 책임 있 다   
75153,연금 불법 행위 이유 배상 을 명하   이익 라고 보   없 으며 불법 행위 이유 배상 을 명하   이익 라고 보   없 다   
75149,공유자   단독 기한 확인 소 부 적법 하 여 각하 하   것 다   
75150,사건 불법 행위 인하   피해 보상금 공탁 하   공탁금 을 이의 유보 하 지 아니하   채 수령 하 였 으면 공탁 수락 하 고 수령 하 였 보   것 므로 피해자 손해 배상 청구권 소멸 하 었 하   것 다   
75146,가하 어 자가 자동차 종합 보험 가입 하   보험 약관 정하 일정 하   한하 여 피해자 보험 회사 직접 보험금 을 하   있 다   
75133,소 외인 부탁 받 범위 넘 어 다른 곳 무단 운행 하 다가 사고 내   외형 적 승용차 차주 위하 여 운행 되 었 보 아야 하  다   
95630,  소정 상속 재산 처분 후의 피인 지자 청구권 기하   것 라면 지연 손해금 채권 상속 회복 청구권 확장 다   
95585,진정 속인 참칭 상속인 부 터 상속 재산 을 양수 하   저   상대 등기 말소 하 상속 회복 청구권 단기 제척 기간 적용 되  다   
75111,묘소 석물 을 설치 하 기 위하 어 지출 하   비용 보통 인의 장례 치루   있 어 소요 되 당하   범위 벗어나   것 특별 하   손해 다   
75106,피 참가 인의 상대방   원고 여 자기 하 결과 되 어 보조 참가 성질 받아들이   없다 고 하  다   
75107,염화 카 리 혈관 주사 하   있 어서 환자 혈액 을 검사 하   적당 하   양 을 주입 하 어야 하 고 시간당 주입 량 일정 하   기준 을 넘 으면 위험 하 기 때문 점적 형식 주사 을 택하 어야 하  다   
95547,진정 하   상속인 임 을 전제 잠 칭상 속인 을 상대 등기 말소 하 소유권 지분권 귀속 원인 을 상속 주장 하 고 있 이상 원인 여하 불구하 고   소정 상속 회복 소로 보 아야 하  다   
74926,환지 전후 통하 어 종전 토지 환지 토지 계속 소유 의사 로서 평온   공연 하 게 점유 사용 하   환지 토지 여 취득 기간 만료 인하   소유권 이전 등기 청구권 발생 하  다고 보   있 다   
95466,불법 행위 사망 하   피해자 상속인 각자 손해 배상 하 고 가집행 선고 부   심 기하 어 각기 강제 집행 을 하 었 다면 가지급 물의 반환 채무 연대 채무 아니 라 각자 별도 부담 하 고 있 채무 다   
95467,부동산 소유권 명의 신탁 관 계가 해지 되 더라도 수탁자 등기 남 아 있 수탁자 상속인 소유권 을 적법 하 게 상속 취득 하 여 이르   저   유효 하 게 처분 하   있 다   
74916,도로 중앙 선상 교통정리 하 교통 순시원 안전 하   장소 교통정리 하여 자신 안전 을 도모 하   주의 의무 있 음에도 차량 접근 을 피하 여 뒷걸음치 다가 이건 사고 당하 었 다   
74915,대지 매도인 매수인 소유권 이전 등기 절차 이행 하   의무 있 기 때문 대지 건물 을 소유 하 저   여도 대지 소유권 을 내세우 어 철거 구하   없 다   
95460,농지   상속 일반 상속 순위 나 등   원칙 전적 배제 되 것 아니 며 일반 상속 순위 나 등   원칙 전적 배제 되 것 아니 다   
74901,원고 은행 대여금   지연 이자 채권 동일 하   성질 채권   년 간 행사 하 지 않 으면 소멸 시효 완성 되  다   
74897,  저   항 점유 기간 산입 하   있 점유 기간   저   항 점유 기간 산입 하   있 다   
74891,개간 준공 되 지 아니하   토지   개간 준공  가 중대 하 고 명백 하   하자 기인 하   무 효 행정 처분 다   
74883,거시 증거 변론 자격 조건 일의 정밀도 난이도 등 비추 어   세 마치   까지 종사 하   있 다는 사실 을 하   있 다   
74880,망 소외   사망 하   까지 원고 종중 발전 새 산소 설치 위하 어 물심 양면 노력 하   원고 계약 해제 의사 표시 신의 성실 원칙 따르 아 효력 을 발생 하   있 다   
95270,부칙   저   항 소정 재산 상속 개시 되 라 하   피 상속인 실종 선고 재산 상속 개시 되 다   
95262,등기 명의 승계 취득 사실 을 주장 입증 하 지 못하 등기 원인 무효 다   
95224,사후 입양 인하 어 호주 상속 개시 되 지만 재산 상속 개시 되 것 아니 므로 구민법 시행 이전 사망 하   피상 속 인의 유 처가 상속 받 이상 원고 신민법 시행 이후 사후 양자 입양 하 였 하 더라도 승계 받 을 없 다   
95231,징발 보상금 산정 기준 되 징 발대 토지   과세 표준 을 제출 하 지 않 아 원고 배척 하   것 심리 미진 위법 있 다   
95192,구 관습법 조상 분묘 수호 관리 하 고 소유 하 권리 종손 있 지만 종가 종손 사망 하 여 절 가가 되   차종손 순차 아 종손 의하 어 종가 조상 제사 분묘 수호 권이 상속 되  다   
95235,취득 시효 되 소유 의사 점유권 원의 성질 의하 여 결정 하 거나 점유자 소유자 여 소유 의사 있 다는 뜻 을 표시 하   되   있 다   
74871,일자무식   세 고령 임 을 이용 하 어 싯가   분   못 미치 가격 매수 하 였 고   개월 전매 기도 하   것 매도인 경솔 무경험 의하   것 다   
95172,관습 의하 면 절 가가 되   망 호주 유산 근친자 귀속 되  다   
95131,공동 상속인 건물 철거 의무 성질 불가분 채무 다   
150171,각 소유 소유권 전등 기가 가사 피고 중   의하 여 위조 되   문서 이루어지 었 다 하 더라도 각 소유권 이전 등기 유효 하 다   
74857,갑 원고 가사 대리권 있 고 양 금액 적정 가격 되 사건 있 어서 객관적 보 아서 갑 대리권 있 믿 을 만하   정 당하   사유 되  다   
74852,망인 원양 어선 기관장 어로 작업 종사 하 다가 귀국 하   으로써 어기 종료 되 어 고용 회사 계약 관계 종료 되 면 고용 회사 다시 고용 계약 을 체결 하 기로 되 어 있 다   
95073,사망 하   사람 을 상대 무효 고 트 어 잡 아 이루어지   소유권 이전 등기 특별 하   사정 없 부적 하   등기 다   
74846,미 상환 농지 상환 완료 정지 조건 하 매매 계약 분배 농지 수분 배자 자신 소유권 을 취득 하 것 을 정지 조건 하 유효 하 다   
74844,동일인 소유 속하   라도 동일인 소유 속하   라도 대지 저   양도 되 어 소유권 이전 등기 까지 되 어 버리   관습 의하   정지 상권 을 주장 하   없 다   
74845,시운전 중 야기 되   이건 사고 어 배상 책임 있 으며 시운전 중 야기 되   이건 사고 어 배상 책임 있 다   
74837,을 명의 소유권 전등 기가 경 료 되   등기 용지 폐쇄 되 고 을 명의 소유권 전등 기만 전사 되   말소 구하   이익 없 다   
94994,가정 심판권 전속 관할 속하 것 라 하   없 고 부산 지방   항소 로서 대구 고등 계속 하 게 되 었 다   
74997,신민법 시행 피 상속인 사망 하   남자 없 고 여자 모두 출가 하여 양자 없 유산 출가 녀 귀속 하 것 관습 다   
74992,임야 대장 상의 원고 명의 직권 말소 되 고 소유 자란 공란 되 어 있 어 소유권 보존 등기 위하   임야 대장 등본 을 얻 을 없다 고 주장 하 본건 있 어 국가 상대 소유권 확인 소 하   이익 있 다   
74986,농지 개혁 법상 농지 분배 받 을 있 농가 라 함 미성년 라 하  지라도 가족 농업 종사 하 여 농지 경작 하 이상 농가 보 아야 하  다   
74983,명인 저   하여금 권리 취득 사실 을 명확히 인식 하 게 하   있 공시 을 갖추 어야 하  다   
74980,가정의례 준칙 따르 면 장례 특단 사정 없   일 장 을 하 도록 되 어 있 점 등 비추 어 음식 대 등 소비 되   금액 불법 행위 상당 인과 관계 있 손해 라고 보   없 다   
74977,비 법인 사단 총 유적 귀속 되   재산  데 등기 명의 만 을 구성원 명의 신탁 하 였 다면 재산 처분 여 집행 기관 의사 만 결정 하   없 으며 회원 결의 의하 어야 하  다   
74974,농지 개혁법 시행 당시 비자 경 농지 었 하 더라도 이르   증여 하   자가 무효 주장 하 것 신 성실 원칙 어긋나  다고 하   있 다   
74970,  저   항 소 정의 출연 재산 법인 성립 되   부터 법인 재산 되 규정 출연 재산 부동산   이전 등기 청구권 을 가지 게 되  다는 뜻 풀이 되  다   
74971,매매 행위 꺼리 소유자 나 상속인 을 유혹 하 어 배임 행위 가담 하 여 수하 었 다면 매매 행위 반 사회적   법률 행위 로서 사회적 타당성 결여 되 어 무효 다   
94906,민사 주문 당사자 인용 하 고 배척 하 것   가르   이유 대조 하 여 짐작 하   있 을 정도 표시 하 면 충분 하 다   
94894,포괄적 유증 채무 까 지 포괄 하 상속 재산 전부 일부 유증 을 말하 것 므로 포괄적 증자 재산 상속인 동일 하   권리 의무 있 다   
74952,상속인 없이 사망 하   자의 재산 구 관습법 따르 아 근친 귀속 되   원래 분묘 소유권 이나 수호 관리 제사상 속인 전속 되 것 므로 분묘 수호 계약 사자 재산 근친 귀속 되   으로써 종료 되  다   
74948,불 제소 특약 위반 하 여 되   소 권리 보호 이익 없 어 부적 법하 다   
228163,소유권 이전 등기 청구권 소멸 되 었 다 고 하   것 변론 주의 원칙 위배 내지 소멸 시효   법리 오해 위법 있 다   
94805,특별 하   사정 없 토지 지목 답 도로 변환 되   사실 만 가지 고 시가 도로 부지 소유 의사 점유 하 었 보   없 다   
94798,민사 소송법   강제 집행   저   이의 소 이미 개시 되   집행 목적물 어 소유권 기타 목적물 양도 나 인도 저지 하 권리 주장 하   으로써 배제 구하 것 어야 하  다   
74934,망인 남편   원고   사고 발생 당시 현장 있었 고 망인 보호 무자 므로 의무 게을리 하   과실 상계 하   것 이나 다른 원고   세 이하 연소 자라 보호 의무 있 보 기 어렵 다   
214029,호주 아니   가족 사망 인하   재산 상속 직계 비속 평등 하 게 공동 상속 하 며 상속권 없 서출 자녀 적출 자녀 반 을 상속 하 것 우리나라 관습 다   
214043,  의하 면 공동 상속 재산   관리인 을 선임 하   공동 상속인 중 관리인 을 선임 하 여야 하  다   
94746,시효 취득 효과 점유 개시 하   소급 하 므로 시효 완성 되   이상 점유 승계 되   점유 기간 취득 시효 기간 미달 되 었 하여   관계 있 어서 시효 취득 효과 부인 하   바 아니 다   
94747,국가 부동산 매각 인하   손해 배상 책임 원인 되 위법 사유 세무서 장의 공매 처분 당시 있 었 하 어도 매수인 손해 발생 부동산 어 말소 명하   확정 되   비로소 전득자   손해 배상 책임 발생 하 었 다   
94721,구 민 법하 우리나라 관습 호주 아니   가족 사망 하   유산 상속 남녀 관계 없이 동일 가적 내 있 직계 비속 평등 하 게 상속 되  다   
94654,소 이익 없 다는 이유 소 각하 하  다고 하 지 아니하 고 기각 하  다는 을 하   본안   기판력 발생 하 것 아니 므로 파기 사유 주장 하   없 다   
204198,  저   항 동일 가적 내 없 여자 여 상속분 을 현저 하 게 낮추 고 있 것 출가외인 라는 옛 관념 이산 되 것 을 적 게 하 려는 의도 연유 되   것 다   
77195,광업소 낙반 사고 부상 을 입 자가   사고 사망 하   조건 적 관계 존재 하 지 않 으면 저   사고 가해자 피해자 사망 하   까지 손해 만 배상 하 면 되  다   
74219,소유권 이전 등기 의무 지 고 있 소외 홍 광 표 자신 지배 하 고 있 피고 회사 이르     중 매도 하 였 다면 피고 회사 배임 행위 가담 하   것 라고 봄 상당 하 다   
74709,장래 가득 수익 을 산출 하   있 어서 수익 상실 자가 사고 당시 직장 일평생 종사 하  다는 절   제하 계산 하 것 아니 라 장래 적어도 정도 수익 일 얻 을 있 추정 하 어야 하  다   
74706,피고 점유 하 공작물 설치 보존 상의 하자 인하 어 두 개강 내출혈 상해 입 고 사망 하 게 되   것 면 공작물 설치 보존 상의 하자 인하   것 다   
74703,피해자 타 었 더   택시 사고 나 바람 안면 가벼운 부상 을 입 고 다시 도로 올라오 아 차 잡 기 위하 어 도로 노변 서 어 있 는데 진행 하 더   차 급정거 하여 피해자 등 을 들이받 과실 상계 하   잘못 없 다   
94580,농지 개혁법 시행 매매 소유권 이전 등기 하 더라도 소재지 관서 농지 매매 증명 필요 없 다   
74701,임야 여 소유권 을 주장 하 자가 임야 대장 상의 소유자 란 공란 기 때문 보존 등기 하 기 위하   소유권 증명 때문 라면 국가   확인 을 구하   이익 있 다   
94573,재산 을 타인 신탁 하   대외적   관계 있 어서 수탁자 만이 재산   저   침해 어 배제 구하   있 다   
94551,확정 기판력 각 등기 청구권 존 부에 만 미치 것 며 부동산 소유권 자체 까지 미치 것 아니 다   
74697,매매 계약서 목적물 평수 대금 확정 되 어 있 지 않 더라도 사용 일 을 정하 고 대금 접지 지가 따르 아 객관적 결정 되   있 목적물 대금 추후 확정 되 것 을 조건 매매 본계약 라고 보 아야 하  다   
74699,사위 의하 어 소유권 전등 기가 경 료 되   등기 기초 되   적법 하 게 송달 되   바 없 어 이에 대한 항소 기간 진행 을 개시 하 지 않 다   
74696,경찰관 숙직실 취침 중 숙직실 방 바닥 틈 사이 연탄 가스 중독 되 어 사망 하 였 다면 국가 손해 배상 하   책임 있 다   
74693,부동산 소유권 이전 등기 말소 당사자 아니   저   말소 확정 부동산 등기법   저   호 임 을 내세우 어 소유권 이전 등기 경 료 하   없 다   
74694,유동 목마 같 놀이 기구 설치 하 손잡이 같 것 을 부착 시키 어 떨어지 등 일 없 도록 하 어야 하 며 떨어지 거나 넘어지 더라도 다치 일 없 도록 설치 하 어야 하  다   
74681,임대차 계약 기간 종료 되 고 피고 각 건물 을 소유 하 고 있 고 원고 임대차 계약 갱신 을 원하 지 않 아 원   피고 사이 매매 계약 성립 되   것 같 효력 발생 되 었 다   
74680,사고 당시 생업 종사 하 면서 얻 고 있 더   수익 농촌 일용 임금 미달 하   농촌 일용 임금 을 손해 배상 산정 기준 하   없 다   
94387,노무 급 형식 을 빌리 어 광업권 광부 사이 도급 업자 개재 시키 어 놓 았 다 하 더라도 실질적 일면 광업권 고용 계약 을 맺 광업권 노사 계약 직접 책임 을 질  다   
74679,부동산   소유권 전등 기의 말소 명하   확정 되 고 부동산   소유권 전등 기의 말소 명하   확정 되 면 말소 등기 청구권 처음 부터 없 었 더   것 되  다고 하   것 다   
74676,부동산 을 현물 분할 하   없 거나 현물 분할 을 하   경제적 가액 감손 되   염려 있 을 이르   현물 분할 하 기 보다 경매 애 부치 어 매득금 을 각 공유자 분배함 상당 하   다   
94346,호주 상속 하   남자 없이 호주 사망 하   조모   모   처 순서 재산권 상속 되 것 시행 우리나라 관습 다   
214119,구 관습법 상속권 있 여자 상속 개시 사실상 재혼 을 하 였 다 하 더라도 호주 사망 하   가적 을 이탈 하   사실 없 이상 호주 상속인 신분 을 상실 하 지 않 다   
74671,채무자 사해 행위 취소 악의 전득자   관계 있 어서 말   상대적 취소 하 것 므로 동 취소 피고 재산 상속 포기 일신 전속 적 권리 다   
74665,매매 목적 물이 경매 의하 어 저   경락 되   으로써 소유권 이전 등기 의무 이행 불 능이 되 었 고 인하   손해 배상 범위 경락 당시 싯 라 하   것 다   
94308,망인 유 처 망인 묘 비대 로서   만 원 을 지출 하   것 사회 통념 상당 하 고 우리나라 종래 풍속 비추 어 유족 조객 이나 분묘 등 설치 종사 하   인부 식사   주류 대 로서 금   원 을 지출 하   것 손해 보   있 다   
94318,동일인 소유 었 더   토지 지상 건물 소유권 분리 되 어 건물 소유자 관습 정지 상권 을 취득 하   임대차 계약 을 체결 하 고 임차권 을 취득 하   관습 정지 상권 을 포기 하   것 보 아야 하  다   
94295,민사 소송법   저   항   호 소 정의 형 사상 처벌 받 을 타인 행위 인하   사유 준재 심사 유 되   있 것 당사자 화해 의사 표시 하 게 되   직접적 원인 되   하   것 다   
74658,원고 사건 계쟁 부동산   공동 상속인 지위 있음 을 전제 부동산 전체   상속권 을 주장 하 피고   관계 있 어서 피고 상속권   소극적 확인 을 구하  다   
74650,피 용인 과실 순차 복합적 경합 되 어 피해자 사망 하   피 용 공동 불법 행위 발생 하   소해 연대 하 여 배상 하   책임 있 다   
74646,장래 상속 개시 되  다면 상속인 되   지위 있음 을 내용 하 권리 라고 하 것 권리 로서 효력 약하   일종 희망 내지 기대 불과   
94245,동법   저   항 기간 내 분배 되   농지 제외 하   외의 농지 국가 매수 조치 해제 되 어 원 소유자 소유 복귀 되  다   
74641,  의하 면 분묘 등 소유권 호주 상속인 승계 되 며 관리 처분권 역시 호주 상속인 승계 되  다   
74642,을 회사 소유 자동차 개인적 빌리 어서 갑 회사 직원 구성 되   친목 단체 야유회 위하 어 제공 하   운행 인하   사고 갑 회사 자동차 손해 배상 보장 법상 손해 배상 책임 없 다   
74639,공유물 분할 소 취하 하   있 어서 일부 당사 자로 부터 일부 당사자   소의 취하 상대방 동의 있 더라도 효력 없 다   
74637,원고 직접 점유자   점유 이전 금지 가처분 결정 을 받 아 집행 까지 하 였 하 더라도 통지 하 지 않 이상 시효 중단 효력 없 다   
74625,처분 권한 없 세무 서 장 부터 귀속 임야 매수 하 여 이르   타 매도 하   원고 국가   손해 배상 청구권 존재 범위 구체적 확정 되 었 하   것 므로 그때 비로소 손해 알 았 보 아야 하   것 다   
74626,채무자 상속인 일정 하   상속 재산 한도 내 상속 한정 승인 신고 하 였 다면 상속인 대한 승계 집행 문 을 부여 받 았 다 하  지라도 상속인 고유 재산 여 집행 을 하   없 다   
74624,소외 양인 복부 자창 을 수술 치료 하   있 어서 피고 양동 규 사이 일체 이의 없 다는 내용 약정 을 하   사실 되 나 의사 고의 나 과실 없 책임 을 묻 지 않 겠 다는 까지 포함 되   것 라고 하   없 다   
94202,호적 부의 기재 법률 기재 적법 히 되 었 고 기재 사항 진실 부합 되 것 라는 추정 을 받 으나 동 기재 반하 증거 추정 을 번복 하   있 다   
94204,타 매도 되   부동산 공동 상속인 중 자기 이외 상속인 상속 지분 을 매수 하 여 이전 등기 마치   특단 사정 없 다른 상속인 부동산 매수인   의무 승계 하  다고 보   없 다   
74620,금   원 을 지급 하   소유권 전등 기절 이행 동의 하 의사 표시 하   것 의제 하 기로 법률 관계 창설 적 확정 하   것 다   
94139,수분 배자 종전 토지   소유권 을 잃 고 분배 받 토지 위하 여 주어지   환지 의하   신 토지 소유권 이전 되  다   
74531,공유물 을 분할 하   있 어 공유 토지 일부 피 고등 선대 분묘 제각 등 설치 되 어 있 부분 토지 부분 을 분할 하여 공유 존속 시키 고 나머지 토지 공유자 별로 개별 분할 토록 하  다   
74532,공동 명의 수탁자 사이 매매 수탁자 저   사이 대외적   매매 달리 신탁자 여 실질적   소유권 을 취득 하 것 아니 다   
214143,  저   항 소정 제척 기간 적용   저   항 소정 제척 기간 적용 을 받 다   
94115,유증 하   재산 개별적 표시 되 었 다는 사실 만 특정 유증 라고 단정 하   없 다   
74521,오토바이 타 면서 안전모 착용 하 지 않 피해자 과실 사고 있 어서 손해 확대 되 게 하나 원인 보태 어 지 었 하   있 다   
93995,농지 개혁법 시행 당시 원고 상속 하 여 등기 까지 되   비자 경농 지가 소작인 수배 되   사실 없 다면 농지 개혁 사업 정리   특별 조치법 비추 어 특별 사정 되  다   
74513,토지 대장 을 편제 하   있 어서 소유 자란 을 공란 남기 어 두 었 하 어도 소유권 을 부인 하 거나 다투 것 아니 다   
74508,부동산 매매 있 어서 매수인 목적물 을 인도 받 아 점유 하 고 있 소유권 이전 등기 청구권 시효 의하 여 소멸 되   없 다   
93962,형 망제 급 원칙 형 미혼 중 죽 었 을 원칙 고 형 자식 있 대 습 상속 을 하 게 되  다   
93868,구 아래 호주 사망 하 고 호주 상속 하   남자 없 으면 망 호주 사후 양자선 정권 저   차 망 호 주의 유 처 있 다는 것 관습 다   
74475,구민법 시대 관습 의하 면 호주 상속 재산 상속 수반 되 고 여호주 사망 하   여호주 사망 하   피 상속인 특유 재산 본 족 귀속 하  다   
74472,지적법     동법 시행령   규정 의하 면 토 지대 장이 멸실 되   군수 지체 없이 토지 대장 을 복구 하 어야 하나 소유자   사항 부동산 등기 나 확정 의하 지 아니하 고는 등록 하   없 다   
74463,사업 경자 소득 노무 활동 등 사업 기여 출자 하   자본 등 합하 여 생기   것 므로 피해 입 경 우의 일식 이익 사업 소득 출자 하   자본 인하   소득 을 공제 하   나머지 기준 산정 하   것 다   
74462,매매 계약 을 있 어 매도인 계약금 배액 을 상환 하 조건 매매 계약 을 해제 하   있 도록 약정 되   매도인 매매 계약 을 해제 하 려면 상대방 이행 착수 하 기 계약금 배액 을 상환 하 어야 하  다   
74455,규정 의하 여 정하 여 지   친권자 이해 관계인 임의 변경 하   없 다는 약정 무효 라 하   것 다   
74451,주택 공사 사가 아파트 내부 시설   보수 관리 책임 을 입주자 부담 하 기로 특약 있 었 하 더라도 주택 공사 로서 주택 건설 촉진법     동 시행령     동시 행 규칙   의하 어 업무 수행 하   법률 의무 지 고 있 다   
74450,신원 보증인 신원 본 인간 친인척 관계 있 신분 관계 비추 어 같 통지 있 었 하 더라도 신원 보증 계약 을 해제 하 였 으리라 고 보이 지 않 다   
