number,contents
194113,"[ 1 ] 채권자 아니 ㄴ 저 3 명의 근저당 권 설정 등기 ( 한정 유효 ) < br / > [ 2 ] 무효 등기 유용 관하 ㄴ 묵시 적 합의 내지 추인 되 < br / > [ 3 ] 근저당 권 설정 등기 채권자 아니 ㄴ 저 3 명의 경 료 되 ㄴ 채권자 근저당 권이 부기 등기 경 료 받 , 근저당 권 설정 등기 실체 관계 부합 하 는지 ( 한정 ) < br / > [ 4 ] 채권자 아니 ㄴ 저 3 명의 근저당 권 설정 등기 경 료 되 ㄴ 부동산 소유권 이전 청구권 가등 기가 경 료 되 고 다시 채권자 명의 근저당 권이 부기 등 기가 경 료 되 ㄴ , 근저당 권 설정 등기 실체 관계 부합 하 유효 하 ㄴ 등기 라고 보 ㄹ 없다 고 하 ㄴ < br / > "
116233,[ 1 ] 민사 소송법 422 저 1 항 7 호 소정 ' 증인 허위 진술 증거 되 ㄴ ' < br / > [ 2 ] 증인 허위 진술 영향 미치 었 는지 하 ㅁ 있 어서 재심 조사 되 ㄴ 증거 까지 종합 하 여 자료 삼 아야 하 는지 ( ) < br / > 
191717,"[ 1 ] 공공 용지 취득 손실 보상 관하 ㄴ 특례법 의하 ㄴ 협의 취득 무권리 자로 부터 이루어지 ㄴ , 진정 하 ㄴ 권리 자가 권리 상실 하 는지 ( ) < br / > [ 2 ] 무 권리자 처분 행위 ㄴ 권리자 추인 효과 < br / > "
200227,아 . 원고 종 중이 고유 종중 으로서 실체 가지 지 않 았 고 종중 유사 단체 아니 라고 하여 당사자 능력 부정 하 ㄴ 위법 라고 하 ㄴ < br / > 나 아 . 종중 원고 되 ㄴ 당사자 능력 결정 위하 여 취하 ㄹ 조치 < br / > 다 . 고유 종중 확정 되 ㄴ 원고 종중 성격 종중 유사 단체 변경 하 주장 가부 < br / > 라 . 원고 등기 말소 명한 확정 원고 동일인 ㄴ지 명백 하 지 알 니 하여 승계 집행 문 부여 소 외 별 소로 소유권 전등 기의 말소 구하 ㄹ 권리 보호 이익 부정 하 ㄹ 없다 고 하 ㄴ < br / > 
232569,"[ 1 ] 부동산 매매 계약 매수인 잔 대금 지급 기일 까지 대금 지급 하 지 못하 면 계약 자동적 해제 되 ㄴ다는 취지 약정 하 ㄴ , 지급기 일의 도과 사실 만 매매 계약 자동 해제 되 ㄴ 것 보 ㄹ 있 는지 ( 원칙적 ) 이때 지급기 일의 도과 사실 만 매매 계약 자동 해제 되 ㄴ 것 보 ㄹ 있 < br / > [ 2 ] 甲 주식회사 乙 공동 주택 신축 사업 영위 하 기 위하 어 필요 하 ㄴ 乙 소유 토지 매수 하 매매 계약 체결 하 ㄴ 다음 , 丙 지역 주택 조합 공동 주택 신축 사업 관하 ㄴ 권리 , 의무 포괄적 丙 조합 양도 하 내용 포괄 양수 계약 체결 하 였 는데 , 이후 丙 조합 乙 토지 ㄴ 매매 계약 체결 하 면서 ‘ 丙 조합 잔금 지급 기일 까지 잔금 지급 하 지 않 계약금 전액 乙 귀속 되 고 추후 협상 ’ 하 기로 하 특약 하 였 으나 , 丙 조합 乙 잔금 지급 기일 까지 잔금 지급 하 지 않 았 다가 나중 乙 잔금 일부 지급 하 고 나머지 금액 변제 공탁 하 ㄴ , 丙 조합 잔금 지급 기일 까지 잔금 지급 하 지 못하 ㄹ 乙 소유권 이전 등기 필요 하 ㄴ 서류 교부 등 반대 의무 이행 이행 제공 없이 매매 계약 실효 시키 기 위하 여 乙 丙 조합 특약 두 었 다 거나 , 丙 조합 매매 계약 자동 해제 감수 하 겠 다는 약정 하 였 다고 보 기 어렵 다고 하 ㄴ < br / > "
154454,특별 하 ㄴ 사정 없 법률 일반적 ㄴ 처분권 있 다고 되 소유 명의자 나 적법 하 ㄴ 대리인 부터 부동산 매수 하 고 현실적 ㄴ 인도 까지 받 매수인 매도 인의 매각 행위 법률 유혹 구비 하 ㄴ 것 ㄴ 까지 조사 하 ㄴ 의무 있 것 라 하 ㄹ 없 다 . < br / > 
190936,"[ 1 ] 분양 자가 아파트 상가 분양 하 면서 수분 양자 상가 분양 자만 슈퍼마켓 운영 하 ㄹ 있 도록 하 겠 다고 약 정하 고 , 나머지 상가 다르 ㄴ 수분 양자 분양 하 면서 타인 중복 되 업종 영업 하 지 않 고 이르 ㄹ 위반 하 ㄹ 분양 자가 계약 해제 하 ㄹ 있 다는 약정 받 , 분양 자가 슈퍼마켓 영업 보장 약정 상가 다른 점포 수분 양자 슈퍼마켓 판매 하 물품 중복 되 물품 판매 하 없 도록 하 여 주 겠 다는 아니 라 , 나머지 점포 저 3 분양 하 ㅁ 있 어 중복 되 업종 즉 슈퍼마켓 업종 분양 하 지 않 겠 고 다르 ㄴ 수분 양자 임의 슈퍼마켓 변경 하 ㄹ 분양 계약 해제 하 ㅁ 으로써 분양 자만 상가 슈퍼마켓 업종 독점적 운영 하 도록 보장 하 ㄴ 취지 라고 하 ㄴ < br / > [ 2 ] 아파트 상가 분양 계약 분양 자가 분양 자로 부터 독점 운영 약속 받 업종 ㄴ 이른바 ' 슈퍼 마켓 ' 의의 타인 영업 이에 하 는지 기준 < br / > [ 3 ] 분양 자가 아파트 상가 분양 하 면서 수분 양자 상가 분양 자만 슈퍼마켓 운영 하 ㄹ 있 도록 하 겠 다고 약 정하 고 , 나머지 상가 다르 ㄴ 수분 양자 분양 하 면서 타인 중복 되 업종 영업 하 지 않 고 이르 ㄹ 위반 하 ㄹ 분양 자가 계약 해제 하 ㄹ 있 다는 약정 받 , 분양 자가 임의 슈퍼마켓 업종 변경 하 ㄴ 다른 수분 양자 분양 계약 해제 하 ㄴ다는 통지 만 하 고 점포 명도 나 소유권 이전 등기 말소 등 후속 조치 취하 지 아니하 ㄴ 채 다른 수분 양자 슈퍼마켓 영업 방치 하 ㄴ 것 실제 분양 계약 해제 하 지 아니하 ㄴ 것 동일 이유 , 당초 분양 자가 특정 수분 양자 상가 슈퍼마켓 업종 독점적 운영 하 도록 보장 하 ㄴ 약정 이행 하 ㄴ 것 보 ㄹ 없다 고 하 ㄴ < br / > "
226787,"채권 조사 확정 재판 채권 조사 확정 재판 ㄴ 이의 소 어떠하 ㄴ 채권 회생 담보권 확정 하 , 동일 하 ㄴ 채권 회생 채권 확정 하 ㄹ 이익 있 는지 ( ) < br / > "
159784,"[ 1 ] 170 저 1 항 정하 ㄴ ‘ 재판 상의 ’ 지급 명령 신청 포함 되 는지 ( ) < br / > [ 2 ] 甲 乙 강간 등 혐의 고소 하 였 으나 오히려 이르 ㄹ 무고 하 ㄴ 검사 甲 무고 간통 혐의 기소 하 여 저 1 심 유죄 받 았 다가 항소심 상고심 무죄 선고 되 어 확정 되 었 고 , 甲 乙 상대 강간 등 불법 행위 따르 ㄴ 손해 배상금 지급 구하 지급 명령 신청 하 였 다가 각하 되 이로 부터 6 개월 내 손해 배상 소 하 ㄴ , 甲 손해 배상 구하 乙 행위 중 형사 재판 대상 되 ㄴ 행위 로서 강간 되 부분 ㄴ 손해 배상 청구권 소멸 시효 170 저 2 항 따르 아 지급 명령 신청 하 ㄴ 시점 중단 되 었 다고 하 ㄴ < br / > "
99986,회복 등기 추정 력 < br / > 
199263,"채무자 경매 진행 중인 부동산 대금 지급 기일 임박 하 여 최소한 경매 보다 낫 조건 처분 하 ㄴ , 채권자 대한 사해 행위 하 ㄴ 파기 하 ㄴ < br / > "
196961,[ 1 ] 물건 ㄴ 점유 임야 ㄴ 점유 이전 계속 기준 < br / > [ 2 ] 등 기부 취득 시효 선의 · 무과 실의 대상 무과실 입증 책임 < br / > [ 3 ] 매도인 부동산 처분 권한 있 는지 조사 하 지 않 매수인 부동산 점유 어 과실 있 는지 ( ) < br / > 
201442,아 . 무권리 자로 부터 토지 매수 하 ㄴ 자의 점유 성질 < br / > 나 아 . 농민 아니 ㄴ 사람 농 지르 ㄹ 시효 취득 하 ㄹ 있 는지 < br / > 다 . 농지 시효 취득 있 어서 농지 개혁법 19 저 2 항 적용 < br / > 
234065,항소심 쌍방 불 출석 의하 ㄴ 항소 취하 간 주가 적법 하 ㄴ 것 되 ㄴ < br / > 
200848,부동산 등기부 시효 취득 있 어서 점유 과실 없 다는 것 < br / > 
80222,[ 1 ] 본인 위하 ㄴ 것 ㅁ 표시 하 지 않 대리 표현 대리 법리 적용 되 ㄹ 없다 고 하 ㄴ < br / > [ 2 ] 756 소 정의 사용자 책임 ㄴ ' 사무 집행 관하 여 ' 기준 < br / > 
207636,입목 ㄴ 매매 계약 체결 하 ㅁ 있 어서 매도인 입목 ㄴ 소유권 매매 계약 동시 매수인 이전 하 여 주 ㄴ다는 의사 표시 하 ㄴ 잔 대금 지급전 라 하 ㄹ 지라 매수인 명인 실시 하 면 다른 특별 하 ㄴ 사정 없 매수인 입목 소유권 취득 하 ㄴ다 . < br / > 
69824,[ 1 ] 저 3 채무 자가 채무자 가압류 되 ㄴ 채권액 변제 하 지 아니하 ㄴ 사유 채권자 가압류 때문 아니 라 저 3 채무자 채무자 사이 가압류 되 ㄴ 채권 존부 채권액 관하 ㄴ 다툼 있 었 기 때문 라면 채무자 범위 내 채권자 부당 가압류 인하 ㄴ 손해 배상 책임 묻 없다 고 하 ㄴ < br / > [ 2 ] 저 3 채무 자가 채무자 가압류 되 ㄴ 채권액 지급 하 지 못하 ㄴ 기간 동안 ㄴ 지연 손해금 배상 책임 부담 하 채무자 채권자 부당 하 ㄴ 채권 가압류 인하 ㄴ 손해 배상 책임 묻 있 는지 ( ) < br / > 
112567,"아 . 취득 시효 완성 전후 국유 재산 매수 신청 하 고 관할 관청 무단 점유 인하 ㄴ 변 상금 이의 없이 납부 하 ㄴ , 자주 점유 추정 번복 되 었 다고 보 ㄴ < br / > 나 아 . 취득 시효 완성 관할 관청 무단 점유 인하 ㄴ 변 상금 이의 없이 납부 하 고 국유 재산 대부 계약 체결 하 ㄴ , 시효 이익 포기 하 였 다고 보 ㄴ < br / > "
210263,"[ 1 ] 경매 절차 입찰 물건 표시 목록 기재 되 ㄴ 물건 부합 되 거나 종 물 ㄴ 물건 경매 목적물 되 는지 ( ) < br / > [ 2 ] 공장 용지 지상 공장 ㄴ 부동산 임의 경매 절차 부동산 감정 평가 누락 되 ㄴ 전기수 설비 공장 종 물 로서 경매 목적물 되 어 경락인 소유권 취득 하 였 다고 하 ㄴ < br / > [ 3 ] 공매 절차 공매 재산 ㄴ 감정 평가 나 아 매각 예정 가격 결정 잘못 되 ㄴ , 매수인 공매 재산 소유자 ㄴ 관계 공매 재산 시가 감정 평가 액과 차액 부당 이득 하 ㄴ 것 라고 하 ㄹ 있 는지 ( ) < br / > [ 4 ] 공장 용지 지상 공장 ㄴ 부동산 임의 경매 절차 공장 ㄴ 종 물 ㄴ 전기수 설비 누락 하 고 감정 평가 이루어지 었 다고 하 더라도 경락인 취득 하 ㄴ 부동산 시가 감정 평가 액과 차액 상당 ㄴ 부당 이득 성립 하 지 않 는다고 하 ㄴ < br / > "
198918,"아 . 등기부 취득 시효 있 어서 등기부 소유 명의 자로 부터 매수 하 ㄴ 자가 과실 없 점유자 ㄴ지 < br / > 나 아 . 등기부 취득 시효 있 어서 편법 농지 매매 증명 받 아 소유권 이전 등기 하 ㄴ , 악의 점유 되 는지 < br / > "
187435,"甲 乙 은행 ㄴ 대출금 채무 여 丙 주식회사 근 보증 , 丁 주식회사 등 연대 보증 하 ㄴ 丙 회사 乙 은행 대출금 채무 대위 변제 하 였 는데 , 甲 乙 은행 부터 ‘ 대출 금 이미 상환 되 었 으니 丁 회사 상의 하라 ’ 고 안내 받 고 丁 회사 요청 丁 회사 명의 계좌 대출금 상당액 송금 하 ㄴ , 甲 丁 회사 ㄴ 대출금 상당액 지급 채권 준 점유자 대한 변제 로서 유효 고 보 ㄴ 법리 오해 위법 있 다고 하 ㄴ < br / > "
198891,"아 . 지방 자치 단체 공유지 점유자 사용료 납부 통지 하 고 불하 신청 거부 하 등 분쟁 있 었 다 하 더라도 , 점유 평온 · 공연 성 상실 되 거나 타 아 주점 유 되 지 않 는다고 보 ㄴ < br / > 나 아 . 국가 나 지방 자치 단체 국 · 공유지 점유자 사용료 부과 · 고지 하 ㄴ , 점유 취득 시효 중단 되 는지 < br / > 다 . 헌법 재판소 법률 ㄴ 위헌 결정 미치 사건 범위 위헌 결정 실효 되 ㄴ 구 지방 재정법 74 저 2 항 적용 받 더 ㄴ 잡종 재산 여 시행 일 이후 위헌 결정 선고 일 까지 취득 시효 기간 진행 되 지 않 는지 < br / > "
86688,귀속 재산 처리법 3 조의 법인 법인격 구비 하 지 아니하 ㄴ 조합 대표자 ㄴ 귀속 대지 매각 < br / > 
92023,농지 수분 배자 상환액 보다 더 많 토지 부분 ㄴ 소유권 이전 등기 절차 이행 구하 심리 하 여야 하 ㄹ 사항 < br / > 
129742,공유 토지 ㄴ 경계 확정 소 필요 적 공동 ㄴ지 ( ) < br / > 
102834,등기 부상 주소 다르 게 표시 되 ㄴ 등기 무자 주소 경정 대상 되 는지 < br / > 
118874,부동산 중개업 자가 중개 대상물 ㄴ 설명 의무 다하 지 아니하 ㄴ 것 보 ㄹ 없다 고 하 ㄴ < br / > 
95662,타인 토지 무단히 개간 경작 하 ㄴ 경작권 < br / > 
154940,농지 시가지 계획 구역 내 소재 하 고 환지 예정지 지정 있 었 다고 하 더라도 공사 완료 되 고 환지 처분 절차 어 침 기 이르 ㄹ 대지 라고 하 ㄹ 없 다 . < br / > 
161113,경락 인하 여 담보 부동산 소유권 상실 하 ㄴ 물상 보증인 채무자 부 터 구상 받 채권 범위 < br / > 
98861,아 . 등기부 멸실 따르 ㄴ 회복 등기 하 지 못하 ㄴ 부동산 처리 < br / > 나 아 . 일반 농지 소유권 이전 등 관하 ㄴ 특별 조치법 의하 ㄴ 소유권 보존 등기 적법 추정 < br / > 
200215,"아 . 565 소 정의 "" 이행 착수 하 ㄹ 까지 "" < br / > 나 아 . 매수인 중도금 지급 이행 착수 하 ㄴ 것 보 ㄴ < br / > "
107474,아 . 호주 ㄴ 갑의 사망 어머니 ㄴ 을이 호주 상속 하 였 다가 사후 양자 병 선정 하 ㄴ 사망 하 ㅁ 으로써 병이 사망 출가 하 ㄴ 딸 ㄴ 정 함께 재산 공동 상속 하 재산 상속인 동시 호주 상속 하 하 지 않 는다고 하 ㄴ < br / > 나 아 . 등기 공무원 실질적 심사 권한 유무 ( ) < br / > 다 . 상속 등기 신청 ㄴ 등기 공무원 심사 속 재산 관하 ㄴ 있 어 서의 확정 기판력 미치 는지 ( ) < br / > 라 . 부동산 등기법 46 소정 상속 증명 하 서면 의하 ㄴ 상속분 산정 등기 공무원 상속 등기 신청 ㄴ 형식적 심사권 하 ㄴ 범위 내 ㄴ지 ( ) < br / > 마 . 상속 등기 신청 시 정상 속 분과 다른 비율 지분 이전 등기 신청 하 지분 정상 속 분과 다르 게 변동 되 ㄴ 사실 증명 하 서면 제출 요부 ( ) 오 아 제출 하 지 아니하 등기 신청 각하 하 ㄹ 것 ㄴ지 ( ) < br / > 
85929,상호 모순 미비 하 ㄴ 증거 의하 ㄴ 사실 < br / > 
120612,"재심 사유 내세우 행위 관하 여 고소 없 어 수사 개시 되 지 않 았 더 ㄴ 상태 공소 시효 완성 되 ㄴ , 재 심의 소 적법 ( ) < br / > "
200226,아 . 공동 저당 있 어서 순위 저당권 자의 대위 물상 보증인 변제 자대 충돌 하 법률 관계 우선순위 < br / > 나 아 . 물상 보증인 대위 취득 하 ㄴ 선순위 저당권 설정 등기 여 선순위 저당권 피 담보 채무 소멸 이유 말소 하 ㄹ 있 는지 < br / > 
201730,아 . 의료법 41 저 3 항 헌법상 평등 원칙 위배 되 는지 < br / > 나 아 . 강제 경매 대상 되 ㄴ 부동산 보건 사회부 장관 허가 받 아 근저당 권 설정 되 었 고 경락 대금 모두 근 저당권 배당 되 ㄴ 경락 의료법 41 저 3 항 소 정의 보건 사회부 장관 허가 또 필요 하 ㄴ 지 < br / > 
202756,"시가 소유 토지 여 환산 등록 시 공무원 착오 과소 하 게 기재 되 ㄴ 토지 대장 면적 기준 환지 예정지 지정 처분 하 고 , 갑과  종전 토지 등기부 표시 맞추 어 매매 계약 체결 하 여 앞 소유권 이전 등기 경 료 환지 확정 되 었 다면 환지 누락 되 ㄴ 부분 여 손해 입 이지 아니 라고 하 ㄴ < br / > "
74273,소유권 전등 기의 말소 등기 명한 확정 집행 등기 말소 되 ㄴ 형식적 확정 되 ㄴ 여 추완 항소 되 어 항소심 계속 중 반 소 로서 말소 되 ㄴ 등기 회복 등기 하 것 소 이익 있 지의 < br / > 
232377,처 표현 대리 < br / > 
223845,"[ 1 ] 투자 관련 계약 당사자 일방 상대방 자신 보유 하 ㄴ 주식 매수 하 면 주식 관하 ㄴ 매매 계약 체결 되 것 정하 ㄴ , 이러하 ㄴ 주식 매수 청구권 법적 성질 ( = 형성권 ) / 같 주식 매수 청구권 행사 기간 제척 기간 ㄴ지 ( ) 행사 기간 관하 ㄴ 약정 없 , 주식 매수 청구권 행사 기간 정하 기준 < br / > [ 2 ] 행위 ㄴ 투자 관련 계약 투자 자가 약정 따르 아 투자 실행 하 여 주식 취득 하 ㄴ 투자 대상 회사 등 의무 불이행 있 투자자 다르 ㄴ 주주 등 상대 주식 매수 청구권 부여 하 , 이러하 ㄴ 주식 매수 청구권 5 년 제척 기간 지나 면 소멸 하 는지 ( ) 행사 기간 투자 대상 회사 등 의무 불이행 있 부터 기산 하 는지 ( 원칙적 ) < br / > "
151118,아 . 불법 행위 침해 되 ㄴ 특정물 현존 하 지 아니하 ㅁ 원인 하 손해 배상액 산정 기준 시기 < br / > 나 아 . 765 고의 중대 하 ㄴ 과실 유무 하 ㅁ 있 어서 증거 잘못하 ㄴ < br / > 
202666,아 . 토지 건물 부분 부지 사용 하 ㅁ 으로써 시작 되 ㄴ 점 유가 토지 소유자 사용 승 낙하 이루어지 ㄴ 것 으로서 권원 성질 자주 점유 라고 보 ㄹ 없다 고 하 ㄴ < br / > 나 아 . 직접 점유자 상대 점유 이전 금 지가 처분 하 ㄴ 뜻 간접 점유자 통지 하 ㄴ 바 없 가처분 간접 점유자 여 시효 중단 가지 는지 ( ) < br / > 다 . 건물 일부 철거 요구 여 건물 대지 경계 침범 사실 부인 하 면서 인근 토지 소유자 입 회하 정확 하 ㄴ 측량 하 ㄴ 침범 되 었 다면 철거 하 고 대지 반환 하 겠 다고 하 ㄴ 의사 표시 건물 일부 ㄴ 철거 의무 승인 라 걸 나 점유 인하 ㄴ 시효 취득 포기 라고 보 ㄹ 없다 고 하 ㄴ < br / > 
157357,토지 현황 경계 관하 ㄴ 착오 매매 계약 중요 부분 ㄴ 착오 보 ㄴ 실례 < br / > 
209112,재난 기인 하 ㄴ 민 형사 사건 임시 조치법 2 규정 기간 기산점 < br / > 
147377,[ 1 ] 건물 소유자 건물 소유권 기한 방해 제거 청구권 행사 하 여 인근 토지 소유자 토지 설치 하 ㄴ 공작물 철거 구하 ㄹ 있 < br / > [ 2 ] 권리 행사 권리 남용 하 기 위하 ㄴ < br / > [ 3 ] 공로 이르 통로 사용 되 자기 소유 토지 인근 상가 출입구 봉쇄 하 형태 블록 담장 설치 하 ㄴ 행위 상가 사용 · 수익 방해 하 고 상가 소유자 고통 이나 손해 주 ㄹ 목적 행하 ㄴ 것 어서 권리 남용 하 ㄴ다고 보 ㄴ < br / > 
153679,아 . 당사자 주장 하 지 아니하 ㄴ 농지 개혁법 해석 적용 관하 ㄴ 사항 직권 조사 사항 인지의 . < br / > 나 아 . 1950.4 . 4 이전 ㄴ 1950.3 농지 분배 적법 하 게 이루어지 었 다고 ㄴ 정한 위법 있 실례 . < br / > 
196730,"[ 1 ] 토지 거래 허가 구역 내의 토지 토지 거래 허가 없이 순차 매매 하 ㄴ , 최종 매수인 중간 생략 등기 합의하 자신 최초 매도인 매매 당사자 하 토지 거래 허가 받 아 경 료 소유권 이전 등기 ( 무효 ) < br / > [ 2 ] 구 국토 이용 관리법 21 3 저 1 항 , 저 7 항 위반 하 ㄴ 자가 스스로 계약 무효 임 주장 하 것 신 성실 원칙 반하 것 ㄴ지 ( ) < br / > "
93590,"572 조의 "" 권리 일부 타인 속하 ㄴ 매도인 권리 취득 하 여 이전 하 ㄹ 없 "" < br / > "
172230,"甲 교회 토지 매수 하 면서 乙 매수인 명의 신탁 하 였 고 매도인 이르 ㄹ 알 ㄹ지 못하 였 는데 , 甲 교회 실명 등기 하 지 않 고 부동산 실 권리자 명의 등기 관하 ㄴ 법률 정하 ㄴ 유예 기간 경과 하 ㄴ 乙 상대 토지 부당 이득 반환 구하 乙 소멸 시효 항변 하 ㄴ , 乙 소멸 시효 항변 권리 남용 허용 되 ㄹ 없다 고 보 ㄴ 법리 오해 위법 있 다고 하 ㄴ < br / > "
201092,무허가 건물 관리 대장 소유 자로 등재 되 ㄴ 사실 만 무허가 건물 ㄴ 소유권 기타 권리 취득 하 거나 권리자 추정 되 있 는지 ( ) < br / > 
154813,근저당 권 실행 되 어 경매 절차 종료 되 었 다 하 더라도 이로써 근 저당권 보다 먼저 등기 되 ㄴ 전세권 설정 등기 아무런 소장 없 으므로 경매 전세권 경락 대금 배당 하 ㄹ 것 아니 다 . < br / > 
70253,"[ 1 ] 텔레비전 방송 보도 특정인 명예 훼손 하 내용 담 고 있 는지 기준 < br / > [ 2 ] 의견 표명 타인 ㄴ 명예 훼손 되 < br / > [ 3 ] 텔레비전 방송국 ‘ 펜 션 분양 사기 ’ 관하 ㄴ 뉴스 보도 하 면서 이미 이사 갈 ㄴ 사기 업체 같 건물 사용 하 ㄹ 뿐 업체 아무런 관련 없 다른 펜 션 분양 회사 사무실 모습 찍 화면 “ 1 억 원 투자 하면 월수입 200 만 원 정도 가능 하 다 . ” 늘 ㄴ 내용 회사 대표 이사 인터뷰 방영 하 등 보도 내용 종합적 고려 하 ㄹ , 보도 접하 ㄴ 일반 시청자 로서 회사 펜 션 분양 사기 업체 라는 취지 인식 하 ㄹ 밖에 없다 고 하 ㄴ < br / > [ 4 ] 명예 훼손 의하 ㄴ 불법 행위 성립 하 기 위하 ㄴ 으로서 피해자 특정 정도 < br / > [ 5 ] 텔레비전 방송국 ‘ 펜 션 분양 사기 ’ 관하 ㄴ 뉴스 보도 인하 여 직접적 명예 훼손 당하 ㄴ 피해자 보도 통하 어 일반 시청자 사기 업체 인식 되 게 되 ㄴ 펜 션 분양 회사 라 하 ㄹ 것 지만 , 보도 내용 중 회사 사무실 걷 어 나오 모습 목 소리 변조 등 별다르 ㄴ 조치 없이 그대로 방영 되 ㄴ 회사 대표 이사 아우르 어 명예 훼손 당하 였 다고 보 ㄴ < br / > [ 6 ] ‘ 펜 션 분양 사기 ’ 관하 ㄴ 취재 동기 결과 등 사실 관계 비추 어 보 면 , 텔레비전 방송국 소속 기자 당해 펜 션 분양 회사 여 등록 등 적법 하 ㄴ 절차 구비 하 고 펜 션 분양 업 영위 하 회사 아니 거나 더 나 아가 고수익 보장 등 내세우 펜션분양 하 업체 라고 의심 하 ㄹ 만하 ㄴ 정황 보이 기 하나 , 펜 션 분양 회사 ‘ 펜 션 분양 통하 ㄴ 고수익 빌미 투자자 유치 하 여 투자자 돈 떼 어 먹 사기 업체 ’ 라는 취지 보도 하 기 위하 어서 같 의심 넘 어 보도 취지 부합 하 당하 ㄴ 정도 근거 확보 하 였 어야 하 ㄴ다고 하 ㄴ < br / > [ 7 ] 인격권 으로서 초상권 침해 되 < br / > "
233945,"[ 1 ] 채권자 대위권 행사 ㄴ ‘ 보전 필요성 ’ 하 기 위하 ㄴ 이르 ㄹ 하 기준 < br / > [ 2 ] 피보험 자가 임의 비 급여 진료 행위 따르 아 요양 기관 진료비 지급 하 ㄴ 다음 실 손 의료 보험 계약 상의 보험자 하 여 진료비 관련 하 ㄴ 보험금 지급 받 았 는데 , 진료 행위 위법 하 ㄴ 임의 비 급여 진료 행위 로서 무효 ㄴ 동시 실 손 의료 보험 계약상 보험금 지급 사유 하 지 아니하 여 보험자 피 보험자 여 보험금 상당 부당 이득 반환 채권 갖 게 되 ㄴ , 채권자 ㄴ 보험자 부당 이득 반환 채권 보전 하 기 위하 여 채무자 ㄴ 피 보험자 대위 하 여 저 3 채무 자인 요양 기관 상대 진료비 상당 부당 이득 반환 채권 행사 하 형태 채권자 대위 채무자 자력 유무 관계없이 보전 필요성 되 는지 ( ) < br / > "
156447,아 . 복 대리인 선임 되 ㄴ 변론 조서 출석 관하 ㄴ 기재 없 조서 증명력 < br / > 나 아 . 노회 승인 없이 교인 총의 의하 여 선임 되 ㄴ 당회장 3 ㄴ 관계 있 어서 대표자 자격 < br / > 다 . 교인 총의 의하 여 선임 되 ㄴ 대표자 교인 총유 재산 처분권 교회 소속 하 ㄹ 노 회의 선택권 < br / > 
76762,1 . 하천 구역 편입 되 ㄴ 토지 ㄴ 소유권 전등 기의 말 소 등기 허용 < br / > 2 . 등기 무자 하천 법상 보상 무자 아니 ㄴ ㄴ 등기 청구권 보상 청구권 확인 확인 이익 < br / > 
108488,아 . 최종 양수인 최초 양도인 ㄴ 소유권 이전 등기 직접 중간 생략 등기 합의 < br / > 나 아 . 최초 양도인 중간 등기 생략 거부 하 고 있 어 매수인 란 공란 되 ㄴ 백지 매도 증서 위임장 인감 증명서 교부 하 ㄴ 것 만 중간 등기 생략 관하 ㄴ 합의 있 었 다고 하 ㄹ 없다 고 보 ㄴ < br / > 
156624,시행 시효 완성 인하 여 부동산 취득 하 ㄴ 자의 이전 등기 청구권 < br / > 
156929,사용자 피 용 자의 선임 사무 감독 상당 하 ㄴ 주의 하 였 다는 것 < br / > 이유 하여 손해 배상 책임 면하 려면 선임 감독 상당 하 ㄴ 주의 하 였 다는 사실 주장 입증 하 여야 하 ㄴ다 . < br / > 
170965,"[ 1 ] 학교 법인 명의 신탁 약정 기하 여 명의 수탁자 로서 기본 재산 관하 ㄴ 등기 마치 ㅁ 으로써 관하 ㄹ 청 기본 재산 처분 관하 여 허가권 갖 게 되 , 관할 청 부동산 실 권리자 명의 등기 관하 ㄴ 법률 4 저 3 항 말하 저 3 하 는지 ( ) < br / > [ 2 ] 명의 신탁자 학교 법인 기본 재산 등기 되 어 있 부동산 관하 여 부동산 실 권리자 명의 등기 관하 ㄴ 법률 정하 ㄴ 유예 기간 내 실명 등기 등 하 지 않 아 종전 명의 신탁 약정 따르 ㄴ 물권 변동 무효 되 었 음 이유 등기 말소 진정 명의 회복 원인 소유권 이전 등기 절차 이행 구하 , 사립학교법 28 저 1 항 정하 ㄴ 관 하 ㄹ 청 허가 필요 하 ㄴ 지 ( ) < br / > "
196182,"[ 1 ] 독립 당사자 참가 < br / > [ 2 ] 소유권 확인 구하 원고 본소 여 참가인 피고 여 소유권 확인 소유권 보존 등기 말소 , 원고 여 소유권 확인 각 구하 독립 당사자 참가 적법 ( ) < br / > [ 3 ] 1975 . 12 . 31 . 지적법 개정 복구 되 ㄴ 구 토 지대 장상 소유자 란 기재 추정 력 ( ) < br / > "
108399,소비 대차 성질 현실 금전 등 수수 < br / > 
