number,contents
199529,"아 . 채권자 대위권 재 판상 행사 하 , 입증 하 여야 하 ㄹ 사항 < br / > 나 아 . 확인서 발급 신청인 자신 구 부동산 소유권 이전 등기 등 관하 ㄴ 특별 조치 법상 보증인 1 되 ㄴ 보증서 이에 기한 확인서 의하 여 경 료 되 ㄴ 등기 적법성 추정 받 있 는지 < br / > "
73722,일부 채권 ㄴ 압류 시효 중단 < br / > 
73979,사정 변경 를이 유 한계 약해 제권 발생 < br / > 
185082,"[ 1 ] 상고 이유서 법령 위반 관하 ㄴ 구체적 고 명시 적 ㄴ 이유 설시 없 , 상고 이유서 제출 되 지 않 것 취급 되 는지 ( ) < br / > [ 2 ] 가처분 채권자 가처분 채무자 공유 지분 관하 여 처분 금 지가 처분 등기 마치 ㄴ 가처분 채무자 나머지 공유자 경매 통하 ㄴ 공유물 분할 내용 하 화해 권고 결정 받 아 확정 시키 ㄴ , 처분 금 지가 처분 금하 처분 행위 하 는지 ( 원칙적 ) < br / > "
75599,농지 매수 당시 외국 거주 하 고 있 자의 농지 매수 자격 유무 < br / > 
228201,아 . 우리나라 국적 상실 하 고 1 년 기간 경과 하 ㄴ 동 국적 상실자 부동산 소유권 보유 < br / > 나 아 . 구 국적법 ( 1948.12 . 20 법률 16 호 ) 저 16 구 외국인 토지법 ( 1925.4 . 1 . 법률 42 호 ) 과의 관계 < br / > 
92623,계미 불입 하 지 아니하 ㄹ 담보 위하 여 설정 되 ㄴ 저당권 파계 따르 ㄴ 청산 절차 부담 하 게 되 ㄹ 계미 지급 의무 까 지 담보 하 것 보 ㄹ 있 는가 여 부 < br / > 
233865,"[ 1 ] 대물 변제 본래 채무 이행 갈음 하 ㄴ 다른 급여 부동산 소유권 이전 ㄴ , 기존 채무 소멸 하 시기 ( = 소유권 이전 등기 완료 시 ) 이때 목적물 하자 있 , 매도 인의 담보 책임 관하 ㄴ 조항 준용 되 는지 ( ) < br / > [ 2 ] 甲 주식회사 다세대 주택 신축 공사 전기 공사 乙 합자 회사 하도급 주 면서 공사 대금 다세대 주택 구분 건물 대물 변제 하 기로 약정 하 고 , 이후 乙 회사 구분 건물 관하 여 소유권 이전 등기 넘겨받 , 乙 회사 약정 하 ㄴ 목적물 관하 여 대물 변제 원인 소유권 이전 등기 넘겨받 았 는데 , 대물 변제 이행 되 었 다는 甲 회사 항변 배척 하 ㄴ 법리 오해 잘못 있 다고 하 ㄴ < br / > "
74077,사정 변경 이유 가처분 취소 신청 있 어 본안 < br / > 
94756,계약 해제 있 어서 2 일의 기간 상당 하 ㄴ 유예 기간 라고 하 ㄴ < br / > 
75217,금원 차용 하 면서 제소 전화 해 하 ㄴ 채무 원금 < br / > 
199460,"아 . 인영 문서 진정 성립 추정 번 복 < br / > 나 아 . 피상 속 인의 증여 의하 여 피 상속인 배우자 직계 비속 유류분 구체적 어느 정도 부족 생기 게 되 었 는지 점 관하 여 아무렇 ㄴ 주장 , 입증 없 다는 이유 피 상속인 배우자 직계 비속 유류 분권 침해 주장 배척 하 ㄴ 데 석명권 불행사 인하 ㄴ 심리 미진 위법 없다 고 하 ㄴ < br / > "
75389,리 당사자 능력 하 ㄴ < br / > 
75590,주민 등록 표상 오기 송달 불능 되 어 공시 송달 의하 어 절차 진행 되 고 선고 되 ㄴ 동 ㄴ 추완 항소 적부 < br / > 
107706,아 . 대리점 계약서 첫머리 당사자 표기 되 어 있 지 않 으나 계약서 각 조항 표기 잇 어 연대 보증인 기명 날인 있 고 각 장 사이 연대 보증인 간인 까지 있 연대 보증인 계약서 따르 아 약정 하 ㄴ 것 보 ㄹ 있 는지 ( ) < br / > 나 아 . 대리점 계약 채무자 위하 여 계속적 보증 계약 체결 하 ㄴ 보증인 채권자 자기 부동산 ㄴ 가압류 집행 항의 하 ㄴ 것 만 보증 계약 해지 보 ㄹ 있 는지 ( ) < br / > 
115066,"[ 1 ] 경매 목적 토지 별개 독립 하 ㄴ 부동산 여 별도 경매 일괄 경매 주장 없이 낙찰 허가 결정 있 , 순위 전세권 자가 일괄 경매 관하 ㄴ 소명 자료 제출 하 면서 경매 절차 하자 주장 하 ㄹ 있 는지 ( ) < br / > [ 2 ] 경매 목적물 감정 가격 이나 낙찰 가격 시가 비하 여 저렴 하 다 주장 낙찰 허가 결정 ㄴ 적법 하 ㄴ 항고 이유 되 는지 ( ) < br / > [ 3 ] 경매 목적 물의 규모 등 제반 사정 비추 어 입찰 불능 시 마다 최저 경매 가격 10 % 씩 저감 하 ㄴ 낙찰 허가 결정 위법 하 지 않 다고 보 ㄴ < br / > "
73785,1 . 약정 의하 ㄴ 농로 개설 의무 있 농로 구조 < br / > 2 . 불법 행위 인하 ㄴ 손해 배상 있 어 손해 금산 정 ㄴ 구체적 입증 없다 고 하여 배척 하 ㄴ < br / > 
154701,채권 계약 으로서 대물 변제 계약 성립 되 ㄴ 이상 이르 ㄹ 원인 하 소유권 이전 등기 절차 이행 하 ㄹ 있 다 . < br / > 
156012,경 추 ㄴ 철도 주식 회사 주주 군정 법령 75 호 저 2 따르 아 회사 잔여 재산 있 정부 여 직접 보상 하 ㄹ 있 다 < br / > 
146468,부동산 소유권 이전 등기 청구권 강제 집행 가압류 대상 되 ㄹ 있 는지 ( 전원 합의체 결정 ) < br / > 
102127,건축 공사 도중 도급인 수급인 채무 불이행 이유 도급 계약 해제 하 ㄴ 법률 관계 < br / > 
198758,"가압류 되 어 있 부동산 소유권 이전 등기 청구권 대위 행사 하 , 가압류 해제 조건 이전 등기 구하 ㄹ 기회 부여 하 지 않 것 석명권 불행사 내지 심리 미진 위법 있 는지 < br / > "
76238,부동산 등기법 49 소정 보증인 선량 하 ㄴ 관리자 주의 의무 해태 하 ㄴ 것 아니 라고 하 ㄴ < br / > 
199603,"아 . 환지 처분 종전 토지 관하 ㄴ 소유권 확인 소 환지 처분 후의 환지 중 종전 토지 상응 하 비율 공유지 분 관하 ㄴ 소유권 확인 소 서로 동일 하 ㄴ 소송물 ㄴ지 < br / > 나 아 . 소유권 확인 확정 다시 소유권 기한 물권 적 청구권 원인 하 하 ㄴ , 전소 소유권 존 부 관하 ㄴ 구속 되 는지 < br / > "
118687,해수 인수권 성질 대항력 < br / > 
212285,근저당 권 설정 되 ㄴ 부동산 처 양도 하 ㄴ 이후 새로이 부담 하 ㄴ 연대 보증 채무 근저당 권 피 담보 채무 포함 되 ㄴ다고 보 ㄴ < br / > 
73955,정지 상권 성립 부정 하 ㄴ < br / > 
72328,검사 위법 하 ㄴ 환부 처분 인하 ㄴ 국가 배상 책임 < br / > 
104010,구 호 주의 사망 인하 ㄴ 재산 상속 있 어 차남 이하 상속인 법률 지위 < br / > 
85817,"선박 우선 특권 신청 의하 여 담보권 실행 위하 ㄴ 경매 절차 진행 중인 선박 사해 행위 타 이전 되 고 변제 등 피 담보 채권 소멸 하 여 경매 신청 취하 되 ㄴ , 채권자 취소권 행사 인하 ㄴ 원상 회복 가액 배상 금액 산정 하 ㅁ 있 어 경매 절차 우선적 변상 받 있 었 더 ㄴ 집행 비용 액 공제 하 여야 하 는지 ( ) < br / > "
202821,농지 개혁법 시행 국가 매수 되 어 수분 배자 분배 되 었 다가 수분 배자 분배 포기 하 ㅁ 으로써 정부 반환 되 ㄴ 농지 중 농지 개혁 사업 정리 관하 ㄴ 특별 조치법 2 저 3 항 기간 내 분배 되 지 아니하 ㄴ 농지 원 소유자 소유 환원 되 는지 ( ) < br / > 
209002,공시 송달 의거 하 ㄴ 저당권 실행 손해 배상 책임 < br / > 
221869,"상가 건물 임대차 보호법 10 4 저 2 항 3 호 정하 ㄴ ‘ 임대차 목적물 ㄴ 상가 건물 1 년 6 개월 이상 영리 목적 사용 하 지 아니하 ㄴ ’ 종전 소유자 ㄴ 임대인 임대차 종료 상가 건물 영리 목적 사용 하 지 아니하 ㄴ 기간 1 년 6 개월 미치 지 못하 사이 상가 건물 소유권 변동 되 ㄴ , 조항 따르 ㄴ 정 당하 ㄴ 사유 하 기 위하 ㄴ < br / > "
201248,생사 불명 부재자 사망 간 주되 시점 이후 실종 선고 있 기 이전 재산 관리 인의 처분 행위 기하 여 경 료 되 ㄴ 등기 적법 추정 력 유무 ( ) < br / > 
144650,1947 년 당시 토지 대장 기재 되 ㄴ 소유권 이전 등록 추정 력 < br / > 
228555,"[ 1 ] 비 법인 사단 당사자 능력 하 민사 소송법 52 규정 취지 여기 서 말하 ‘ 사단 ’ / 사단 법인 하부 조직 별개 독립 되 ㄴ 비 법인 사단 하 기 위하 ㄴ < br / > [ 2 ] 비 법인 사단 하부 기관 당사자 능력 가지 지에 관 하 ㄴ 사항 직권 조사 사항 ㄴ지 ( ) < br / > [ 3 ] 선교 행위 사회적 상당 성 잃 고 상대방 종교 선택 관하 ㄴ 자유 상실 시키 정도 이르 ㄴ , 불법 행위 성립 하 ㄹ 있 는지 ( ) 이르 ㄹ 하 기준 < br / > [ 4 ] 甲 종교 단체 입교 하 였 다가 탈퇴 하 ㄴ 乙 , 甲 종교 단체 지 교회 ㄴ 丙 교회 소속 신도 ㄴ 丁 등 조직적 고 계획적 ㄴ 선교 방식 의하 여 기망 당하 여 甲 종교 단체 ㄴ 줄 모르 ㄴ 채 교리 교육 받 아 사실상 자유 의지 박탈 당하 ㄴ 상태 甲 종교 단체 입교 하 게 되 었 고 甲 종교 단체 허황 되 ㄴ 교리 등 인하 어 장기간 탈퇴 하 지 못하 등 정신적 고통 받 았 다고 주장 하 며 , 丙 교회 丁 등 상대 손해 배상 구하 ㄴ , 丙 교회 甲 종교 단체 구별 되 별개 독립 되 ㄴ 비 법인 사단 라고 하 ㄹ 없 고 , 제반 사정 비추 어 丁 등 乙 ㄴ 선교 행위 정 당하 ㄴ 범위 일탈 하 여 사회적 상당 성 잃 었 다 거나 乙 종교 선택 관하 ㄴ 자유 상실 되 ㄹ 정도 이르렀다 고 보 ㄹ 없다 고 하 ㄴ < br / > "
198179,"[ 1 ] 경정 허용 되 범위 < br / > [ 2 ] 환지 확정 따르 아 취지 정정 하 면서 등기부 누락 인하 ㄴ 착오 종전 토지 일부 누락 하 ㄴ , 토대 선고 되 ㄴ 누락 부분 추가 하 경정 불허 하 ㄴ < br / > "
207947,이중 국적 ( 그중 하나 대한민국 임 ) ㄴ 실종 선고 하 ㅁ 있 어서 의거 하 여야 하 ㄹ 준거법 ㄴ < br / > 
76309,"토지 구획 정리 사업 지구 내의 토지 여 환지 예정지 지정 처분 하 ㄴ , 환지 예정지 지정 되 지 아니하 ㄴ 토지 소유자 토지 사용 수익권 상실 하 는지 < br / > "
203186,"아 . 구 토지 개량 사업법 ( 1961.12 . 31 . 법률 948 호 ) 의하 ㄴ 토지 개량 사업 하 유지 매립 여 하 ㄴ 구 공유 수면 매립 ( 1962.1 . 20 . 법률 986 호 ) 의하 ㄴ 매립 면허 ( = 당연 무효 ) < br / > 나 아 . 공유 수면 매립 면허 당시 계쟁 유지 공유 수면 하 는지 공유 수면 매립 법상 다른 법령 규정 의하 ㄴ 저수지 변경 하 기 위하 여 필요 하 ㄴ 매립 하 지 심리 , 하 지 않 심리 미진 등 위법 파기 하 ㄴ < br / > "
153609,아 . 구 경매법 시행 당시 경락 허가 결정 확정 되 ㄴ 사건 있 어서 경락인 경락 허가 결정 동시 경락 대금 지급기 일내 지급 하 지 않 것 해제 조건 경락 부동산 소유권 취득 하 ㄴ다 < br / > 나 아 . 결정 유탈 있음 이유 하 준재심 있 어서 특단 사정 없 재 항고인 결 정의 송달 받 유탈 있 다는 사실 알 았 다 하 ㄹ 것 다 < br / > 
74660,공시 송달 추완 항소 허부 < br / > 
153447,아 . 농가 아니 ㄴ 자의 농지 취득 < br / > 나 아 . 변론 종결 농지 증명 추완 하 ㄴ 호가 정 기판력 < br / > 
72337,구민법 당시 매매 계약 인하 ㄴ 등기 청구권 소멸 시효 < br / > 
206072,"2 이상 계주 조직 하 ㄴ 계 계원 계 불입금 채무 담보 하 기 위하 여 다른 계주 아 등기 경 료 하 어 주 고 계 불입금 중 1 / 2 넘 금원 다른 계주 지급 하 ㄴ , 간 계 불입금 수령 하 ㄹ 권한 관하 ㄴ 약정 있 었 다고 봄 타당 하 다고 예 < br / > "
196836,[ 1 ] 동기 착오 법률 행위 중요 부분 하 ㅁ 이유 법률 행위 취소 하 기 위하 ㄴ < br / > [ 2 ] 109 저 1 항 단서 ' 중대 하 ㄴ 과실 ' < br / > [ 3 ] 동기 착오 법률 행위 중요 부분 하 고 착오 상대방 적극적 행위 의하 어 유발 되 등 제반 사정 비추 어 표의자 중대 하 ㄴ 과실 없다 고 하여 착오 이유 매매 계약 취소 하 ㄴ < br / > 
73561,교환 적 변경 허용 되 ㄴ < br / > 
193895,"[ 1 ] 민사 소송법 79 저 1 항 정하 ㄴ 독립 당사자 참가 < br / > [ 2 ] 민사 집행법 300 저 1 항 정하 ㄴ 다툼 대상 관하 ㄴ 가처분 , 피 보전 권리 관하 ㄴ 소명 되 ㄴ다면 보전 필요성 되 는지 ( ) < br / > "
204677,상대방 주장 소유권 하 진술 재 판상 자백 되 ㄹ 있 지 ( ) < br / > 
199000,"아 . 토지 수용법 65 보상금 미 지급 인하 ㄴ 재결 실효 주장 하 ㄹ 있 자의 범위 나 . 압류 전부 명령 피 전부 채권 표시 ' 토지 수용 따르 ㄴ 손실 보상금 채권 중 가등기 의하 여 담보 되 ㄴ 채권 금 공제 하 ㄴ 나머지 금액 ' 기재 하 ㄴ , 손실 보상금 담보 채권 액 공제 하 기 위하 여 담보권 자가 반드시 토지 수용법 69 소정 압류 하 여야 하 는지 < br / > "
153249,"강제 경매 있 어서 , 사망자 집행 채무자 하여 경매 개시 결정 송달 되 ㄴ , 경매 효과 < br / > "
80358,[ 1 ] 등기 권리증 같 권리 관계 서류 명의 수탁자 지칭 되 자가 소지 하 고 있 명의 신탁 관계 하 ㄹ 있 는지 ( 한정 ) < br / > [ 2 ] 명의 수탁자 지칭 되 자가 등기 권리증 소지 하 고 있 으나 제반 사정 비추 어 계쟁 부동산 명의 신탁 되 ㄴ 것 라고 하 ㄴ < br / > 
120845,"이중 등록 되 ㄴ 선적 근거 하여 선박 소유권 이나 선적 변동 되 ㄴ , 선박 보험 계약 적용 하 협회 기간 약관 소 정의 "" 선박 소유권 이나 선적 있 어서 어떠하 ㄴ 변경 있 보험 자가 서면 의하 여 동의 하 지 않 보험 계약 자동 종료 되 ㄴ다 . "" 늘 ㄴ 면책 조항 적용 되 는지 ( ) < br / > "
93614,아 . 농지 소 표의 작성 분배 농지 확정 절차 추정 < br / > 나 아 . 중복 되 ㄴ 소유권 보존 등기 < br / > 
93446,부동산 소유 명의 현 소유 명의 여 소유권 이전 다투 소유권 전등 기의 추정 력 < br / > 
74705,기판력 저촉 되 ㄴ다고 하 ㄴ < br / > 
73545,신원 보증인 수인 ㄴ 상대방 < br / > 
107615,이미 대 지화 되 ㄴ 토지 농지 분배 하 ㄴ 처분 유무 ( ) < br / > 
104803,취득 시효 완성 소유 자로 부터 저 3 앞 경 료 되 ㄴ 소유권 전등 기가 원인 무효 ㄴ 등 기의 말소 가부 ( ) < br / > 
74525,부동산 단기 취득 시효 하 ㄴ < br / > 
193656,"부동산 매수인 근저당 채무 등 부동산 결부 되 ㄴ 부담 인수 하 고 채무액 매매 대금 공제 하 기로 약정 하 ㄴ , 이행 인수 ㄴ지 병존 적 채무 인수 인지의 판별 기준 < br / > "
147813,"[ 1 ] 의사 표시 관련 하 여 ‘ 사실 ’ 법률적 영역 속하 ‘ 의사 표시 해석 ’ 구별 < br / > [ 2 ] 채권자 아니 ㄴ 저 3 명의 근저당 권 설정 등기 ( 한정 유효 ) 당사자 일련 행위 가지 법률적 분명 하 지 아니하 여 채권자 근저당 권 사이 형성 되 ㄴ 법률 관계 실체 밝히 것 의사 표시 해석 문제 ㄴ지 ( ) < br / > [ 3 ] 채무 자가 채권자 아니 ㄴ 저 3 명의 근저당 권 설정 등기 하 ㄴ , 채권자 근저당 권 자가 불가분 적 채권 관계 형성 하 ㄴ 것 라고 보 ㄹ 여지 충분 하 ㅁ에도 , 채권자 근저 당권 채권 양도 하 였 다는 사실 하 ㄴ 파기 하 ㄴ < br / > "
95667,농지 양도 담보 하 양수인 자경 영 의사 소재지 관서 증명 요부 < br / > 
195068,[ 1 ] 개인 사찰 구 불교 재산 관리법 독립 하 ㄴ 권리 · 의무 귀속 주체 되 기 위하 ㄴ < br / > [ 2 ] 등기 명의 인의 동일성 해치 지 않 범위 내 행해지 ㄴ 등기 명의 ㄴ 변경 등기 말소 등기 가부 ( ) < br / > 
205010,아 . 이행 소 하 ㄹ 있 는데 확인 소 하 것 ' 확인 이익 ' 있 는지 < br / > 나 아 . 지적법 38 저 3 항 소정 ' 이해 관계인 대항 하 ㄹ 있 ' 소유권 확인 포함 되 는지 ( ) < br / > 
114202,"[ 1 ] 부동산 불법 처분 행위 부동산 전전 양도 따르 ㄴ 최종 매수인 등기 믿 고 금원 대여 하 ㄴ 근저당 권 자가 입 게 되 ㄴ 손해 상당 인과 관계 유무 ( ) < br / > [ 2 ] [ 1 ] 항 , 근저당 권 자가 입 손해 범위 < br / > [ 3 ] [ 1 ] 항 , 대출금 채무자 변제 자력 유무 손해 발생 영향 미치 는지 ( ) < br / > "
64698,[ 1 ] ‘ 신탁업 ’ 장부 열람권 관하 ㄴ 규정 ‘ 신탁법 ’ 규정 되 ㄴ 신탁자 수탁자 ㄴ 신탁 사무 관하 ㄴ 서류 열람 청구권 제한 하 근거 되 는지 ( ) < br / > [ 2 ] 신탁 법상 신탁 사무 관하 ㄴ 서류 ‘ 열람 ’ 청구권 관련 서류 ‘ 송 부 ’ 청구권 포함 되 는지 ( ) < br / > 
152782,보존 등기 추정 력 입증 책임 관하 ㄴ 법리 오해 하 ㄴ 위법 있 실례 < br / > 
119434,종전 토지 여 환 지가 교부 되 지 아니하 였 거나 환 지가 교부 되 었 더라도 제자리 환지 아니 ㄴ 환지 처분 종전 토지 점유 기간 통산 하 ㄹ 있 는지 ( ) < br / > 
165371,아 . 보조 참가인 ㄴ 재판 ( 참가 적 ) < br / > 나 아 . 보조 참가인 일 ㄴ 낙 하 ㄴ ㄴ 낙 조서 보조 참가인 ㄴ < br / > 
208392,채권자 대위권 관하 ㄴ 법리 오해 하 ㄴ 위법 있 < br / > 
214197,증인 증언 중 「 알 ㄴ다 」 고 진술 < br / > 
201227,"아 . 채권자 건축 주가 신축 중인 연립 주택 관하 여 채권 담보 목적 매매 계약 체결 하 ㄴ 분양 대금 으로써 채권 충당 하 기로 하 ㄴ 약정 트 어 잡 아 분양 되 ㄴ 건물 관하 ㄴ 채권자 담보권 분양 대금 채권 충당 되 지 않 았 다 하 여도 소멸 하 는지 ( ) < br / > 나 아 . "" 아 "" 항 약정 해제 되 ㄴ 이전 분양 받 자가 채권자 대항 하 ㄹ 있 는지 ( ) < br / > "
153450,권리 남용 법리 오해 하 ㄴ 위법 있 예 < br / > 
94962,교회 ㄴ 증여 의사 표시 취소 하 ㅁ 인하 ㄴ 원상 회복 교인 결 < br / > 
197199,"[ 1 ] 확정 기판력 객관적 범위 < br / > [ 2 ] , 명의 순차 소유권 등 기가 경 료 되 ㄴ 토지 점유자 병이 여 소유권 전등 기의 말소 구하 고 여 소유권 이전 등기 구하 었 으나 ㄴ 기각 되 고 ㄴ 각하 되 ㄴ , 소유권 존 부에 까지 기판력 미치 는지 ( ) < br / > "
106502,신의 성실 원칙 반하 여 조건 성취 방해 하 ㄴ 것 단정 하 ㄹ 없다 고 보 ㄴ < br / > 
207233,매매 · 교환 등 계약 의하 여 타인 부터 토지 인도 받 아 점유 하 게 되 ㄴ 자가 동 계약 무효 임 알 ㄴ 자주 점유 보 ㄹ 없 는지 < br / > 
199188,"아 . 진정 속인 참칭 상속인 주장 하 피 상속인 서로 다른 사람 ㄴ , 이르 ㄹ 상속 회복 소라 고 하 ㄹ 있 는지 < br / > 나 아 . 채권자 대위 채무자 미치 < br / > 다 . 소 각하 하 ㄴ 파기 하 더라도 기판력 저촉 되 어 기각 되 ㄹ 운명 있 , 상고 심의 조치 < br / > "
207637,이미 중간 생략 등기 경유 되 어 버리 ㄴ 있 어서 다만 중간 생략 등기 관하 ㄴ 합의 없 었 다는 사유 만 으로서 등 기 무효 라 하 ㄹ 없 다 < br / > 
234643,"부동산 등기법 23 저 4 항 말하 ‘ 등기 절차 이행 명하 ㄴ ’ 주문 반드시 등기 절차 이행 하 라는 등기 무 자의 등기 신청 의사 진술 하 내용 등 포함 되 어 있 어야 하 는지 ( ) / 서류 등 공시 송달 송달 되 어 확정 되 ㄴ 저 1 심 문 기초 등기 권리자 소유권 이전 등기 마치 었 으나 이후 되 ㄴ 추후 보완 항소 저 1 심 취소 되 고 등기 권리자 기각 되 ㄴ , 등기 무자 등기 권리자 상대 추후 보완 항소 절차 반소 하 거나 별도 소 하 여 소유권 전등 기의 말소 등기 절차 구하 ㄹ 있 는지 ( ) < br / > "
214043,공동 상속 재산 관리인 상속인 아니 ㄴ 사람 선임 위법 < br / > 
150419,문교부 장관 허가 없 사찰 재산 매각 < br / > 
207730,건물 스 어 있 공용 대지 분할 건물 위하 ㄴ 관습 상의 지상권 < br / > 
191487,"[ 1 ] 건축 업자 타인 대지 매수 하 여 대금 지급 하 지 아니하 ㄴ 채 자기 노력 재료 들이 어 건물 건축 하 면서 건축 허가 명의 대지 소유자 하 ㄴ 법률 관계 < br / > [ 2 ] 토지 소유자 건축 업자 토지 매도 하 고 건축 업자 대금 지급 담보 하 기 위하 여 토지 소유자 명의 건축 허가 받 아 건축 업자 비용 건물 신축 하 ㄴ , 토지 소유자 건축 업자 ㄴ 토지 건물 관하 ㄴ 소유권 이전 등기 의무 건축 업자 토지 소유자 ㄴ 토지 잔 대금 지급 의무 동시 이행 관계 있 는지 ( ) < br / > "
86223,부동산 매매 있 어서 주의 이행 불능 < br / > 
75376,지명 채권 양도 송달 되 ㄴ 전부 명령 < br / > 
106492,아 . 당사자 착오 기인 하 ㄴ 오류 경정 가부 ( ) < br / > 나 아 . 당사자 주소 다르 ㄴ 주민 등록 표상 주소지 표시 하 지 아니하 ㄴ 것 경정 사유 ㄴ 명백 하 ㄴ 오류 되 는지 ( ) < br / > 
185756,"甲 주식회사 소유 유체 동산 관하 ㄴ 강제 집행 사건 경매 기일 乙 甲 회사 직원 참여 하 ㄴ 가운데 최고 매수 신청인 으로서 매각 허가 얻 어 유체 동산 매수 하 였 고 , 유체 동산 丙 , 丁 거치 어 최종적 戊 양도 되 었 는데 , 丁 甲 회사 상대 하 ㄴ 유체 동산 인도 확정 기하 어 丁 戊 각각 신청 하 여 시행 되 ㄴ 유체 동산 인도 집행 절차 유체 동산 중 일부 소재 불명 ㄴ 것 확인 되 , 戊 甲 회사 상대 불법 행위 따르 ㄴ 손해 배상 등 구하 ㄴ , 아무렇 ㄴ 권리 없 음 알 면서 유체 동산 점유 하 고 사용 하 ㄴ 甲 회사 적어도 유체 동산 도난 · 분실 되 지 않 도록 보관 하 여야 하 ㄹ 주의 의무 있 으므로 이르 ㄹ 위반 하여 유체 동산 일부 멸실 되 게 하 였 다면 甲 회사 丁 戊 입 손해 배상 하 ㄹ 의무 있 다고 하 ㄴ < br / > "
193900,[ 1 ] 사하 어 행위 취소 미치 범위 < br / > [ 2 ] 사하 어 행위 취소 미치 지 아니하 저 3 범위 사하 어 행위 기초 목적 부동산 관하 여 새롭 게 법률 행위 하 ㄴ 목적 부동산 전득자 등 만 한정 하 ㄹ 것 ㄴ지 ( ) < br / > [ 3 ] 수익자 새 롭 ㄴ 법률 관계 맺 것 아니 라 수익자 채권자 로서 이미 가지 고 있 더 ㄴ 채권 확보 위하 여 목적 부동산 압류 가압류 하 ㄴ 사해 행위 취소 미치 지 않 는다고 하 ㄴ < br / > 
69768,[ 1 ] 사찰 독립 하 ㄴ 실체 로서 권리 의무 주체 되 기 위하 ㄴ < br / > [ 2 ] 토지 사찰 부지 점유 · 사용 하 여 오 ㄴ 사찰 점유 취득 시효 하 ㄴ < br / > [ 3 ] 토지 점유 · 사용 하 동안 세금 납부 하 ㄴ 사실 없 다 하여 자주 점유 아니 라고 단정 하 ㄹ 있 는지 ( ) < br / > 
234101,구민법 시대 토지 매수 하 였 으나 등기 마치 지 아니하 ㄴ 자의 토지 점유자 ㄴ 부당 이득 반환 청구권 < br / > 
204786,아 . 유탈 이유 하 ㄴ 재심 소제기 기간 기산점 < br / > 나 아 . 한국 토지 개발 공사 비치 되 ㄴ 토지 피 공급자 명부 수분 양자 명의 변경 구하 소 이익 있 는지 ( ) < br / > 다 . 당사자 주장 하 거나 조사 촉구 하 지 아니하 ㄴ 소 이익 유무 여 하 지 아니하 ㄴ 재심사 유인 유탈 보 ㄹ 있 는지 ( ) < br / > 
228565,저 3 피 용 자의 공동 불법 행위 발생 하 ㄴ 손해 저 3 자신 추 ㄹ 재 배상 하 여 공동 면책 시키 ㄴ 3 사용자 사이 구상 관계 < br / > 
100051,무 권 대리 인의 행위 상고심 추인 하 ㄹ 있 는지 ( ) < br / > 
208350,"임대인 임차인 합의 임대차 계약 해약 하 고 임차인 지상 건물 철거 하 기로 약정 하 ㄴ 643 , 저 652 규정 적용 되 ㄹ 없 다 < br / > "
154065,중간 등기 생략 경유 되 ㄴ 이전 등기 여 종전 등기 명의 자가 말소 하 ㄹ < br / > 있 지의 < br / > 
71944,무 권 대리인 ㄴ 손해 배상 청구권 소멸 시효 기산점 < br / > 
145789,"[ 1 ] 대 하 ㄴ 주택 보증 주식회사 분양 행의 주택 분양 보증 채무 이행 하 ㄴ , 회사 수분 양자 ㄴ 관계 분양 자로 서 지위 승계 하 여 수분 양자 인도 하 ㄴ 주택 존재 하 하자 여도 책임 있 다고 하 ㄴ < br / > [ 2 ] 대 하 ㄴ 주택 보증 주식회사 분양 행의 주택 분양 보증 채무 이행 하 여 수분 양자 인도 하 ㄴ 주택 하자 존재 하 , 하자 보수 보증 보증 하 지 않 범위 여 분양 보증 보증 하 것 해석 하 ㅁ 타당 하 ㄴ 점 등 비추 어 회사 책임 범위 주택 사용 검사 이전 발생 하 ㄴ 하자 한정 되 ㄴ다고 하 ㄴ < br / > "
120600,"[ 1 ] 피 상속인 상속인 되 ㄹ 직계 비속 동시 사망 하 ㄴ , 직계 비속 배우자 대 습 상속 하 ㄹ 있 는지 ( ) < br / > [ 2 ] 피대 습자 동치 ㄴ 등 다른 직계 비속 존재 하 지 않 , 피대 습자 배우자 대 습 상속 하 ㄹ 있 는지 ( ) < br / > "
157372,군정 법령 33 호 저 3 소정 귀속 재산 소유 관리 지배하 보관자 등 같 법령 시행 당시 보관자 등 만 지칭 하 것 아니 다 < br / > 
208944,545 저 1 항 3 의의 < br / > 
