number,contents
232749,공단이 불법행위의 피해자에게 보험급여를 한 다음 피해자의 가해자에 대한 기왕치료비 손해배상채권을 대위하는 경우 그 대위의 범위는 가해자의 책임비율에 해당하는 금액으로 제한된다.
208029,대법원에서 원고의 법률적 주장이 정당하다고 하여 배치된 제2심 판결을 파기환송한 이후에 피고가 원고의 청구에 응하지 않고 제2심에 또 응소한 것은 부당항쟁에 속한다.
194973,지구별 수산업협동조합은 직원이 고의 또는 중대한 과실로 조합에 재산상 손해를 끼쳤을 때 발생한다는 취지로 변상절차에 관한 규정을 두고 있다.
172745,공유지 관리방법으로서 적법하지만 공유자들 중 지분은 있으나 사용·수익은 전혀 하지 않아 손해를 입고 있는 자에 대하여는 공유자가 그 자의 지분에 상응하는 부당이득을 하고 있다고 보아야 한다.
145837,신용상상의 운송조건은 기본적으로 수출입계약 당사자 사이의 비용 및 위험부담에 관한 약정에 지나지 않기 때문에 매수인이 매도인을 대리하여 운송회사와 사이에 물품운송계약을 체결할 대리권을 묵시적으로 수여했다고 보기는 어렵다.
203776,산재보험법 제80조 제2항 후문은 지급이 현실화되지 않은 장해보상연금도 공제의 대상으로 삼는 대신 공제의 범위를 장해보상일시금 상당액으로 한정했다.
209103,지방자치단체가 설립 경영하는 학교는 영조물로서 법인이 아님은 물론 민사소송법 제46조 규정의 사단 또는 재단에도 해당하지 않으므로 당사자능력이 없다.
183647,구 농지개혁법에 따라 국가로부터 농지를 분배받은 수분배자는 농지대가 상환을 완료하면 분배농지의 소유권을 취득하게 된다.
197557,건축 도급계약의 수급인이 설계도면의 기재대로 시공한 경우 수급인에게 하자담보책임을 지울 수 없다.
75832,해상운송인이 선하증권에 기재한 면책약관은 특단의 사정이 없는 한 증권소지인이 주장하게 될 운송계약상의 채무불이행책임뿐만 아니라 불법행위책임도 적용할 의도로 기재했다.
74945,하천구역에 속하는 토지로서 법률의 규정에 의하여 당연히 그 소유권이 국가에 귀속된다.
72605,징발보상금을 포함한 청구가 확정되었다면 징발보상금 상당액의 손해배상 또는 부당이득반환청구권을 내세워 청구해도 채권의 발생원인과 시기에 있어 같은 기간의 사용료 상당 금원을 구한다는 원인사실이 다르다.
174799,상계항변은 수동채권의 존재가 확정되는 것을 전제로 행해지는 일종의 예비적 항변으로 당해 소송에서 수동채권의 존재 등 상계에 관한 법원의 실질적 판단이 이루어지는 경우에 비로소 실체법상 상계의 효과가 발생한다.
108428,부동산매도용 인감증명서 소지자의 대물변제약정 주장을 배척한 원심판결에 심리미진이나 채증법칙위배의 위법이 있다고 본 사례도 있다.
74504,타인으로부터 수표의 추심의뢰를 받은 은행은 특별한 사정이 없는 한 위임의 취지에 따라 선량한 관리자의 주의의무를 다하여 지급제시기간내에 수표를 추심의뢰인에게 반환해야 한다.
75940,교통사고의 원인을 밝히기 위해 사고원인감정을 의뢰하고 감정비로 지급한 금원은 특별한 사정으로 인한 손해이다.
107809,원심은 자동차손해배상보장법 제3조의 법리를 오해하여 심리를 다하지 아니한 위법을 저질렀다.
75565,피해자가 한약업사 자격으로 허가지역과 그외의 두 곳에서 한약방을 경영하고 있는 경우 그 부분의 수입을 전면적으로 가해자에 대한 손해배상의 범위에서 면하게 하는 것은 가해자에게 부당하게 이득을 주는 것이 된다.
199225,사용자책임의 요건으로서의 사용자 관계는 객관적 사정에 따라 명의차용자나 피용자를 지휘·감독하여야 할 지위에 있다고 인정되지 않으면 안 된다.
106956,자동차종합보험보통약관의 배상책임조항에서 무면허운전이 위험발생의 개연성이 큰 행위로 운전자체를 금지한 법규의 위반행위에 해당한다고 규정한 취지는 운전의 주체가 누구이든 보험의 보상대상에서 제외하려는 데에 있다.
199972,징발재산정리에관한특별조치법 제20조 제1항 소정의 징발재산정리에 해당 여부는 고도의 현대화된 작전개념에 맞추어 결정해야 한다.
86676,채권발생의 원인이 인정된 이상 특별한 사유가 없는 한 알맞는 손해금액이 산정될 수 있어야 할 것은 경험법칙에 비추어 당연한 법리라 할 것이다.
174788,甲과 동일모계에 의한 혈연관계가 성립하는 乙은 甲과 자동차보험계약을 체결한 보험회사인 丙 주식회사를 상대로 보험금지급 등을 구했다.
160193,저작권법 제2조 제32호에 규정된 공중에 해당하므로 甲 회사가 구입한 이용자들에게 계속 서비스를 이용할 수 있도록 한 행위는 乙의 공중송신권 또는 전송권을 침해한다고 볼 수 있다.
119876,손익상계의 법리는 손해배상이 실손해의 전보를 목적으로 하는 것인 만큼 피해자로 하여금 실손해 이상의 이익을 취득하게 하는 것은 손해배상의 본지에 반하는 것이다.
173611,甲 조합은 회생절차개시결정이 내려진 후 가지급물반환신청을 제기한 사안에서 가지급물반환채권은 회생채권에 해당하고 소송이 계속 중인 경우에 해당하지 않는다고 했다.
194500,국가배상책임이 인정되려면 법관의 직무수행상 준수할 것을 요구하고 있는 기준을 위반하는 등 법관이 부여된 권한의 취지에 어긋나게 이를 행사했다고 인정할 만한 특별한 사정이 있어야 한다.
70358,불법시위 및 인터넷을 통한 명예훼손행위에 의하여 사용자의 업무를 방해한 전 노동조합 조합원에 대해 손해배상책임을 인정한 사례이다.
208743,보험회사가 의료기관에 지급한 진료비 중 교통사고와 상당인과관계가 인정되지 않는 상해 등의 치료를 위해 지급된 금원 상당액은 피해자가 법률상 원인 없이 이득을 얻었다고 봄이 타당하므로 보험회사는 피해자에게 부당이득의 반환을 구할 수 있다.
150237,대리권 없음을 알았거나 알 수 있었을 것이라는 점에 대한 주장입증책임은 무권대리인에게 있다.
216945,이사가 임무를 수행함에 있어서 법령을 위반한 행위 자체가 회사에 대해 채무불이행에 해당하므로 그 행위 자체가 회사에 대해 채무불이행에 해당하므로 손해배상책임을 면할 수 없다.
197041,임대차 종료를 원인으로 건물명도를 청구하는 본소와 그 건물에 대한 합수 등을 건물주가 단절함으로 인한 손해배상의 반소청구는 목적물 또는 발생원인에 있어서 공통점이 있다.
115958,자동차손해배상보장법의 목적이 손해배상을 보장하는 제도를 확립함으로써 피해자를 보호하고 자동차 운송의 건전한 발전을 촉진함에 있음에 비추어 보면 승객의 고의 또는 자살행위는 의식적으로 행한 행위에 한정된다.
76222,자동차손해보상보험법 제3조 소정의 타인에 해당하지 않으며 자동차손보상보험법 제3조 소정의 타인에 해당하지 않는다.
230205,정리계획의 인가를 하기 위해서는 정리계획이 회사정리법 제233조 제1항 제2호 전단이 규정하는 공정·형평성을 구비하고 있어야 한다.
118873,"저작인격권은 저작물의 내용, 형식 및 제호의 동일성을 유지할 권리로서 저작물의 외형이나 내용을 수정, 증감하거나 표현형식을 변경할 수 없다."
220925,구 국공유재산처리임시특례법에 의해 사찰에게 수의매각된 부동산에 관해 담당 공무원이 매수인으로 표시한 매도증서를 발급해 주어 그 개인 명의의 원인무효의 소유권이전등기가 마쳐진 경우 담당 공무원의 과실을 인정한 사례이다.
75610,등기부상의 소유자와 실제 소유자라고 자칭하는 자가 불일치하는 경우 매매에 앞서 등기부상 소유명의자에게 대지의 소유관계를 알아봐야 한다.
146326,국제운송업자의 피용자 乙이 선하증권을 회수하지 않은 채 화물인도지시서를 발행한 것은 위법한 행위이다.
216363,구 내수면어업개발촉진법 제3조의2 제1항은 공공용수면이 아닌 내수면이라도 특별한 규정이 있으면 위 법을 적용하도록 하고 있고                                                                                                                                                                                                                                                                                                                                                                                                                                                                                                           
140489,공해소송에 있어서 피해자에게 사실적인 인과관계의 존재에 관해 과학적으로 엄밀한 증명을 요구하는 것은 공해로 인한 사법적 구제를 거부하는 결과가 될 우려가 있다.
104558,남해고속도로는 국유로서 건설부장관이 관리청이고 한국도로공사는 건설부장관의 권한의 일부를 대행하는 지위에 있으며 대행하는 범위 내에서 그 관리청이 되는 것 뿐이다.
196313,불법행위로 인한 일실수입을 산정하기 위해 노동능력상실률을 평가함에 있어서 의료보조기구의 착용 여부에 따라 피해자의 노동능력상실률에 차이가 있는 경우에는 의료보조기구를 착용한 상태를 기준으로 노동능력상실률을 평가해야 한다.
207147,버스여객자동차운송사업을 하는 甲 주식회사가 노사합의의 무효를 주장하며 정기상여금을 통상임금에 포함하여 산정한 추가 법정수당 등을 청구하는 것이 신의성실의 원칙에 위배되는지는 신중하고 엄격하게 판단해야 한다.
93915,총기오발 사고는 공무원이 그 직무를 집행함에 당하여 발생한 것으로 보아야 한다.
92343,위법한 농지분배처분을 원인으로 한 손해배상청구권의 소멸시효의 기산점은 상환이 완료한 때이고 소멸시효기간은 10년이다.
202825,신원보증인이 피보증인과 연대하여 손해를 배상하겠다는 내용의 신원보증계약을 체결한 경우 신원보증인의 책임은 원칙적으로 피보증인의 책임 범위와 동일한 것이다.
93783,학교법인의 대표자였던 자에 의한 차금행위가 불법행위가 된다면 이는 민법상 사용자의 배상책임이 아니고 민법 제35조에 의한 법인자체의 불법행위가 되어 배상책임이 된다.
199754,상소는 전부 승소한 판결에 대하여는 항소가 허용되지 않는 것이 원칙이나 하나의 소송물에 관하여 형식상 전부 승소한 당사자의 상소이익 부정은 절대적인 것이라고 할 수 없다.
93892,피담보채무가 채권최고액을 초과할 경우 근저당권가 입은 손해액을 산정하려면 사실심 변론종결당시를 표준으로 하여 싯가를 확정해야 한다.
105915,원심법원이 매도인의 손해배상책임을 인정함에 있어서 60평의 면적을 표준으로 삼은 것은 정당하다.
125183,국가배상법에 의한 손해배상청구에 적용되는 단기 소멸시효의 기산점은 민법 제766조 제1항에 정한 손해 및 가해자를 안 날의 의미와 그 판단 방법이다.
113762,이사회결의가 부존재한다고 하더라도 이에 대한 부존재확인을 구하는 것은 확인의 소로서의 권리보호 요건을 결여하게 되어 부적법하다.
228167,외과의사가 65세까지 의료업에 종사할 수 있는 것은 우리 경험법칙에 어긋나지 아니하며 외과의사가 65세까지 의료업에 종사할 수 있는 것은 경험법칙에 어긋나지 않는다.
105911,자동차종합보험약관 제3조에 의하면 보험증권에 기재된 피보험자의 승낙을 얻어 자동차를 관리 중인 자도 피보험자에 포함되어 있다.
112724,타인의 불법행위로 인해 상해를 입은 농업노동자의 일실이익 손해액을 계산함에 있어 사고가 발생한 때로부터 노임 인상이 있기 이전까지는 사고 당시의 노임액을 기준으로 하여야 한다.
165920,타인의 명의의 자동차운전면허증과 인장을 위조한 후 증권회사인 丙 주식회사에 계좌 개설을 신청했고 甲은 자동차운전면허증과 인장을 위조하여 계좌 개설을 신청했다.
233875,甲이 구 민주화운동 관련자 명예회복 및 보상 등에 관한 법률에 따른 보상금 지급결정에 동의하여 재판상 화해가 성립된 것으로 보아야 한다는 이유로 각하판결이 내려졌다.
70594,개구리소년 실종사건에서 경찰관들이 초동수사시에 범죄관련 가능성을 배제하였다고 볼 수 없고 유골 발굴 과정에서 현장보존 원칙에 위반하거나 현장을 훼손하지 않았다.
168180,우리 헌법은 교육을 통해 개인의 잠재적인 능력을 계발시켜 주고 인간다운 문화생활과 직업생활을 할 수 있는 기초를 마련해 주고 문화창조의 바탕을 마련하여 헌법이 추구하는 사회국가·복지국가의 이념을 실현한다.
74506,공무상 요양비를 받을 권리가 구체적으로 결정되지 않은 이상 요양비청구권의 존재에 대한 확인을 구할 이익이 없고 민사소송으로 공무상 요양비의 지급을 청구할 수도 없다.
84821,구 보험업법 제158조는 사용자의 배상책임에 관한 일반규정이고 구 보험업법 제158조는 민법 제756조에 우선하여 적용된다.
98728,민법 제496조는 고의의 불법행위로 인한 손해배상청구에 관해 상계금지규정을 두고 있으므로 원고의 위 손해배상청구권이 소멸되었다고 한 원심판단은 위법하다.
75944,재매매예약을 한 뒤 예약완결권의 행사를 최고하면서 재매매가격과 다른 가격으로 매수할 것을 최고한 것은 적법한 예약완결권 행사의 최고로는 볼 수 없다.
76520,은행지점 차장 갑이 동 지점에 보통예금 구좌를 개설하고 거래하던 을의 요청에 따라 타지점으로부터 송금되어온 예금이 있음을 확인하고 동 은행지점장 명의로 동액 상당의 보관증을 작성해 주었다.
73486,위 매매행위는 채권자의 강제집행을 면탈할 의도로 사해행위를 한 사해행위임이 분명하다.
234615,甲이 甲의 인감증명서 등을 제출받고 甲과 전화 통화 시 연대보증 의사를 확인하였다는 사정만으로 甲과 戊 은행 사이에 근보증계약이 체결되었다고 할 수 없다.
152579,판단유탈로 인한 이유불비의 위법한 판단유탈로 인한 이유불비는 판단유탈로 인한 이유불비의 위법이다.
184151,甲은 甲의 증세에 대한 원인을 찾기 위해 추가적인 검사를 실시하거나 상급의원으로 전원시킬 주의의무가 있음에도 불구하고 추가적인 조치를 하지 않아 위암의 진단 및 치료의 적기를 놓치게 했다.
228685,점포가 파손된 경우 통상의 손해는 불법행위 당시 그 점포의 교환가격이고 그 점포를 사용하여 얻을 수 있었던 이익은 교환가격에 포함되어 있다고 볼 것이므로 손해의 배상을 구할 수 없다.
196327,불법행위나 채무불이행으로 인한 손해배상청구권이나 부당이득반환청구권은 객관적이고 합리적으로 판단해야 한다.
198019,의료기관 또는 의사가 치료비를 청구함에 있어 치료행위와 일반의료수가 사이에 현저한 불균형이 존재하고 그와 같은 불균형이 피해 당사자의 무경험에 의해 이루어진 경우 무효이므로 지급을 청구할 수 없다.
118857,"법인이 해외학술연수자에 대하여 등록금, 체재비 등의 연수경비를 지급하고 연수자가 귀국 후 의무복무기간 동안 근무하지 않을 경우 총 의무복무기간에 대한 비율에 해당하는 금액을 반환하기로 하는 약정은 근로기준법 제24조가 금지하는 예정이다."
222621,산재보험법 제87조 제1항에 따라 재해근로자의 손해배상청구권을 대위할 수 있는 범위는 보험급여 중 제3자의 책임비율에 해당하는 금액으로 제한된다.
117047,감정평가업자의 부실감정으로 손해를 입게 된 감정평가의뢰인이나 제3자는 지가공시및토지등의평가에관한법률상의 손해배상책임과 민법상의 불법행위로 인한 손해배상책임을 물을 수 있다.
76940,반소피고가 이의하지 아니하면 책문권을 상실한다.
82286,구 자동차손해배상보장법 제3조에 의한 손해배상채권과 채무가 상속으로 귀속하더라도 교통사고의 피해자에게 책임보험 혜택을 부여하여 보호해야 할 사회적 필요성은 동일하다.
231325,피해자의 현증상이 기왕증으로서 노화현상과 결부된 것이며 의학상으로는 피해자의 기왕증을 어느 정도 심화시키고 어느 정도 기여했는지 판단할 수 없다.
103296,불법행위 당시 일정한 수입을 얻고 있던 피해자의 상실수입손해액은 객관적이고 합리적인 자료에 의해 피해자가 사고당시에 얻고 있었던 수입금액을 기초로 산정해야 한다.
77010,임차인이 사고발생을 미리 막아야 할 주의의무가 있음에도 이를 게을리한 경우 과실은 70퍼센트 정도 참작하면 타당하다.
70480,"채무자 회생 및 파산에 관한 법률 제32조의2 규정의 취지에 반하고 직원의 근로의 권리, 직업행사의 자유를 과도하게 침해하는 것으로 사회통념상 그 상당성을 인정하기 어렵다."
84607,부랑인선도시설 및 정신질환자요양시설에 대한 지방자치단체장의 지도·감독사무에 관한 법규의 규정 형식과 취지를 고려하여 판단해야 한다.
172957,원상회복의무를 규정하는 민법 제548조 제1항 본문은 부당이득에 관한 특별규정의 성격을 가지며 그 이익 반환 범위는 특단의 사유가 없는 한 받은 이익의 전부이다.
126141,건설공제조합과 주계약상 보증인은 채권자에 대한 관계에서 채무자의 채무이행에 관하여 공동보증인의 관계에 있다고 보아야 한다.
114744,의장법 제65조 본문에서 0b타인의 의장권 또는 전용실시권을 침해한 자는 그 침해행위에 대하여 과실이 있는 것으로 추정한다.
69675,범죄현장에서 채취한 지문이 피의자의 것과 일치하고 절도범의 침입방법이나 경로가 피해자들의 진술내용과 부합한 점 등에 비추어 긴급체포 및 구속 당시 피의자의 혐의를 의심할 만한 합리적인 이유가 있었다고 볼 수 있다.
231317,철도청이 부산시에 매각하기 위하여 철도로서의 용도폐지를 결정하고 궤도를 철거하였다 하더라도 국가는 붕괴로 인한 사고로 입은 손해를 배상할 책임이 있다.
232117,전세목적물이 당사자 쌍방의 귀책사유 아닌 다른 사유로 멸실된 관계로 전세권설정자가 사용수익케 할 의무를 이행할 수 없게 된 경우 의무있는 전세권설정자가 위험을 부담한다.
152514,구 민법상의 상무취체역에 대한 보수는 상당액을 증거에 의하여 일정액으로 인정한 조처에 위법이 있지 아니하다.
106663,임야매매계약의 매수인이 계약에 따른 잔대금지급의무를 이행하지 않은 것은 대한주택공사에 의해 분묘들이 모두 이장될 때까지 5년 동안이나 지체했기 때문이다.
72465,본인과 대리인과의 사이에는 적법한 대리관계가 존재하여야 하며 이를 주장하는 당사자가 입증해야 한다.
70346,아파트 입주자가 해외여행을 떠난 사이에 절도범이 침입하여 귀금속류를 절취한 사안은 경비용역회사의 입주자에 대한 손해배상책임을 부정한 사례이다.
234339,의사는 의료행위에 대한 설명이나 의사결정능력이 없는 환자에게 의료행위에 대한 의사결정권을 가질 수 있다.
226407,도급인은 하자보수비용을 민법 제667조 제2항에 따라 손해배상으로 청구할 수 있고 민법 제390조에 따라 손해배상으로 청구할 수 있다.
168491,배구단운영회사와 배구선수가 전속계약을 체결함에 있어 선수의 위약시의 손해배상액의 예정비율을 연 2할 5푼으로 정하였으나 다른 구단에 입단한 경우 전속계약을 불이행하게 되었다.
102591,타인의 불법행위로 인해 상해를 입은 피해자가 부상으로 인해 직업에 종사할 수 없게 된 경우 일실이익은 향후 소득을 공제하는 방법으로 산정할 수 있다.
169626,구 공공용지의 취득 및 손실보상에 관한 특례법 시행규칙 제23조의5는 공공사업의 시행으로 인해 배후지의 3분의 2 이상이 상실되어 영업을 할 수 없는 경우 손실액을 평가하여 보상한다고 규정하고 있다.
202857,갑이 을 회사와의 중기위수탁계약에 의해 을 회사 앞으로 소유자등록을 했다면 갑으로서는 중기의 소유권침해에 대한 손해배상청구권을 가질 수 없다.
234447,이사가 이사의 행위에 대해 경영판단의 원칙을 적용하기 위한 요건 및 이사의 경영판단을 정당화할 수 있는 이익은 회사가 실제로 얻을 가능성이 있는 구체적인 것이어야 한다.
122185,사고차량의 운행자에게 일반의 교통사고와 같은 책임을 지우는 것이 불합리하다고 인정되는 경우 배상액을 감경할 수 있다.
75388,교통사고로 인한 상해가 중대한 사실을 알지 못한 채 합의에 이른 경우 법률행위내용의 중요한 부분에 착오가 있었다고 할 것이므로 취소의 의사표시에 의해 합의는 무효로 돌아간다.
74869,주식거래에 관한 아무런 위탁관계를 맺지 않고 소외 1의 행위를 피고 회사의 사무집행에 관련한 행위라 볼 수 없으며 원고와 소외인 사이의 개인적인 대차관계 또는 위임관계로 보아야 한다.
142924,보험자의 대리인이 보험계약자와 사이에 보험계약을 체결하고 보험계약자로부터 회분 보험료를 받으면서 약속어음을 함께 교부받았다면 변제수령의 효과는 보험자에 미친다고 할 것이다.
71353,학교 체육관에서의 태권도 연습시간에 피해자가 상대방의 발에 얼굴을 맞아 부상을 입은 경우 감독이나 코치의 보호·감독의무가 있다고 보기는 어렵다.
76396,위 사고는 경험이 부족한 수련의에게 수술 및 수술회복조치를 담당하게 한 수술관리상의 잘못으로 인한 것으로 추정된다.
212049,자동차손해배상보장법 제3조 소정의 운행공용자는 자동차 소유자의 운행지배 및 운행이익을 완전히 상실하였다고 인정되는 특별한 사정이 없는 한 운행공용자로서의 책임을 면할 수 없다.
168201,집배원이 보험계약 해지 통보서를 송달하지 않았음에도 허위의 공문서를 작성하여 보험회사가 입은 손해에 대해 국가배상책임을 인정한 사례이다.
191579,매수인이 상행위를 목적으로 할부계약을 체결하는 경우라 함은 자신의 소비만을 목적으로 한 경우가 아닌 영리를 목적으로 할부계약을 체결하는 경우를 의미한다.
106128,노동능력상실율을 잘못 인정한 위법이 있다고 본 사례 배관공으로서의 노동능력상실율을 잘못 인정한 위법이 있다고 본다.
160191,甲이 트랙터 및 트레일러에 길이의 천장 크레인을 적재한 상태로 운행하다가 甲 운전의 차량에 적재된 천장 크레인을 피하지 못하고 정면부를 충격하는 사고가 발생했다.
95945,교통사고로 인한 상해가 치유된 후 우측경골의 단축 등으로 15퍼센트의 자동차운전능력이 상실되었다면 고용주가 이를 고용하여 운전하게 하리라고 기대하기 어렵다.
211243,중앙선이 설치된 도로를 자기 차선을 따라 운행하는 자동차 운전자는 상대방 자동차가 중앙선을 침범하여 들어올 것까지 예상하여 특별한 조치를 강구해야 할 주의 의무가 없다.
108432,불법행위로 인해 발생한 손해 중 장래 소요되는 입원치료비는 불법행위로 인한 상해의 발생과 동시에 확정하는 것이라 하더라도 치료가 장래 오랜기간에 걸쳐 정기적으로 필요한 경우에 전액을 청구하려면 중간이자를 공제해야 한다.
211321,손해배상책임이 인정되는 경우 법원은 당사자의 주장과 증명이 미흡하더라도 적극적으로 석명권을 행사하여 증명을 촉구해야 하고 경우에 따라서는 직권으로 손해액을 심리·판단해야 한다.
