number,contents
76608,피해자의 노동능력상실이 기왕증과 사고로 인한 부상의 경합으로 야기된 것이라면 가해자는 위 상해로 인한 부상이 피해자의 노동능력상실이라는 결과 발생에 기여하였다고 인정되는 한도 내에서 배상책임을 부담해야 한다.
64997,사업주체와 건설공제조합이 각 하자보수보증계약 사이에서 보증기간이나 보증대상이 중복되는 것을 배제하기로 하는 등의 특별한 약정을 하지 않는 한 하나의 하자가 각 하자보수보증계약의 보증대상에 중복적으로 해당하는 경우도 발생할 수 있다.
229187,심장수술 중 발생한 대동맥박리는 부적절한 캐뉼라 삽관에 의해 초래된 것이라고 추정할 수밖에 없다.
229075,부동산등기법 제49조의 각 규정 취지에 의하면 부동산등기법 제49조 소정의 확인은 등기공무원이 수행해야 할 확인 업무를 등기공무원에 갈음하여 행하는 것이다.
115822,12인승 승합차는 주운전자가 소지한 2종보통운전면허로는 이를 운전할 수 없고 주운전자가 그 자동차를 운전한 것은 무면허운전에 해당한다.
155532,자동차손해배상보험법 제3조는 구 국가배상법과 저촉되는 범위에서는 동법의 관계규정보다 우선 적용되며 구 국가배상법과 저촉되는 범위에서는 동법의 관계규정보다 우선 적용된다.
73233,특정채무의 담보로서 하는 저당권을 설정함이 없이 채권자와 근저당권설정계약을 맺고 이에 따른 근저당권을 설정한 것이라면 근저당권의 효력이 미친다.
234241,승무여비는 출장시마다 소비되는 것이므로 일실이익금의 산정에 있어서 급료에 포함할 수 없는 성질의 승무여비는 급료에 포함할 수 없다.
215423,망인들이 국가를 상대로 농지분배처분을 원인으로 하는 소유권이전등기청구소송을 제기했으나 패소판결이 선고되었다.
105165,고등학교 2학년에 재학중인 자는 불법행위에 대한책임을 변식할 지능이 있으며 책임능력이 있는 미성년자의 불법행위로 손해가 발생한 경우 그 발생된 손해가 미성년자의 의무위반과 상당인과관계가 있으면 감독의무자는 손해배상의무가 있다.
223019,공탁금출급청구권을 부당이득한 악의의 수익자는 공탁금에 대한 민사 법정이율인 연 5푼 상당의 이자와 공탁금 이율인 연 2푼 상당 이자의 손해를 배상할 의무가 있다.
102979,가옥임대차에 있어서 임대인은 임차인으로 하여금 목적물을 사용수익하게 할 의무가 있고 그 의무내용에는 목적물의 수선의무도 포함되어 있다.
153126,보도내 사실 자체는 진실이라 하더라도 허위의 사실을 적시한 것으로 보아야 하며 보도내용의 주된 부분은 암시된 사실 자체라고 보아야 한다.
115183,구 국유재산법 제7조는 국유재산 처분 사무의 공정성을 도모하기 위해 관련 사무에 종사하는 직원에 대하여 부정한 행위로 의심받을 수 있는 행위를 적시하여 엄격히 금지하고 있다.
83163,상법 제332조 제2항은 주금납입의 효력이 발생한 주금의 가장납입의 경우 적용되지 않고 주금의 가장납입이 일시 차입금을 체당납입한 것과 같이 볼 수 있다.
194932,소송요건을 구비하여 적법하게 제기된 본소가 그 후에 상대방이 제기한 반소로 인하여 다시 부적법하게 되는 것은 아니므로 소송요건에 흠결이 생겨 다시 부적법하게 되는 것은 아니다.
118848,갑회사가 소외 을회사와의 사이에 주방설비납품계약을 체결하면서 계약금 약정은 특별한 사정이 없는 한 이행이익의 상실로 인한 손해배상액의 예정으로 봄이 상당하다.
72778,공동불법행위자의 한 사람이 피해자로부터 제기된 손해배상청구소송을 반드시 다른 공동불법행위자에게 고지하여야 할 법률상의무를 부담하는 것은 아니다.
219659,일반 국민들은 사회에서 발생하는 제반 범죄에 관한 알권리를 가지고 있고 수사기관이 피의사실을 발표하는 것은 국민들의 권리를 충족하기 위한 방법의 일환이다.
85792,인감증명은 거래행위자의 동일성과 거래행위가 행위자의 의사에 의한 것임을 확인하는 자료로서 인감증명사무를 처리하는 공무원으로서는 발급된 인감증명으로 인한 부정행위의 발생을 방지할 의무가 있다.
185080,민사소송법 제1조 제1항은 법원은 소송절차가 공정하고 신속하며 경제적으로 진행되도록 노력해야 한다고 하여 민사소송의 이상을 공정·신속·경제에 두고 있다.
94274,채권계약에 있어서 당사자 사이에 교부된 계약금은 해약금으로서의 성질을 가지나 계약금을 위약금으로 하기로 하는 특약이 없는 한 손해배상액의 예정으로서의 성질을 가진 것이라고 볼 수 없다.
116982,각서에 기재된 귀책사유라 함은 손해배상책임 발생의 주관적 요건으로서의 고의 또는 과실을 의미한다.
114926,"54세 남짓의 나이로 농촌지역에 거주하면서 자영농으로 전답을 경작하여 온 자의 가동연한을 산정함에 있어 농촌노동능력의 고령화 추세, 피해자의 사고 당시 경작형태 등 여러 사정을 고려했다."
114513,공사도급계약을 체결하면서 부가가치세를 별도로 지급하기로 약정하였음에도 불구하고 도급인이 수급인에게 공사대금 일부를 지급하면서 부가가치세 상당액을 지급하지 않은 경우 원심판결을 수긍했다.
64771,채무자가 회생 및 파산에 관한 규칙 제72조에 정한 첨부서류를 제출하지 않아 법원이 보정을 촉구하였음에도 채무자가 정당한 사유 없이 응하지 않은 경우 파산신청을 기각하는 것은 허용되지 않는다.
74254,부진정 연대채무관계가 성립되는 경우 다른 공동 불법행위자에게도 면책의 효력이 미친다고 볼 수 없고 기대수입상실 손해로 수령한 금원 한도 내에서만 면책의 효력이 미친다.
116490,예인선과 피예인선이 충돌한 경우 예인선의 선박소유자는 선장이나 선원들의 항해상의 잘못으로 인한 손해를 상대방 선박소유자에게 배상책임이 있다.
228351,乙이 乙에게 대출원리금 상환을 청구하거나 가압류 등의 조치를 취하지 않고 있는 점과 丁이 채권자에게 이를 변제하지 아니한 상태에서 대출원리금 상당의 재산상 손해가 발생하였다고 단정하기 어렵다.
205652,세월호 사고의 현장지휘관이 구조 업무를 수행하면서 적절한 구조지휘 및 승객 퇴선 유도조치를 하지 않은 과실이 인정되는데 이는 직무상 의무를 위반한 위법행위에 해당한다.
122915,사용자와의 단체협약갱신협상에서 유리한 지위를 차지하기 위해 조합원들로 하여금 월차휴가를 실시하게 한 것이 부당한 쟁의행위에 해당한다.
202923,토지 매도인의 소유권이전등기의무가 이행불능상태에 이른 경우 매도인이 매수인에게 배상하여야 할 통상의 손해배상액은 매수인이 그 위에 건물을 신축할 것이라는 사정을 알고 있었다면 손해는 특별한 사정으로 인한 것이다.
92985,직무수행상의 주의의무를 다하지 않은 경우 피해자의 과실정도가 크다고 하드라도 국가는 손해배상책임을 면치 못한다.
104208,불법행으로 사망한 피해자의 일실수익을 산정함에 있어서는 사망 당시의 피해자의 수익을 기준으로 산정해야 하고 객관적인 자료가 있는 때에는 증가될 수익도 고려되어야 한다.
201610,책임능력 있는 미성년자의 불법행위로 인하여 손해가 발생한 경우 그 손해가 미성년자의 감독의무자의 의무위반과 상당인과관계가 있는 경우 감독의무자는 일반불법행위자로서 손해배상의무가 있다.
76036,상호신용금고의 대표이사가 제3자발행의 약속어음에 보증의 의미로 배서한 경우 상호신용금고는 위 배서가 위법한 것으로 믿고 동 어음을 취득한 소특인이 입은 손해를 배상해야 한다.
214313,의사에게 의료행위를 할 때 임상의학 분야에서 실천되고 있는 의료행위의 수준을 기준으로 판단해야 하며 의료행위의 특수성 등을 고려하여 규범적인 수준으로 파악해야 한다.
153571,당초의원인으로서 당초의 불법원인급여사실을 주장하게 되는 청구는 불법원인급여의 반환청구의 범위에 속한다.
154397,평균임금 산정의 기초가 되는 임금총액에는 사용자가 근로자에게 지급하는 일체의 금품으로 사용자에게 계속적·정기적으로 지급되고 근로자에게 지급의무가 지워져 있으면 명칭 여하를 불문하고 모두 포함된다.
153798,국가 또는 공공단체라 할지라도 대등한 지위에서 사경제의 주체로 활동했을 경우 손해배상의 책임에 국가배상법의 규정이 적용될 수 없다.
226873,토지보상법 제91조 제1항은 해당 사업의 폐지·변경 또는 그 밖의 사유로 취득한 토지의 전부 또는 일부가 필요 없게 된 경우 그 토지에 대하여 받은 보상금에 상당하는 금액을 사업시행자에게 지급하고 그 토지를 환매할 수 있다고 규정하고 있다.
213115,甲이 乙 주식회사 등을 상대로 甲의 제품 형태를 모방한 제품을 수입·판매하여 부정경쟁방지 및 영업비밀보호에 관한 법률 제2조 제1호목에서 정한 부정경쟁행위를 하였다며 손해배상을 구했다.
94182,부두하역작업에서 동인이 계속적인 근무가 아니고 보수를 지급한 것도 아니며 사실상의 사용관계만으로 동인을 피고 회사의 피용자라고 보아야 한다.
74883,거시증거와 변론의 전취지는 그 자격 조건과 일의 정밀도 및 난이도 등에 비추어 65세를 마칠 때까지 종사할 수 있다는 사실을 인정할 수 있다.
155120,대한민국과 아메리카합중국간의 상호방위조약 제4조에 의한 시설과 구역 및 합중국 군대의 지위에 관한 협정 제23조 제8항 소정의 분쟁이 없을 때에는 공무집행중으로 보아 책임을 인정한 원판결 판단을 위법이라 할 수 있다.
172339,乙은 甲 종중의 총회나 이사회의 결의가 없더라도 종중 대표자의 권한에 기초하여 매매계약에 부수하는 수수료 지급 약정을 체결할 수 있다.
114737,공동광업권자는 광업권 및 광업권 침해로 인한 손해배상청구권을 준합유한다고 보아야 하며 새로 공동광업권자가 된 자의 지분에 해당하는 부분만 소멸시효가 중단된다.
126270,신용관리기금의 정관에도 경영 및 재산상태가 불건전한 종합금융회사의 인수·관리가 규정되어 있고 재정경제원장관이 신용관리기금 이사장을 선임한 것도 업무범위에 대한 고려에서 비롯된 것으로 보인다.
94510,강제집행의 집행비용은 가집행선고로 인한 지급물 자체라고는 할 수 없으나 원고의 집행에 의하여 피고가 부담하게 된 손해이다.
223009,범인과 범죄혐의자에 대한 공개적 신원노출은 원칙적으로 허용되지 않으며 그에 따라 범죄에 관한 언론의 보도에 있어서는 관계인의 신원을 밝힐 수 없다.
118634,자동차종합보험보통약관의 피보험자가 보험기간 중 자동차를 양도한 때에는 보험계약자 및 피보험자의 권리의무를 함께 양도한 것으로 추정한다.
194546,시험검사만을 받은 상태의 온천공이 있는 토지의 공유자인 신청인이 온천법의 특별 규정에 따라 철거한 시설물을 다시 설치하기에 용이한 점 등의 제반 사정에 비추어 보전의 필요성이 있다.
75537,국가배상법 제2조 제1항 단서의 규정은 공무집행과 관련하여 피해를 입은 공무원에 대한 국가의 불법행위책임자체를 부정하는 규정이라고 봄이 상당하다.
74510,제2차 변칙적 담보채권자 앞으로 가등기가 된 경우 채무자는 채무를 변제하고 목적물을 환수할 수 없다.
194040,채권가압류이의사건의 수소법원 사무관이 제3채무자에게 가집행선고부 가압류취소판결의 정본을 송달한 행위는 국가배상법 제2조 제1항의 법령에 위반한 행위에 해당하지 않는다.
176329,"甲과 乙 보험회사가 피보험자의 사망 시 원인에 따라 교통재해사망보험금, 일반재해사망보험금, 일반사망보험금을 지급하는 보험계약을 체결하면서 보험계약일부터 2년이 지난 후 면책을 허용하지 않는다는 약관 조항을 두었다."
217955,양도성예금증서는 권리의 이전 및 행사에 증서의 소지를 요하므로 양도성예금증서가 실제로 발행된 바 없다면 은행 직원에게 그 자금을 제공한 것만으로는 양도성예금증서에 관한 매매계약이 성립할 수 없다.
76841,의료보험법 제45조에 따라 피보험자의 사용자에 대해 부당이득징수고지처분을 한 경우 그 고지처분은 행정처분에 해당되므로 무효확인을 구하는 소는 행정소송이다.
210239,해외 현지법인은 모회사에 대하여 구상권 기타 법률상의 권리를 가지고 있으므로 대북송금과정상 불법행위의 피해자라고 볼 수 없다고 했다.
211199,"부동산중개업법 제19조 제1항, 제3항의 규정에 의해 부동산중개업자가 중개행위를 함에 있어서 고의 또는 과실로 재산상의 손해를 입은 경우의 손해를 보상하기 위해 체결한 인·허가보증보험계약은 타인을 위한 손해보험계약이다."
191467,도급인이 건물을 완공하였음에도 공사잔대금을 지급받지 못하는 때에는 공사잔대금조로 공사관련 채무를 인수하고 부동산 소유권을 양도받기로 약정한다.
167379,상표권자 甲이 보험서비스 상품을 홍보하기 위해 제작한 광고에 등장하는 인형에 甲의 등록표장과 유사한 메리츠 걱정인형이라는 표장을 사용했다.
198357,불법행위의 피해자로서는 손해부담의 공평이라는 손해배상제도의 이념에 따라 손해의 확대를 방지하거나 경감하기 위해 상당한 노력을 해야 할 의무가 있다.
73982,급부의 소에 있어서 당사자적격의 문제는 원고의 청구자체로서 판가름이 되는 것으로 원고들은 각 토지의 경작권을 침해한 피고에 대해 손해배상을 청구하는 것이다.
214957,행위의 외형상 법인의 대표자의 직무행위라고 인정할 수 있는 것이라면 법령의 규정에 위배된 것이었다 하더라도 직무에 관한 행위에 해당한다.
116869,전처와 공동으로 할부판매보증보험계약상의 채무를 연대보증한 경우 표현대리 책임을 부정한 원심을 심리미진을 이유로 파기한 사례도 있다.
76883,야구부원이 같은 학교 3학년에 끼어들어 공을 던져 반대편 학생의 눈을 다치게 했다면 위 사고의 발생을 막지 못한 직무상의 과실이 있다.
206763,피고는 일정액의 자금을 투자하여 자동차정비공장을 동업함에 있어 이익이 난 액수에 관계없이 피고에게 매월 일정액을 지급하거나 친지들의 차량을 정비해 주었다.
145369,부정경쟁방지법 제2조 제1호 소정의 부정경쟁행위를 판단함에 있어서 타인의 상품표지 또는 영업표지가 국내에 널리 인식되었는지 여부가 기준이 된다.
80545,수인이 공동하여 타인에게 손해를 가하는 민법 제760조의 공동불법행위는 객관적으로 그 공동행위가 관련되어 있으면 족하고 손해가 발생하면 배상책임을 지는 공동불법행위가 성립한다.
197179,국토이용관리법상 토지거래허가지역 내의 토지에 관한 매매계약은 처음부터 그 허가를 배제하거나 잠탈하는 내용의 계약일 경우 확정적 무효로서 유효화될 여지가 없다.
211425,민사집행법 제300조 제2항에서 정한 임시의 지위를 정하는 가처분은 응급적·잠정적인 처분이므로 다툼 있는 권리관계의 존재를 요건으로 한다.
119289,근로계약관계는 사람의 인적 결합관계가 상당기간 지속하는 계속적 계약관계이므로 인적인 신뢰관계를 전제로 하는 것이고 그 관계가 깨지면 계약관계의 기반이 상실된다.
219609,영화상영관 시설을 보유하고 영화상영업을 영위하는 甲 주식회사 등이 영화 관련 정보를 장애인차별금지 및 권리구제 등에 관한 법률에서 금지하고 있는 차별행위를 시정하기 위한 조치를 구했다.
114873,피해자의 일실수입을 전경력 화가의 수입으로 산정한 원심판결을 일실수입 산정의 법리에 반하거나 채증법칙을 위반한 잘못이 있다고 보아 파기한 사례이다.
97680,일방이 출자의무의 이행으로 소요된 비용에 대해 조합계약의 해지에 따른 청산을 구함은 별론으로 하고 채무불이행으로 인한 손해배상을 구할 수는 없다.
201642,저수지에 빠진 사람을 구출하려다가 함께 익사한 사고가 저수지의 설치 보존의 하자로 인한 것이라고 본 사례다.
216261,도급인은 하자에 갈음한 손해배상채권 등에 기한 동시이행의 항변으로 하수급인에게 대항할 수 있다.
76140,"예금업무를 취급하는 피용자가 수금한 예금 12,500,000원을 횡령한 사실이 발각되어 그의 부가 변상한 사실이 있었다면 사용자는 신원보증인들에게 불성실한 사적을 통지해 줌으로써 횡령에 따른 책임을 면해야 한다."
196362,수용토지의 소유권을 회복할 수 있는 권리관계를 불안정하게 하고 불합리한 결과를 초래할 수 있기 때문에 수용토지의 소유권을 회복할 수 있는 권리를 인정해야 한다.
81917,무면허 또는 도난운전이 보험계약자나 피보험자의 묵시적 승인하에 이루어졌는지 여부는 보험계약자나 피보험자의 묵시적 승인하에 이루어졌는지 여부를 참작하여 인정할 것이다.
209957,채권자가 유기시설들에 대한 처분권이 집행채무자에게 있다고 믿은 데에 과실이 있다는 이유로 선의취득 주장을 배척한 사례이다.
204049,보험회사 대리점은 보험약관에 따라 보험기간이 24:00 이미 시작된 것으로 기재된 보험료영수증을 교부한 경우 약정일에 보험계약이 체결되어 보험회사가 보험료를 영수한 것으로 보아야 한다.
118934,물품운송계약에 있어서 운송인으로부터 훼손된 목적물을 인도받은 수하인이 훼손된 상태 그대로 전문검사기관에 검사의뢰하는 행위는 수하인의 과실이 될 수 없다.
100951,지입차주들은 수탁관리운영계약에 의해 회사로부터 그 소유 차량들의 운행관리권을 위임받아 통상업무에 속하는 자동차의 운행관리를 대리하는 것으로 볼 것이다.
184755,확정된 조정을 갈음하는 결정에 인정되는 확정판결과 동일한 효력은 권리관계의 존부에 관한 판단에만 미치므로 권리관계에도 효력이 미치려면 결정의 기재 내용에 의하여 권리관계가 되었다고 인정할 수 있어야 한다.
196029,사해행위의 목적인 부동산에 수 개의 저당권이 설정되어 있다가 일부의 저당권만이 말소된 경우 원상회복은 가액배상의 방법에 의할 수밖에 없다.
145881,이휘소 유족의 동의 없이 가족 사진을 무단으로 게재한 행위는 유족들의 초상권을 침해한 것이며 이휘소라는 실명을 사용하여 창작된 소설은 그의 명예를 훼손시키는 내용이 아닌 한 허용되어야 한다.
76679,임차인이 임차보증금반환청구를 하는 경우 화재로 목적물이 멸실되거나 파손된 부분의 수선이 불가능하여 목적물이 반환되었다고 볼 수 없는 경우가 아닌 한 임대인은 보증금반환채무를 거절할 수 없다.
65017,"파견사업 성격상 파견사업주가 직접적으로 근로자를 관리·감독할 지위는 없지만 파견근로자보호 등에 관한 법률 제34조, 제35조 제2항에 따라 재해보상에 관한 근로기준법, 산업재해예방에 관한 산업안전보건법 제5조를 적용한다."
76920,제반주의의무를 게을리한 임차인의 전체손해에 대한 과실비율은 90% 정도로 보는 것이 상당하다.
105762,자동차운전자가 마주오는 자동차의 불빛을 보고 충돌을 피하려고 핸들을 꺾다가 도로가의 가로수를 들이받고 벼랑에 떨어지는 바람에 피해자에게 어떤 과실이 있다고 할 수 없다.
85794,손해배상청구소송에서 기왕증과 관련 사고 이전에 이미 기왕증이 있었던 경우에 기왕증으로 인한 노동능력상실의 정도와 사고와 피해자의 기왕증이 경합하여 후유증이 나타난 경우에 기왕증이 후유증이라는 결과 발생에 기여한 정도는 구분해야 한다.
198317,통상의 채권 양도와 달리 양도인의 채무자에 대한 통지는 채무자에 대한 대항력이 생기지 않으며 반드시 채무자의 동의를 얻어야 대항력이 생긴다.
183393,조합이 이익금을 정산할 경우 이익배당은 매 분기 종료 시에 청구할 수 있고 이익배당금은 연도 말 기준으로 배당 가능한 최종 이익이 있어야 청구할 수 있다.
106571,피고 농지개량조합이 관리하는 용수로가 부락 앞을 통과하고 있어 통행인이나 어린이들이 접근하다가 추락할 위험이 큰 곳이어서 피고는 위험표지판이나 방책 등을 설치하여 사람들의 접근을 막았다.
119189,노동조합의 쟁의행위는 개개인의 집단적 행위에 의하여 이루어진다는 2면 집단적 성격을 가지고 있으며 위법쟁의를 이유로 한 민사상 손해배상책임을 부담하는 1차적 주체는 노동조합이다.
74004,중소기업협동조합법 47조 2호에 의하면 기채행위를 함에 있어서 이사회의 의결을 거치도록 규정되어 있고 이는 강행규정에 위반되어 무효가 된다.
81831,정신병원에서 입원치료받던 고령의 정신병환자가 두부외상을 입고 그 후 치매증상을 보이게 되었는데 치매가 발생하려면 뇌의 손상이나 기능 장애가 생겨야 한다.
165461,집합건물의 소유 및 관리에 관한 법률에 의하여 하자담보추급권으로 인정되는 손해배상청구권은 입주자대표회의에는 권리가 없고 구 주택건설촉진법 및 구 공동주택관리령에 의해 개별적으로 소를 제기할 수 있다.
184396,언론매체의 기사가 타인의 명예를 훼손하여 불법행위가 되는지는 일반 독자가 기사를 접하는 통상의 방법을 전제로 기사의 객관적 내용 등을 종합적으로 고려하여 판단해야 한다.
226641,해외이주 알선업체인 乙 주식회사와 미국 비숙련공 취업이민에 관한 계약을 체결하면서 미국 이민법 변화에 따라 요구하는 사항 및 수속 변화는 사전 통고 없이 변경될 수 있다.
74870,"공무원의 순수한 직무상의 행위로 말미암 국가 또는 공공단체가 직접적인 재산상의 손해를 입었을 경우 회계관계직원 등의 책임에 관한 법률, 물품관리법 등에 의하여 책임을 지지 않는다."
86526,구 민법 제715조의 사업 또는 사무가 영리를 목적으로 하는 여부와 공무나 사무임을 묻지 않는다고 해석되는 바 일방 동조에서 그 사업의 집행에 관하여 설명한다.
156734,동장의 신원보증인이 된 자는 국가위임사무를 처리하면서 국가에 입힌 손해까지 배상할 의무가 있다.
156648,건널목에는 간수가 지키고 있지 않으나 통행하는 사람이나 자동차에서 볼 수 있는 건널목이라는 표시와 간수의 근무시간을 기재한 표시가 설치되어 있다.
73203,원고들에게 직접 소송을 수행할 능력이 없다고 보여진다면 피고는 원고들이 변호사에게 지급할 보수금을 손해로서 배상할 의무가 있다.
207774,유치원설립이 다른 사람의 공연장설치를 방해할 의도에서 행하여졌다면 형식상 정당하더라도 유치원설립자는 공연장설립방해로 인하여 손해를 배상할 책임이 있다.
165311,가.채무불이행으로 인한 손해배상의 경우 법원이 채권자측의 과실을 참작하여 손해배상의 범위를 정함에 있어 채권자가 입은 전체 손해액을 기준으로 해야 한다.
147608,구 저작권법은 구 저작권법상의 사진저작물로서 보호될 정도로 보호될 정도로 촬영자의 개성과 창조성이 인정되는 저작물에 해당한다고 볼 수 있다.
