number,contents
205185,공탁 공무원 여 정하   절차 의하 어 공탁금 지급 하 지 않 고 직접 민사 국가 상대 공탁금 지급 하   부당 하 다   
204827,부가 공동 속한 거주 가옥 부지 자의 대리권 없이 매도 하 고 사망 하   매수인 매매 대금 상당액 을 지급 하 기로 약정 하   것 만 망부 무 권 대리 행위 추인 하   것 보   없 다   
205212,부동산 소유자 명의 만 을 다른 사람 신탁 하 등기 권리증 같 권리 관계 증명 하 서류 명의 신탁자 소지 하 것 상례 다   
108859,부동산 소유권 이전 등기 등   특별 조치법 의하   소유권 이전 등기 적법 하   절차 따르 아 마 쳐지   등기 추정 되 지만 허위 보증서 확인 서 트 어 잡 아 경 료 되 었 되 번복 되  다   
205221,원고 종중 공동선 조의 분묘 수호 등 을 목적 손들   구성 되   자연적 집단 보기 어렵 어 실체 하   없 으므로 당사자 능력 없다 고 보   조치 수긍 하 었 다   
205227,부동산   점유 인하   소유권 취득 시효 완성 되 었 다 하 더라도 등기 하 지 않 고 있 사이 저   소유권 전등 기가 경 료 되 면 시효 취득 대항 하   없 다   
119114,대리 운전자 교통사고 사망 하   상속인 보험금 지급 되 자동차 종합 보험 가입 하 고자 하 보험 계약자 의사 보험 회사 영업소장 확인 하 지 않 아 보험 계약 자가 보험금 을 지급 받 지 못하 게 되   손해 어 보험 회사 사용자 책임 을 하 었 다   
119139,가처분 채권자 본안 을 하 지 않 고 방치 하 고 있 다면 가처분 을 유지 하   필요 없 사정 변경 생기 었 하   것 므로 취소 하 어야 하  다   
108685,산제 치성 목적 을 위하   마을 주민 결합체   도선 동동 민회 비 법인 사단 하  다고 보  다   
205306,원고 종 중이 스스로 부적 하   종중 회의 결의 원고 종중 결의 로서 유효 하   것 하 고 명의 신탁 계약 유효 고 주장 하 여 소유권 이전 등기 을 하 였 다면 명의 신탁 약정 효력 없 었 더   것 다   
205285,전소 항소심 계속 중 소 취하 서가 제출 되 었 음 을 전제 소 전소 확정 기판력 저촉 되  다고 보   직권 조사 사항   법리 오해 심리 미진 위법 있 다   
108671,부동산 매매 계약서 위조 되   것 며 계쟁 토지 여 소유권 이전 등기 하 어 주기 약정 사기   강박 의하   것 라고 하   당사 자본   신문 법리 오해 하   위법 있 다   
205294,매수인 매도인 공동 상속인 이나 상속인 상속 지분 을 구체적 알 기 어렵 다면 중도금 지급 기일 사망 하   매도인 을 피공 탁자 하여 변제 공탁 을 하   것   단 하  다   
108660,구 관습 의하 면 호주 사망 시 호주 상속인 적출   장남 을 원칙 하 고 상속 개시 사망 하     남 이하 자손 있 더라도 호주 상속 을 하   없 다   
205338,농지 개혁 법의 시행 등기부 소실 되 었 다가 소유자 명의 다시 보존 등기 되 었 더라도 명의 마치 어 진 보존 등기 원인 무효 등기 로서 말소 되 어야 하  다   
205334,계쟁 토지   매매 계약 체결 되   계쟁 토지   소유권 전등 기가 마 쳐지 었 으나 토지 매매 목적물     필지 포함 되 지 아니하   것 확실 하 다   
108584,국가 유공자 예우 등   법률 상의 전몰 군경 유자녀   유족 연금 사람 수입 생계 의존 하 어 오   가족   관계 있 어서 같 기능 을 수행 하  다   
119132,동일 토지 어 관계 공무원 착오   필지 토지 중복 적 환지 되   종전 토지 평수 보다 과다 하   평수 환지 되   것 지나 지 않 다   
108479,부동산 소유권 이전 등기 등   특별 조치법 의하 어 경 료 되   등기 실체적 권리 관계 부합 하 등기 추정 되  다   
119018,공유 수면 공동 매립 권   피고 원고 매립 조성 되   수필 지 토지에 대 하   일부 공유지 분만 을 소유 하 고 있 다면 원고   평 상당 하 지분 이전 등기 경 료 하   의무 있 다   
119053,부당 이득금 반환 원고 갑 부터 매매 원인 소유권 이전 등기 경 료 받 것 이례적   일 고 등기 경 료 갑 계속 소유권 자로 행세 하 었 다   
119027,변호사 과실 없 었 다면 결과 얻 어 지 었 더   것 보다 유리 하 게 끝나 었 을 것 되 의뢰인 얻 지 못하 게 되   경제적 이익 상당 손해 배상 의무 있 다   
119044,국유 재산법     국유 재산법     같 시행령   규정 의하   공고 하 고 토지   소유권 신고 없 었 다 하 더라도 토지 국유 재산 되 지 않 다   
108428,부동산 매도 용 인감 증명서 소지자 대물 변제 약정 주장 을 배척 하   심리 미진 이나 채 증 법칙 위배 위법 있 보   있 다   
108324,종중 종손 묘제 초헌관 허   잔 하 것 을 방해 하 행위 금지 하 어 닿  라 가처분 신청 어 이르   기각 하   있 다   
108351,부동산 소유권 이전 등기 등   특별 조치법 의하 어 소유권 보존 등 기가 경 료 되   토지 실체적 권리 관계 부합 하 등기 추정 받 다   
119056,내국 법인   피고 회사 노동력 값싸   인도네시아 국 생산 공장 을 건립 하 기 위하 어 현지 법인 을 공동 설립 하 여 주식   퍼센트 소유 하 고 있 다   
119024,은행 채무자 기존 채무 하 금원 을 신규 대출 하 여 즉 졸   채무 변제 충당 하 대환 형식적 신규 대출 하 나 실질적 변 연장 불과   
108207,등기 무자 재산 상속인 소유권 이전 등기 절차 이행 을 명하   있 어 상속분 을 특정 하 여 명시 하 지 아니하 였 위법 고 하   없 다   
108185,    항 소유 의사 추정 점유자 타인 소유권 을 배척 하 여 점유 하   의사 갖 지 않 았 더   것 보   사정 증명 되 었 을 깨어지 것 다   
108184,호적 내 있 지 않 여자   상속권 없 으며 서출 자녀 적출 자녀 반 을 상속 하 것 우리나라 관습 었 다   
228259,과정 본국 판례 나 해석 기준   자료 제출 되 지 않 아 내용 확인 불가능 하   으로서 일반적   해석 기준 따르 아 내용 을 확정 하   밖에 없 다   
108131,부동산 소유권 이전 등기 등   특별 조치법   의하 어 소유권 보존 등기 경 료 하   등기 실체적 권리 관계 부합 하 등기 추정 되  다   
108078,허위 보증서 의하 어 부동산 소유권 이전 등기 등   특별 조치법 따르 아 소유권 이전 등기 무효 라고 하   것 이나 종 중이 명의 신탁 을 해지 하 였 다면 소유권 이전 등기 실체 관계 부합 하 여 유효 하 다   
108054,세무서 장 한국 감정원 상속 재산 가액 감정 결과 잘못 되   것   을 알았 거나 알   있 었 다면 담당 공무원 직무 집행 하   당하 어 고의 과실 상속세 납세 고지 처분 을 하   으로써 손해 가하   것 되  다   
119037,아   유류분 보전 을 원인 재산 반환 상속인 전원 공동 당사자 되 어야 하 필요 적 공동 라고 보   없 다   
107992,원고 피 상속인 구 시행 당시 토지 매도 하 였 으나 매수인 명의 소유권 이전 등기 경 료 하 지 않 았 다면 부칙   규정 따르 아 매수인 소유권 을 상실 하 게 되  다   
107902,점유권 소유 의사 선의   평온 공연 하 게 점유 하   것 추정 되 며 점유권 원 되 지 않 는다고 하 어서 타 아 주점 유 라고 보   없 다   
118939,  적십자 사가 장차 수혈 사용 되   혈액 어 세균 감염 을 피하 기 위하 어 밀봉 하 여 각 병원 공급 하 고 혈액 을 공급 받 병원 역시   차 적인 세균 감염 위험 때문 곧바로 환자 수혈 하   밖에 없 다   
107707,감실 의하   회복 등기 등기부 기재 되 었 다면 등기 공무원 의하 어 적법 하 게 수리 되 고 처리 되   것 라고 일 응 추정 하   타당 하 며 전등 기의 접수 연월일 번호 란 불명 기재 되 어 있 다는 것 만 회복 등기 절차 하자 있 것 보   없 다   
107715,점유 있 어 소유 의사 유무 권원 의하 어 외형 적   객관적 정해지 어야 하 것 므로 매매 타인 토지 매매 로서 소유권 을 취득 하   없 어도 매수인 점유 소유 의사 로써 하 것 라고 해석 되  다   
107589,  규정 의하   협의 분할 이루어지   으로써 공동 상속인 중   고유 상속분 을 초과 하 재산 을 취득 하 게 되 었 지만 상속 재산 분할 상속 개시 되   소급 하 여 효력 있 다   
107604,제반 공부 멸실 되   토지   소유권 확인 을 구하 사건 있 어서 심리 미진 하   채 원고 당부 하 어 을 파기 하   등 있 다   
107623,  편 저   장 재산 상속   규정 있 는데 거기 열거 되 어 있 재산 상속인 존재 하 지 않   의하 어 상속 재산 국가 귀속 되  다고 보 아야 하  다   
107597,농지 개혁 사업 정리   특별 조치법   정부 취득 하   농지 어서 말   적용 되 며 같 시행 인하 어 당하 어 농 지가 수탁자 자경 지로 되   적용 되  다   
107580,임야 소유권 이전 등기 실체적 권리 관계 부합 하 등기 추정 되 며 보증서 확인 서 역시 승계 취득 사실 을 보증 내지 확인 하 것 다   
107583,토지 사정 명의 갑과 원고 아버지 을 동일인 라는 주장 부합 하 확정 민사 있 음에도 이르   배척 하   것 법리 오해 위법 있 하여 을 파기 하   있 다   
107487,부동산 소유권 이전 등기   특별 조치법 의하 여 경 료 되   소유권 전등 기의 추정 력 깨어지 었 보  다   
107492,원고 소유 토지 여 피고 소유권 을 다투 고 있 다면 원고 피고 을 상대 소유권 확인 을 소구 하   이익 있 다   
107463,부동산 소유권 이전 등기 등   특별 조치법 의하 여 경 료 되   소유권 보존 등기 나 소유권 이전 등기 실체적 권리 관계 부합 하 등기 추정 되  다   
107474,  저   호 의하 어 사후 양자 입적 되   날 이미 여호주   을 부터 상속 하   것 므로 상속인 동시 호주 상속 을 하 하 지 않 다   
107467,공동 상속인 사망 상속 지분 추가 상속 하 였 다는 원고 주장 여 을 유탈하 여 결과 영향 을 미치 었 하여 을 파기 하   있 다   
107368,채무자 소유 대지 건물   경매 절차 경락인 대지 건물 을 경락 받 으면서 별개 독립 되   건물 을 채무자 소유 건물 부합물 경락 받 았 하 더라도 소유권 을 취득 하   없 다   
118884,자동차 종합 보험 계약 자동차 특수 하   구조 장치 기동력 등 발생 하 위험 을 담보 하 것 므로 운전자 운전석 을 뒤 젖히 고 눕 어 있 다가 화재 사망 하 게 되 었 다면 피 보험 자동차 사고 하  다   
228707,  소정 긴급 필요 하   재산 목록 작성 완료 이전 피 후견인 재산 을 처분 하 지 않 으면 회복 하   없 손해 입 게 되   우려 있 하  다   
107151,구 당시 여호주 사망 하   호주 상속 을 하   사람 없 어 절 가가 되   유산 여 호 주의 태어나   출가 녀 승계 되  다는 것 구 관습 었 다   
228703,공동 상속인 중   피 상속인 부터 증여 받 특별 수익 유류 분산 정의 기초 되 재산 산입 되 고 유류 분 을 초과 하 범위 유류분 반환 대상 되  다   
106941,  상속 회복 소인   상속 회복 소 라고 보 아야 하  다   
106935,경험칙 합치 되 경험칙 합치 되 경험칙 합치 되 증언 을 합리적 이유 없이 배척 하   잘못 을 저지르 었 하여 을 파기 하   경험칙 합치 되 증언 을 합리적 이유 없이 배척 하   잘못 을 저지르 었 하 어서 을 파기 하   다   
106928,생명   신체 침해 인하   손해 배상 있 어서 재산 상의 손해 배상 위자료 소송물 동일 하 지 아니하   별개 므로 항소 하 지 아니하   당사자 저   심 보다 많 위자료 지급 을 명하   없 다   
106876,소유권 이전 등기 의무 면탈 하 기 위하 어 가장 매매 원인 하   토지 소유권 이전 등기 이루어지 었 하여 이르   원인 무효 등기 라고 보  다   
106883,부동산 을 매수 하 사람 매도인 부동산 을 처분 하   권한 있 조사 하 어야 하   것 므로 조사 하 지 않 고 수하 었 다면 부동산 점유 과실 있 었 보 아야 하  다   
106823,부동산 소유권 이전 등기 등기 등기 등기   특별 조치법 이나 일반 농지 소유권 이전 등기 등기   특별 조치법 의하 어 등기 적법 하 게 되   것 아니 라는 점 을 주장   입증 하 어야 하  다   
106824,피고 등 공동 상속인 간 상속 재산   사건 부동산 을 평 당 금   만 원 가격 매도 하 여도 좋 다는 양해 성립 되   사정 아래 상속인 중 피고 장남 명의 매매 계약 을 체결 하 장소 있 었 다면 장남 부동산 매매   대리권 을 수여 하 었 보 것 합리적 다   
106818,공장 매수인 체납 전기 요금 을 납부 하 지 않 으면 한국 전력 공사 부터 전기 공급 을 받 을 없 처지 있 었 하 더라도 체납 전기 요금 을 매수인 인수 하   을 조건 사건 공장 을 매수 하 었 다   
106795,권리 행 행사 권리 남용 하  다고 하   있 으려 면 객관적 권리 행사 사회 질서 위반 되  다고 보   있 어야 하  다   
165678,보험 회사 을 과실 비율 따르   구상 금 을 하 피고 갑 회사 합의 하여 상계 처리 하 였 주장 하 고 있 다   
106806,토지 조사부 등재 되 어 있 재결 인하 여 사정 내용 변경 되 었 다는 등 반증 없 토지 소유자 사정 받 고 사정 확정 되   것 추정 되  다   
106738,등기부 진실 하   소유자 소유권 방해 되 불실 등기 존재 하 등기 명의 허무 인인 등기 행위자 표상 하 허무   명의 등기 말소 구하   있 다   
106737,특별 하   사정 없 사실 부합 하 것 추정 되 어야 하 고 호적 취적 허가 의하 여 이루어지   것 라고 하여 달리 보   것 아니 다   
228567,조선 민 사령   의하 면 일본 중 친족   상속   규정 우리나라 적용 되 지 않 고 우리나라 관습 의하 도록 되 어 있 다   
106497,부동산 등기법   저   호 소정 부동산 등기법   저   호 소정 제소 전화 하 어 조서 포함 되  다고 하   있 다   
118794,수복 지역 내 소유자 미 복구 토지 부칙   적용 을 배제 하  다는 규정 없 고 같   계속 중인 부동산 여 을 적용 하 지 않 는다고 규정 하 고 있 다   
106427,민사 소송법   저   항   호 소정 재심사 유인 영향 을 미치   중요 하   사항 여 을 유탈하   라 함 영향 을 미치   중요 하   사항 여 당사자 공격 방어 주장 하 였 음에도 불구하 고 을 하 지 않 말하  다   
118758,토지 사용료 인근 토지 정 상거래 가격   분   이내 범위 추정 거래 가격 을 구하   다음 기대 이율 을 곱하   금액 필요 경비 더하 산정 하 어야 하  다   
147296,조선 민 사령   규정 의하 어 친족 상속 여 관습 의하 도록 되 어 있 었 으나 호주 아니   가족 사망 하   재산 직계 비속   자녀 균등 하 게 상속 되  다   
106357,공유자 공유자 사람 가족 을 데리 고 만주 이주 하 게 되 어 쉽사리 돌아오 기 어렵 었 을 것 라고 보 아야 하   경험 법칙 하 기 어렵 다   
106247,  저   항 기간 만료 되 면 등기 하   으로써 부동산 소유권 을 취득 하 게 되  다   
118797,자동차 종합 보험 기명 피보험 자가 보험 증권 학교 법인 소유 승용차 시동 열쇠 보관 하 고 업무 시간 이후 관리 하 어 오 았 고 대학 측 운행 일지 작성 하 여 결재 받 도록 하 었 다   
228645,조광권 자가 광업소   채굴권 기타 동산   일체 권리 임금 채무 등 을 타인 양도 하 기로 합의 하   합의 조광권 양도 계약 으로서 무효 다   
106170,임야 소유권 이전 등기 등   특별 조치법 의하 어 경 료 되   소유권 보존 등기 허위 위조 되   보증서 확인 서 의하 어 경 료 되 었 다 고 되 추정 복멸되  다고 보   있 다   
106163,사건 부동산 사정 받 당초 권리 자인 원고 선대 부터 소유자 변동 없 다면 시효 완성 주장 을 하   있 어서 증거 의하 여 시효 기간 경과 하   사실 만 확정 되 면 인용 하   있 다   
106166,허위 보증서 의하 여 등기 하 었 더라도 권리 실체 관계 부합 하 공정 증 서원 본부 실 기재 행 사죄 성립 하 지 않 다   
106058,상속인 부동산 등기부 시효 취득   부동산 소유자 등기 하   하  다고 하   것 다   
106050,  저   항 규정 내용 부동산 소유자 등기 되   기간 점유 기간 같이 하여   년 임 을 요하  다는 풀이 하 어야 하  다   
105976,임야 대장 상의 명의 변경 이전 지목 대지 변경 되   토지 어 임야 소유권 이전 등기 등   특별 조치법 따르   임야 대장 상의 명의 변 경과 소유권 보존 등 기가 경 료 되 었 다 고 하 었 다   
105926,수복 지역 내 소유자 미 복구 토지 복구 등록 보존 등기 등   특별 조치법 의하 어 소유자 복구 등록 신청 을 하   있 어서 보증서 추정 력 같 특별 하   증명력 부여 되  다고 풀이 하   없 다   
231203,  소정 유류분 반환 청구권   소멸 시효 기간 기산점 유류 분권 리 자가 유증 증여 행위 있 었 더   사실 을 알   라고 해석 하   타당 하 다   
105900,유리 하   자료 제출 하 기 위하 어 중 작성 되   증거 라 하여 배척 하   조치 채 증 법칙 위반 되  다고 보   다   
105787,등기 신청 적법 하   이상 등 기가 경 료 되   등기 명의 사망 하 었 다는 이유 만 등 기 무효 라고 하   없 다   
105713,원고 소유권 을 취득 하 게 되   경위 어 석명 하 지 않 고 증거 부족 하 배척 하   심리 미진 위법 있 다   
105637,토지 매수인 자신 분묘 단독 매수 하 여 조상 분묘 설치 하   달리 장손 단독 상속 시키 어 영구 보존 하 게 하   의사 었 봄 전통적 사고 부합 하  다   
105521,  저   항 이해 상반 행위 당사자 쌍방 모두 친권 복종 하 미성년 자일 여야 하 며 미 성년자 위하 여 특별 대리인 을 선임 하 어야 하  다   
105542,  규정 의하   협의 분할 이루어지 어 공동 상속인 중   고유 상속분 을 초과 하 재산 을 취득 하 게 되 었 더라도 피 상속인 부터 승계 받 것 보 아야 하  다   
118621,월북 작가 북한 지역 거주 하 면서 저작 하   저작물 라도 우리 저작권법 따르 아 보호 되 저작권 을 취득 하 였 고 사망 하   상속인 이르   상속 하   것 보 아야 하  다   
105432,군인 연금 법상 퇴역 연금 이나 유족 연금 동일 하   목적 성격 을 지니   급부 보   것 므로 동법   따르 아 동일 하   목적 성격 을 지니   급부 보   것 다   
118635,사건 적립 상해 보험 약관 상의 보험 사고 급격 하 고 우연 하   외래 사고 하 지 않 으며 적립 상해 보험 약관 상의 보험 사고   급격 하 고 우연 하   외래 사고 하 지 않 다   
105372,소유권 보존 등기 명의 인은 소유자 추정 받 으나 양도 사실 을 부인 하   추정 력 깨어지 것 므로 등기 명의 구체적 실체 관계 부합 하 거나 승계 취득 사실 을 입증 하 지 못하 면 등기 원인 무효 다   
105335,구 관습 호주 나 가족 사망 하 고 재산 상속인 없 최 근친자 유산 권리 귀속 되 고 근친자 출가 녀 포함 되  다   
118611,간기능 이상 있 환자 수술 을 위하   전신 마취 하   환자 간기능 급격히 악화 되 어 사망 하   우려 있 으므로 담당 의사 환자   전임 의사 작성 진료 일지 까지 면밀 하 게 검토 하 어야 하  다   
231413,의사 부터 제왕절개 수술 등 을 받 뒤 파상풍 균 감염 되 어 사망 하   환자 특별 하   사정 없 었 다면 사망 원인 되   파상풍 일반적   수술 의사 로서 갖추 어야 하   기본 적인 주의 의무 다하 지 않 의사 과실 기하 어 발생 하   것 추정 되  다   
118623,등록 전환 토지   임야 대장 잘못 되   기재 인하 어 등록 전환 토지 어 소유자 지정 하 지 아니하   채 환지 부여 되   종전 소유자 환지 처분 만 소유권 을 취득 하   없 다   
118612,피고 사무원 소외 을 화해 조서 정본 을 변조 하   뒤 토지 보상금 중 일부 횡령 하   따르 아 갑 위임 계약 상의 수임인 으로서 의무 게을리 하   것 을 원인 손해 배상 을 하 었 다   
204691,농지 개혁법     저     저     의하 면 국가 농 지수 분배 소유권 이전 등기 하 데 있 어 국가 명의 중간 등기 필요 없 다   
204710,농지 개혁법 헌법 의거 하 여 농지 농민 적절히 분배 하   으로써 농민 생활 향상 내지 국민 경제 균형 발전 을 목적 제정 되 었 다   
157132,취득 시효 완성 되   부동산 어 저   명의 아 등기 경 료 하   소유권 이전 등기 자체 불가능 하 지만 시효 취득자 이전 받 을 부동산 어 아 등기 부담 하 게 되   인하   손해 입 었 다   
228733,보험 약관 상의 보험금 지급 기준 교통사고 당사자 사이 의하 지 않 고 보상 금액 을 신속히 결정 하 기 위하   기준 불과 하 고 을 구속 하 지 못하  다   
105072,조선 총독 국유 삼림 대부 받 삼림 을 양여 하 행위 사경제 주체 로서 행하 사법 법률 행위 불과   
105005,재산 상속인 상속 개시 되   부터 피 상속인 재산   포괄적 권리 의무 승계 하 것 므로 재산 상속인 상속 개시 되   부터 피 상속인 재산   포괄적 권리 의무 승계 하  다   
105006,이미 확정 되   관련 있 민사 나 형사 사실 채용 하   없 특별 하   사정 나타나 지 않 유력 하   증거 자료 되  다   
105009,갑 시행 실종 신고 받 이상 실종 기간 만료 사망 간주 되   시점         
105002,우리나라 민사 항소심 구   저   심 을 취소 하   필요 없이 신 여만 저   심 으로서 을 하 게 되  다   
189217,명의 신탁 탁자 로서 말소 등기 청구권 을 포기 하 여 권리 처분 하 추인 권 을 행사 하   없 다   
228687,한국 해양 대학 기관 학과 졸업생   급 기관사 면허 시험 합격 하 여 오 았 다면 사고 당시 직종별 임금 실태 조사 보고서 선박 기관실 원 종사 하 남자 월평균 수입 을 기초 산정 하   있 다   
228691,서울특별시 설치 하 여 관리 하 고 있 배수 펌프장 중 사 고는 안전 시설 을 설치 하 지 않 배수 펌프장 방책 설치 설치 관리 상의 하자 발생 하 었 보 아야 하  다   
118517,공동 상속인 펴   선상 법인체 만들 어 상속 재산 을 법인 현물 출자 하   상속인 느   별개 법인격 체임 을 주장 하 것 신의칙 반하 여 허용 되 지 않 다   
228573,  소정 유류분 반환 청구권 유증 을 받 자가 취득 하   권리 유류 분 을 침해 하 한도 실효 되 어 유류 분 권리자 귀속 하  다고 봄 상당 하 다   
118536,공동 불법 행위자 중 사람 가집행 선고 부 따르 아 손해액 중 일부 변제 하 였 다 하 더라도 따르   강제 집행 을 모면 하 기 위하 어 지급 되   것 기 때문 공동 면책 되  다고 하   없 다   
104803,취득 시효 완성 인하   등기 하 기 먼저 소유권 이전 등기 경 료 하여 부동산 소유권 을 취득 하   저   여 시효 취득 을 주장 하   없 다   
118535,시소 속 재해 담당 공무원 으로서 산 정상 부터 산비탈 을 타 고 흘르 어 내리 물 을 다른 곳 흐르 게 하 수로 시설 을 설치 하 등 조치 취하 어야 하   주의 의무 있 다   
228655,중복 등기 로서 말소 되 어야 하   소유권 전등 기가 취득 시효 완성 적법 하   등기 전환 되  다고 하   없 다   
104751,  저   항 상속 회복 청구권 소멸   규정 상속 개시 일로 부터   년 을 경과 하   상속권 침해 있 었 하 더라도   년 제척 기간 경과 상속권 회복 청구권 소멸 하 었 보 아야 하  다   
118474,징발 재산 정리   특별 조치법   규정 환매 대금 선 지급 내지 현실 제공 환매권 행사 되   을 규정 하   것 다   
118470,생명 보험 계약 피 보험자 과거 질병 을 앓 적이 있 고 보험 계약 청약서 상의 질문 사항 여 아무런 해당사항 없다 고 기재 하 여 보험 계약 을 해지 하   것 계약 해지 로서 적법 하 다   
231317,철도청 부산시 매각 하 기 위하 여 철도 로서 용도 폐지 결정 하 고 궤도 철거 하 였 다 하 더라도 국가 붕괴 인하   사고 입 손해 배상 하   책임 있 다   
118459,부동산 등기법   말하 보존 등기 신청인 소유권 있음 을 실질적 증명 하 만 을 하 므로 갑 명의 소유권 보존 등기 부적 법하 다   
104519,등기 원인 무효 취소 원인 하   폐쇄 등기 부상 소유권 이전 등기 말소 등기 원인 무효 취소 원인 하   폐쇄 등기 부상 소유권 이전 등기 말소 기각 하 었 다   
